"10/3/23 12:17","University of California, Santa Barbara","California","Quantitative Population Ecology and Statistical Modeling","Cheryl Briggs","10/1/2023","https://recruit.ap.ucsb.edu/JPF02598","","","Match, partial","University of California-Santa Barbara","CA",110705,"Santa Barbara","R1 Doctoral Universities: Very High Research Activity","Arts & sciences focus, high graduate coexistence","Research Doctoral: Comprehensive programs, no medical/veterinary school","Four-year, full-time, more selective, higher transfer-in","High undergraduate","Four-year, large, primarily residential","Not Classified","Far West AK CA HI NV OR WA","Public, 4-year or above","Four or more years","Public",1,"Suburb Midsize","Yes","No","No","No","Yes","Yes","No","No","No","No",0,7063,570,298,0,0,7931,241523,12911,527,882,41,52,179,26,272,26,414,156,6374,689,0,0,26314,28096,26179,25562.333333,23196,2983,22480,686,0,30,2774,209,4813,34,2351,102,NA,NA,19,45,NA,2063,0.260119,52,80,37,0.711538,"Conferred research/scholarship doctoral degrees",0,0,1,18,17,9665,3957,1865,620,610,1230,28,25,25.96101,90961,33384,0.367014,3
"10/1/23 12:26","University of Alberta","Canada","Avian Ecology, Conservation Planning","Erin Bayne","10/15/2023","https://borealbirds.ca/impact-assessment-postdoctoral-fellow/","","","International",NA,NA,NA,NA,NA,NA,NA,NA,NA,NA,NA,NA,NA,NA,NA,NA,NA,NA,NA,NA,NA,NA,NA,NA,NA,NA,NA,NA,NA,NA,NA,NA,NA,NA,NA,NA,NA,NA,NA,NA,NA,NA,NA,NA,NA,NA,NA,NA,NA,NA,NA,NA,NA,NA,NA,NA,NA,NA,NA,NA,NA,NA,NA,NA,NA,NA,NA,NA,NA,NA,NA,NA,NA,NA,NA,NA,NA,NA,NA,NA,NA,NA,NA,NA,NA,NA,NA,NA,NA,NA,NA,NA,NA,NA,NA,NA
"9/30/23 18:29","University of Alaska-Fairbanks","Alaska","Freshwater ecology/water quality","Jeff Muehlbauer","11/1/2023","https://akriverecology.weebly.com/join.html#opportunities","10/22/23 14:32","1) Is Fall 2024 the expected start date for this position?","Match, partial","University of Alaska Fairbanks","AK",102614,"Fairbanks","R2 Doctoral Universities: High Research Activity","Balanced arts & sciences/professions, high graduate coexistence","Research Doctoral: Comprehensive programs, no medical/veterinary school","Four-year, higher part-time","High undergraduate","Four-year, medium, primarily nonresidential","Not Classified","Far West AK CA HI NV OR WA","Public, 4-year or above","Four or more years","Public",1,"Suburb Small","Yes","No","No","No",NA,"No","No","No","No","No",262,622,198,49,0,0,1131,150364,1935,48,258,6,1,38,4,40,4,88,110,287,335,268,145,7179,11413,6813,4126.333333,5850,963,2343,1916,56,1535,384,579,513,155,200,166,NA,NA,29,52,NA,159,0.140584,46,55,30,0.652174,"Conferred research/scholarship doctoral degrees",0,0,1,16,9,958,203,199,530,520,1050,18,20,19.00995,1361,912,0.670096,0
"9/29/23 5:59","Syracuse University","New York","Functional Morphology & Biomechanics","Austin Garner","","https://www.sujobopps.com/postings/100795","9/29/23 6:00","AP: this position is open until filled, so I wasn't sure what to put for the review data, and just clicked today's date","Match, exact","Syracuse University","NY",196413,"Syracuse","R1 Doctoral Universities: Very High Research Activity","Balanced arts & sciences/professions, high graduate coexistence","Research Doctoral: Comprehensive programs, no medical/veterinary school","Four-year, full-time, selective, lower transfer-in","Majority undergraduate","Four-year, large, highly residential","Not Classified","Mid East DE DC MD NJ NY PA","Private not-for-profit, 4-year or above","Four or more years","Private not-for-profit",1,"City Midsize","No","No","No","No",NA,"No","No","No","No","No",2,4565,2597,144,190,0,7498,77690,71962,74,1121,23,17,60,44,100,44,1145,1642,2063,2502,0,2,22850,38868,21322,19040.666667,14479,6843,13796,456,36,191,4068,2775,3486,13,233,30,NA,NA,29,52,NA,1313,0.175113,77,140,54,0.701299,"Conferred research/scholarship doctoral degrees",1,0,0,25,16,8001,0,0,0,0,0,0,0,0,32005,21994,0.687205,2
"9/28/23 12:12","Smithsonian Environmental Research Center","Maryland","3 positions: Oyster Reef Ecology, Ecology of Urban Estuaries, Marine Biodiversity Conservation","Matthew Ogburn","10/25/2023","https://serc.si.edu/get-involved/job-opportunities/interdisciplinary-postdoctoral-research-fellows","9/28/23 19:25","3 year Federal term positions (GS-09)","Unmatched",NA,NA,NA,NA,NA,NA,NA,NA,NA,NA,NA,NA,NA,NA,NA,NA,NA,NA,NA,NA,NA,NA,NA,NA,NA,NA,NA,NA,NA,NA,NA,NA,NA,NA,NA,NA,NA,NA,NA,NA,NA,NA,NA,NA,NA,NA,NA,NA,NA,NA,NA,NA,NA,NA,NA,NA,NA,NA,NA,NA,NA,NA,NA,NA,NA,NA,NA,NA,NA,NA,NA,NA,NA,NA,NA,NA,NA,NA,NA,NA,NA,NA,NA,NA,NA,NA,NA,NA,NA,NA,NA,NA,NA,NA,NA,NA
"9/27/23 17:36","Pepperdine University","California","population genetics/genomics and arthropod vector ecology","Javier Monzon","9/27/2023","https://apply.interfolio.com/133120","9/27/23 17:39","NIH-funded project to do population genomics and microbiome study of ticks expanding in geographic range.","Match, exact","Pepperdine University","CA",121150,"Malibu","Doctoral/Professional Universities","Balanced arts & sciences/professions, some graduate coexistence","Research Doctoral: Single program-Education","Four-year, full-time, more selective, lower transfer-in","Majority graduate","Four-year, medium, highly residential","Not Classified","Far West AK CA HI NV OR WA","Private not-for-profit, 4-year or above","Four or more years","Private not-for-profit",1,"Suburb Large","No","No","No","No",NA,"No","No","No","No","No",0,946,1487,66,167,0,2666,NA,NA,NA,NA,NA,NA,NA,NA,0,66,305,1349,485,461,0,0,8824,10579,9554,7136.666667,3459,6095,3131,326,1,1,2796,3299,726,7,89,46,NA,NA,20,52,NA,945,0.354464,41,30,6,0.146341,"Conferred research/scholarship doctoral degrees",1,0,0,11,1,2585,510,280,600,600,1200,26,25,25.35443,11768,4925,0.418508,3
"9/26/23 21:59","San Francisco State University","California","Genomics, Phylogenetics, Bioinformatics, Pop Gen, Museomics","Jaime Chaves","10/26/2023","https://jaimechaves.weebly.com/","9/27/23 9:56","Join the GalapaGenomes at SFSU and California Academy of Sciences. For more details here https://jaimechaves.weebly.com/uploads/6/3/9/7/63971367/postdoc_hire_add.pdf (1) is the salary 58k or 58k+41k? I'd love to apply, but there's no way one can live in SF on 58k...","Match, exact","San Francisco State University","CA",122597,"San Francisco","R2 Doctoral Universities: High Research Activity","Balanced arts & sciences/professions, high graduate coexistence","Research Doctoral: Single program-Education","Four-year, full-time, inclusive, higher transfer-in","High undergraduate","Four-year, large, primarily nonresidential","Classified","Far West AK CA HI NV OR WA","Public, 4-year or above","Four or more years","Public",1,"City Large","No","No","No","No",NA,"No","No","No","No","No",0,6455,912,22,33,0,7422,30779,2299,21,709,0,0,0,22,0,22,394,551,3143,3312,0,0,29032,32541,27349,23795.666667,24024,3325,19806,3605,41,572,2172,1153,2617,162,2560,456,NA,NA,24,52,NA,1681,0.226489,63,60,39,0.619048,"Conferred research/scholarship doctoral degrees",1,0,0,22,1,4416,2467,537,470,460,930,16,17,16.821238,31430,26431,0.840948,1
"9/26/23 10:37","University of California Santa Cruz","California","Population modeling","Malin Pinsky","7/24/2023","https://globalchange.sites.ucsc.edu/2023/07/16/were-hiring-a-postdoc-2/","10/1/23 21:39","Still open as of 10/1/2023","Match, partial","University of California-Santa Cruz","CA",110714,"Santa Cruz","R1 Doctoral Universities: Very High Research Activity","Arts & sciences focus, high graduate coexistence","Research Doctoral: STEM-dominant","Four-year, full-time, more selective, higher transfer-in","High undergraduate","Four-year, large, highly residential","Not Classified","Far West AK CA HI NV OR WA","Public, 4-year or above","Four or more years","Public",1,"City Small","Yes","No","No","No","Yes","Yes","No","No","No","No",0,5460,347,152,0,0,5959,146771,3629,332,565,16,28,108,0,151,0,259,88,4399,1061,0,0,19494,20861,19161,18660.333333,17207,1954,16521,686,0,0,1889,65,4158,36,1606,53,NA,NA,20,26,NA,894,0.150025,46,69,27,0.586957,"Conferred research/scholarship doctoral degrees",0,0,1,15,14,9291,3726,1348,580,580,1160,25,24,24.265668,54988,35591,0.64725,3
"9/22/23 13:22","University of California - Los Angeles","California","California Conservation Science","H. Bradley Shaffer","11/26/2023","https://www.ioes.ucla.edu/jobs/postdoctoral-fellowship-with-the-la-kretz-center-for-california-conservation-science/","9/22/23 13:24","The 2024 UCLA La Kretz Center Postdoctoral Fellowship in California Conservation Science is now accepting applications.The deadline to submit is November 26th, 2023","Match, partial","University of California-Los Angeles","CA",110662,"Los Angeles","R1 Doctoral Universities: Very High Research Activity","Arts & sciences focus, high graduate coexistence","Research Doctoral: Comprehensive programs, with medical/veterinary school","Four-year, full-time, more selective, higher transfer-in","Majority undergraduate","Four-year, large, highly residential","Classified","Far West AK CA HI NV OR WA","Public, 4-year or above","Four or more years","Public",1,"City Large","Yes","Yes","No","No",NA,"No","No","No","No","No",0,10006,3271,676,569,0,14522,1338707,54234,1498,3481,96,97,365,118,556,117,2075,1765,9100,906,0,0,44371,46947,44589,43489,31636,12953,31068,568,0,0,11871,1082,6378,8,3743,44,NA,NA,24,45,NA,2910,0.200386,71,166,53,0.746479,"Conferred research/scholarship doctoral degrees",0,0,1,20,21,19093,0,0,0,0,0,0,0,0,108870,15602,0.1433085,3
"9/21/23 15:56","USDA ARS","Mississippi","Entomology - post doc to work on the molecular side of pathogen infection in invasive ants","Michael Grodowitz (michael.grodowitz@usda.gov)","","n/a","9/21/23 15:59","No URL - Open until filled. USDA ARS in Stoneville, MS. If interested email Michael Grodowitz at michael.grodowitz@usda.gov. US Citizens only, GS11 ($69,107 FY23). Project to be focused on molecular side of pathogen infection in invasive ants.  ","Unmatched",NA,NA,NA,NA,NA,NA,NA,NA,NA,NA,NA,NA,NA,NA,NA,NA,NA,NA,NA,NA,NA,NA,NA,NA,NA,NA,NA,NA,NA,NA,NA,NA,NA,NA,NA,NA,NA,NA,NA,NA,NA,NA,NA,NA,NA,NA,NA,NA,NA,NA,NA,NA,NA,NA,NA,NA,NA,NA,NA,NA,NA,NA,NA,NA,NA,NA,NA,NA,NA,NA,NA,NA,NA,NA,NA,NA,NA,NA,NA,NA,NA,NA,NA,NA,NA,NA,NA,NA,NA,NA,NA,NA,NA,NA,NA,NA
"9/20/23 12:34","USC","California","Statistical and Population Genetics","Arun Durvasula","","https://sites.usc.edu/durvasula/2023/09/20/postdoctoral-researcher-position/","","","Match, by alias","University of Southern California","CA",123961,"Los Angeles","R1 Doctoral Universities: Very High Research Activity","Balanced arts & sciences/professions, high graduate coexistence","Research Doctoral: Comprehensive programs, with medical/veterinary school","Four-year, full-time, more selective, higher transfer-in","Majority graduate","Four-year, large, primarily residential","Not Classified","Far West AK CA HI NV OR WA","Private not-for-profit, 4-year or above","Four or more years","Private not-for-profit",1,"City Large","No","Yes","No","No",NA,"No","No","No","No","No",0,5447,9751,786,898,158,17040,899507,41691,635,2232,24,80,312,370,416,370,4233,6574,2833,2614,0,0,48321,52376,46287,41167,19786,26501,18560,961,0,265,20047,6454,3436,23,1411,36,NA,NA,26,52,NA,2929,0.17189,79,228,61,0.772152,"Conferred research/scholarship doctoral degrees",1,0,0,23,20,8700,2292,1427,660,680,1340,30,28,28.767411,59712,9618,0.161073,3
"9/20/23 10:18","State University of Campinas","South America","Molecular Ecology, eDNA, Ecological Network","Gustavo Q. Romero","10/20/2023","https://gqromero.wixsite.com/lab/opportunities","","","International",NA,NA,NA,NA,NA,NA,NA,NA,NA,NA,NA,NA,NA,NA,NA,NA,NA,NA,NA,NA,NA,NA,NA,NA,NA,NA,NA,NA,NA,NA,NA,NA,NA,NA,NA,NA,NA,NA,NA,NA,NA,NA,NA,NA,NA,NA,NA,NA,NA,NA,NA,NA,NA,NA,NA,NA,NA,NA,NA,NA,NA,NA,NA,NA,NA,NA,NA,NA,NA,NA,NA,NA,NA,NA,NA,NA,NA,NA,NA,NA,NA,NA,NA,NA,NA,NA,NA,NA,NA,NA,NA,NA,NA,NA,NA,NA
"9/20/23 9:03","GFZ German Research Centre for Geosciences","Germany","Data Science and Global Land Monitoring","","10/15/2023","https://www.gfz-potsdam.de/en/career/job-offers/details/8370","9/20/23 9:04","Fixed-term: 4,5 years","International",NA,NA,NA,NA,NA,NA,NA,NA,NA,NA,NA,NA,NA,NA,NA,NA,NA,NA,NA,NA,NA,NA,NA,NA,NA,NA,NA,NA,NA,NA,NA,NA,NA,NA,NA,NA,NA,NA,NA,NA,NA,NA,NA,NA,NA,NA,NA,NA,NA,NA,NA,NA,NA,NA,NA,NA,NA,NA,NA,NA,NA,NA,NA,NA,NA,NA,NA,NA,NA,NA,NA,NA,NA,NA,NA,NA,NA,NA,NA,NA,NA,NA,NA,NA,NA,NA,NA,NA,NA,NA,NA,NA,NA,NA,NA,NA
"9/19/23 11:40","Mississippi State University","Mississippi","Forest Health","John J. Riggins","9/19/2023","https://forestentomology.org.msstate.edu/index.html#jobs","9/25/23 7:04","Open until filled. (still unfilled as of 9/25/23)","Match, exact","Mississippi State University","MS",176080,"Mississippi State","R1 Doctoral Universities: Very High Research Activity","Professions plus arts & sciences, high graduate coexistence","Research Doctoral: Comprehensive programs, with medical/veterinary school","Four-year, full-time, selective, higher transfer-in","High undergraduate","Four-year, large, primarily residential","Classified","Southeast AL AR FL GA KY LA MS NC SC TN VA WV","Public, 4-year or above","Four or more years","Public",1,"Town Remote","Yes","Yes","No","No",NA,"No","No","No","No","No",0,4175,794,160,87,0,5216,264367,16118,63,745,9,4,114,33,127,33,511,370,1461,2714,0,0,22226,24449,22986,20380.666667,18803,4183,17057,1667,32,47,1989,2194,3202,21,1803,203,NA,NA,26,52,NA,993,0.190376,66,82,36,0.545455,"Conferred research/scholarship doctoral degrees",0,0,1,19,13,5333,205,3003,520,530,1050,22,20,21.872195,16127,12908,0.800397,2
"9/19/23 6:11","Bigelow Laboratory for Ocean Sciences","Maine","Environmental Chemistry","Christoph Aeppli","10/15/2023","https://bigelow.freshteam.com/jobs/uPudksYiHX_7/postdoctoral-research-scientist-in-environmental-chemistry","","","Unmatched",NA,NA,NA,NA,NA,NA,NA,NA,NA,NA,NA,NA,NA,NA,NA,NA,NA,NA,NA,NA,NA,NA,NA,NA,NA,NA,NA,NA,NA,NA,NA,NA,NA,NA,NA,NA,NA,NA,NA,NA,NA,NA,NA,NA,NA,NA,NA,NA,NA,NA,NA,NA,NA,NA,NA,NA,NA,NA,NA,NA,NA,NA,NA,NA,NA,NA,NA,NA,NA,NA,NA,NA,NA,NA,NA,NA,NA,NA,NA,NA,NA,NA,NA,NA,NA,NA,NA,NA,NA,NA,NA,NA,NA,NA,NA,NA
"9/18/23 7:53","Auburn University","Alabama","Wetland Remote Sensing","Zutao Yang","11/1/2023","https://wordpress.auburn.edu/emo/opportunities/","","","Match, exact","Auburn University","AL",100858,"Auburn","R1 Doctoral Universities: Very High Research Activity","Professions plus arts & sciences, high graduate coexistence","Research Doctoral: Comprehensive programs, with medical/veterinary school","Four-year, full-time, more selective, lower transfer-in","High undergraduate","Four-year, large, primarily nonresidential","Classified","Southeast AL AR FL GA KY LA MS NC SC TN VA WV","Public, 4-year or above","Four or more years","Public",1,"City Small","Yes","Yes","No","No",NA,"No","No","No","No","No",0,5668,1310,269,269,0,7516,221503,33778,120,1169,4,7,165,93,176,93,659,920,1688,3980,0,0,30460,32840,30737,27476.333333,24505,6232,22408,1960,50,87,3388,2844,4869,45,898,122,NA,NA,26,52,NA,1709,0.227382,80,104,43,0.5375,"Conferred research/scholarship doctoral degrees",0,0,1,22,15,4823,841,4062,590,570,1160,25,24,24.828472,17946,15266,0.850663,3
"9/12/23 11:50","University of California, Santa Cruz","California","Spatial Ecology/Conservation Ecology/Connectivity modelling","Natalia Ocampo-Peñuela","10/31/2023","https://drive.google.com/file/d/1z-c2dNp_HCTc6wWeDS0I7FMedF1Wysma/view?usp=sharing","","","Match, partial","University of California-Santa Cruz","CA",110714,"Santa Cruz","R1 Doctoral Universities: Very High Research Activity","Arts & sciences focus, high graduate coexistence","Research Doctoral: STEM-dominant","Four-year, full-time, more selective, higher transfer-in","High undergraduate","Four-year, large, highly residential","Not Classified","Far West AK CA HI NV OR WA","Public, 4-year or above","Four or more years","Public",1,"City Small","Yes","No","No","No","Yes","Yes","No","No","No","No",0,5460,347,152,0,0,5959,146771,3629,332,565,16,28,108,0,151,0,259,88,4399,1061,0,0,19494,20861,19161,18660.333333,17207,1954,16521,686,0,0,1889,65,4158,36,1606,53,NA,NA,20,26,NA,894,0.150025,46,69,27,0.586957,"Conferred research/scholarship doctoral degrees",0,0,1,15,14,9291,3726,1348,580,580,1160,25,24,24.265668,54988,35591,0.64725,3
"9/11/23 14:26","Georgia Tech","Georgia","theoretical ecology and evolution","Sam Brown and Rachel Kuske","9/18/2023","https://brownlab.biology.gatech.edu/opportunities/","","","Match, by alias","Georgia Institute of Technology-Main Campus","GA",139755,"Atlanta","R1 Doctoral Universities: Very High Research Activity","Professions plus arts & sciences, high graduate coexistence","Research Doctoral: Comprehensive programs, no medical/veterinary school","Four-year, full-time, more selective, higher transfer-in","Majority undergraduate","Four-year, large, highly residential","Not Classified","Southeast AL AR FL GA KY LA MS NC SC TN VA WV","Public, 4-year or above","Four or more years","Public",1,"City Large","No","No","No","No",NA,"No","No","No","No","No",0,3934,4073,527,0,0,8534,1017808,31180,597,839,3,2,492,30,497,30,3262,811,1173,2761,0,0,36302,43217,39771,27189,16561,23210,14476,1267,9,809,6413,16797,3234,26,834,33,NA,NA,17,14,NA,3738,0.438013,33,78,26,0.787879,"Conferred research/scholarship doctoral degrees",0,0,1,16,13,8796,2321,1648,670,700,1370,31,29,29.830436,40852,8719,0.213429,3
"9/11/23 8:09","Auburn University","Alabama","Forest and fire ecology","Heather Alexander","9/11/2023","https://forestfireecology.auburn.edu/opportunities/","9/11/23 8:15","Open until filled; Part of a US Forest Service grant to help understand the carbon and flammability consequences of forest restoration using prescribed fire; highly collaborative research","Match, exact","Auburn University","AL",100858,"Auburn","R1 Doctoral Universities: Very High Research Activity","Professions plus arts & sciences, high graduate coexistence","Research Doctoral: Comprehensive programs, with medical/veterinary school","Four-year, full-time, more selective, lower transfer-in","High undergraduate","Four-year, large, primarily nonresidential","Classified","Southeast AL AR FL GA KY LA MS NC SC TN VA WV","Public, 4-year or above","Four or more years","Public",1,"City Small","Yes","Yes","No","No",NA,"No","No","No","No","No",0,5668,1310,269,269,0,7516,221503,33778,120,1169,4,7,165,93,176,93,659,920,1688,3980,0,0,30460,32840,30737,27476.333333,24505,6232,22408,1960,50,87,3388,2844,4869,45,898,122,NA,NA,26,52,NA,1709,0.227382,80,104,43,0.5375,"Conferred research/scholarship doctoral degrees",0,0,1,22,15,4823,841,4062,590,570,1160,25,24,24.828472,17946,15266,0.850663,3
"9/9/23 0:45","Gloucester Marine Genomics Institute","Massachusetts","Marine genomics","","11/30/2023","https://gmgi.bamboohr.com/careers/43","","","Unmatched",NA,NA,NA,NA,NA,NA,NA,NA,NA,NA,NA,NA,NA,NA,NA,NA,NA,NA,NA,NA,NA,NA,NA,NA,NA,NA,NA,NA,NA,NA,NA,NA,NA,NA,NA,NA,NA,NA,NA,NA,NA,NA,NA,NA,NA,NA,NA,NA,NA,NA,NA,NA,NA,NA,NA,NA,NA,NA,NA,NA,NA,NA,NA,NA,NA,NA,NA,NA,NA,NA,NA,NA,NA,NA,NA,NA,NA,NA,NA,NA,NA,NA,NA,NA,NA,NA,NA,NA,NA,NA,NA,NA,NA,NA,NA,NA
"9/8/23 11:40","Stanford University","California","Climate change and genomics of ectomycorrhizal fungi","Kabir Peay","","https://twitter.com/mykophile/status/1699926342631092405","","","Match, exact","Stanford University","CA",243744,"Stanford","R1 Doctoral Universities: Very High Research Activity","Arts & sciences plus professions, high graduate coexistence","Research Doctoral: Comprehensive programs, with medical/veterinary school","Four-year, full-time, more selective, lower transfer-in","Majority graduate","Four-year, large, highly residential","Not Classified","Far West AK CA HI NV OR WA","Private not-for-profit, 4-year or above","Four or more years","Private not-for-profit",1,"Suburb Large","No","Yes","No","No",NA,"No","No","No","No","No",0,1771,2372,770,274,0,5187,1159809,44141,3640,2106,48,66,619,37,733,37,2041,605,1389,382,0,0,17249,20961,15953,14795.666667,6366,9587,5752,614,0,0,8465,1122,1606,0,67,0,NA,NA,23,14,NA,1215,0.234239,49,129,40,0.816327,"Conferred research/scholarship doctoral degrees",0,0,1,23,20,14717,1156,725,700,720,1420,31,31,31,45227,2349,0.051938,3
"9/7/23 8:21","University of Tennessee - NIMBioS","Tennessee","mathematical and computational modeling","Nina Fefferman","9/15/2023","https://ut.taleo.net/careersection/ut_system/jobdetail.ftl?job=23000001T1&tz=GMT-04%3A00&tzname=America%2FNew_York","9/7/23 8:23","epidemiological risk in wildlife trade networks, focusing on network and game theoretic models -- open until filled, potential for fully remote work","Match, by alias","The University of Tennessee-Knoxville","TN",221759,"Knoxville","R1 Doctoral Universities: Very High Research Activity","Professions plus arts & sciences, high graduate coexistence","Research Doctoral: Comprehensive programs, with medical/veterinary school","Four-year, full-time, more selective, higher transfer-in","High undergraduate","Four-year, large, primarily residential","Classified","Southeast AL AR FL GA KY LA MS NC SC TN VA WV","Public, 4-year or above","Four or more years","Public",1,"City Midsize","Yes","Yes","No","No",NA,"No","No","No","Yes","No",0,5293,1626,439,197,0,7555,292314,28093,198,1269,46,24,257,112,327,112,637,1186,1890,3403,0,0,29460,32056,30559,28007,24254,6305,22896,1250,18,90,3817,2488,5489,23,1348,131,NA,NA,26,52,NA,1665,0.220384,71,129,52,0.732394,"Conferred research/scholarship doctoral degrees",0,0,1,25,21,7714,1328,4722,580,560,1140,25,23,24.560992,25423,19867,0.781458,3
"9/7/23 1:10","University of Bern","Switzerland","Ecological synthesis","Markus Fischer","10/15/2023","https://ohws.prospective.ch/public/v1/jobs/106707ce-08d0-490c-99e1-ba6571a836f1","10/3/23 6:24","postdoc or data scientist part-time at 60 - 80% Updated link: https://ohws.prospective.ch/public/v1/jobs/12743982-1bbc-4488-b11e-137a80ef8d65","International",NA,NA,NA,NA,NA,NA,NA,NA,NA,NA,NA,NA,NA,NA,NA,NA,NA,NA,NA,NA,NA,NA,NA,NA,NA,NA,NA,NA,NA,NA,NA,NA,NA,NA,NA,NA,NA,NA,NA,NA,NA,NA,NA,NA,NA,NA,NA,NA,NA,NA,NA,NA,NA,NA,NA,NA,NA,NA,NA,NA,NA,NA,NA,NA,NA,NA,NA,NA,NA,NA,NA,NA,NA,NA,NA,NA,NA,NA,NA,NA,NA,NA,NA,NA,NA,NA,NA,NA,NA,NA,NA,NA,NA,NA,NA,NA
"9/7/23 1:08","University of Bern","Switzerland","Social-ecological synthesis","Markus Fischer","10/15/2023","https://ohws.prospective.ch/public/v1/jobs/ceec4300-ddf0-4c3e-975a-f89db26c3ba1","10/3/23 6:24","possibility of working 80 to 100% of time UPdated link: https://ohws.prospective.ch/public/v1/jobs/4481c632-36c0-411a-a4c1-bbbe0b2c5dc2","International",NA,NA,NA,NA,NA,NA,NA,NA,NA,NA,NA,NA,NA,NA,NA,NA,NA,NA,NA,NA,NA,NA,NA,NA,NA,NA,NA,NA,NA,NA,NA,NA,NA,NA,NA,NA,NA,NA,NA,NA,NA,NA,NA,NA,NA,NA,NA,NA,NA,NA,NA,NA,NA,NA,NA,NA,NA,NA,NA,NA,NA,NA,NA,NA,NA,NA,NA,NA,NA,NA,NA,NA,NA,NA,NA,NA,NA,NA,NA,NA,NA,NA,NA,NA,NA,NA,NA,NA,NA,NA,NA,NA,NA,NA,NA,NA
"9/6/23 1:28","National Tropical Botanical Garden","Hawaii","Systematics and evolution of Hawaiian plant radiations","Ken Wood and Warren Wagner","9/11/2023","https://ntbg.org/about/jobs/","9/16/23 10:33","Open until filled. Part of a collaborative NSF project between NTBG (Ken Wood), Smithsonian (Warren Wagner), UCLA (Felipe Zapata) and WUSTL (Michael Landis). 2) as of september 16th, this position is still accepting applications, maybe for another two weeks max  ","Unmatched",NA,NA,NA,NA,NA,NA,NA,NA,NA,NA,NA,NA,NA,NA,NA,NA,NA,NA,NA,NA,NA,NA,NA,NA,NA,NA,NA,NA,NA,NA,NA,NA,NA,NA,NA,NA,NA,NA,NA,NA,NA,NA,NA,NA,NA,NA,NA,NA,NA,NA,NA,NA,NA,NA,NA,NA,NA,NA,NA,NA,NA,NA,NA,NA,NA,NA,NA,NA,NA,NA,NA,NA,NA,NA,NA,NA,NA,NA,NA,NA,NA,NA,NA,NA,NA,NA,NA,NA,NA,NA,NA,NA,NA,NA,NA,NA
"9/5/23 16:36","U of Arizona","Arizona","Forest Carbon and Demography","Margaret Evans","10/16/2023","https://arizona.csod.com/ux/ats/careersite/4/home/requisition/16842?c=arizona","9/5/23 16:37","Open until filled, thoughful mentor. ","Match, by alias","University of Arizona","AZ",104179,"Tucson","R1 Doctoral Universities: Very High Research Activity","Balanced arts & sciences/professions, high graduate coexistence","Research Doctoral: Comprehensive programs, with medical/veterinary school","Four-year, full-time, selective, higher transfer-in","High undergraduate","Four-year, large, primarily nonresidential","Not Classified","Southwest AZ NM OK TX","Public, 4-year or above","Four or more years","Public",1,"City Large","Yes","Yes","No","No",NA,"No","No","No","No","No",0,7871,2021,435,516,0,10843,743233,17742,947,1805,52,60,231,92,343,92,894,1643,4166,3705,0,0,44577,49966,45601,38188.333333,35357,10244,28539,6120,17,681,5926,4318,5374,1960,1659,988,NA,NA,29,52,NA,1512,0.139445,100,203,71,0.71,"Conferred research/scholarship doctoral degrees",0,0,1,27,21,6581,3380,3600,550,540,1090,21,21,21,43540,37064,0.851263,2
"9/3/23 15:50","USDA-ARS","Maryland","Fungal Systematics & Taxonomy","Catalina Salgado-Salazar","9/30/2023","https://view.officeapps.live.com/op/view.aspx?src=https%3A%2F%2Fmsafungi.org%2Fwp-content%2Fuploads%2F2023%2F08%2FPostdoc-AD-Mycos-USDA-mredit.docx&wdOrigin=BROWSELINK","9/3/23 15:50","Very good mentor.","Unmatched",NA,NA,NA,NA,NA,NA,NA,NA,NA,NA,NA,NA,NA,NA,NA,NA,NA,NA,NA,NA,NA,NA,NA,NA,NA,NA,NA,NA,NA,NA,NA,NA,NA,NA,NA,NA,NA,NA,NA,NA,NA,NA,NA,NA,NA,NA,NA,NA,NA,NA,NA,NA,NA,NA,NA,NA,NA,NA,NA,NA,NA,NA,NA,NA,NA,NA,NA,NA,NA,NA,NA,NA,NA,NA,NA,NA,NA,NA,NA,NA,NA,NA,NA,NA,NA,NA,NA,NA,NA,NA,NA,NA,NA,NA,NA,NA
