"10/8/24 15:18","Utah State University","Utah","Water Quality","11/1/2024","https://careers-usu.icims.com/jobs/8445/assistant-professor-in-water-quality/job?mobile=false&width=1290&height=500&bga=true&needsRedirect=false&jan1offset=-420&jun1offset=-360","Asst Prof","Tenure Stream","10/24/24 2:55","1) SC member here: This position has opportunities for integrating ecological components of water quality (e.g., biogeochem, harmful algal blooms, etc.). 2) Everyone, see previous comments about conservative/mormon culture in Logan. 3) could you please introduce more things about mormon culture in Logan>??  4) tldr: if you have or want children, and you aren't mormon, you risk them being somewhat socially isolated, especially as kids get older and get more involved in the church. Adults will almost certainly be fine, socially. 5) From the advertisement, I got the feeling this search is targeted at an internal candidate, instead of normal open search..... Am I right???? Does anyone know the real situation??? 6) speculation about internal hire - drink!  7) what does it mean??@6, is it really an internal hire position???? 8) No, they mean that you're speculating without any real evidence. It's very common here and elsewhere. 9) As someone more familiar with USU folks, not an internal hire, but certain a few key Water Quality faculty are nearing retirement age or have transitioned into admin positions, so likely trying to fill those vacant roles (so internal hire speculations are unwarrented)","","Match, exact","Utah State University","UT",230728,"Logan","R1 Doctoral Universities: Very High Research Activity","Balanced arts & sciences/professions, high graduate coexistence","Research Doctoral: Comprehensive programs, with medical/veterinary school","Four-year, full-time, selective, higher transfer-in","Very high undergraduate","Four-year, large, primarily nonresidential","Classified","Rocky Mountains CO ID MT UT WY","Public, 4-year or above","Four or more years","Public",1,"City Small","Yes","Yes","No","No",NA,"No","No","No","No","No",1209,4411,837,96,7,0,6560,300894,3362,178,874,14,2,46,34,62,34,331,513,1840,2571,238,1045,27810,33055,27691,21369,24647,3044,17002,4085,115,3445,1091,1953,4192,355,984,326,NA,NA,33,24,NA,1085,0.165396,80,92,44,0.55,"Conferred research/scholarship doctoral degrees",1,0,0,19,13,3095,785,4065,550,530,1080,21,21,21,15949,14520,0.910402,2
"10/8/24 9:28","Georgia Institute of Technology","Georgia","Sustainability: Brook Byers Institute for Sustainable Systems","11/19/2024","buff.ly/3Ngonr9","Executive Director","Tenure Stream or Other, as relevant","","","","Match, by alias","Georgia Institute of Technology-Main Campus","GA",139755,"Atlanta","R1 Doctoral Universities: Very High Research Activity","Professions plus arts & sciences, high graduate coexistence","Research Doctoral: Comprehensive programs, no medical/veterinary school","Four-year, full-time, more selective, higher transfer-in","Majority undergraduate","Four-year, large, highly residential","Not Classified","Southeast AL AR FL GA KY LA MS NC SC TN VA WV","Public, 4-year or above","Four or more years","Public",1,"City Large","No","No","No","No",NA,"No","No","No","No","No",0,3934,4073,527,0,0,8534,1017808,31180,597,839,3,2,492,30,497,30,3262,811,1173,2761,0,0,36302,43217,39771,27189,16561,23210,14476,1267,9,809,6413,16797,3234,26,834,33,NA,NA,17,14,NA,3738,0.438013,33,78,26,0.787879,"Conferred research/scholarship doctoral degrees",0,0,1,16,13,8796,2321,1648,670,700,1370,31,29,29.830436,40852,8719,0.213429,3
"10/8/24 6:27","Justus Liebig University Giessen (JLU)","Germany","Biological Modelling","10/17/2024","https://www.uni-giessen.de/de/ueber-uns/karriere/stellenangebote/professuren/8-13-24-e","Assoc Prof","Tenure Stream","","","","International",NA,NA,NA,NA,NA,NA,NA,NA,NA,NA,NA,NA,NA,NA,NA,NA,NA,NA,NA,NA,NA,NA,NA,NA,NA,NA,NA,NA,NA,NA,NA,NA,NA,NA,NA,NA,NA,NA,NA,NA,NA,NA,NA,NA,NA,NA,NA,NA,NA,NA,NA,NA,NA,NA,NA,NA,NA,NA,NA,NA,NA,NA,NA,NA,NA,NA,NA,NA,NA,NA,NA,NA,NA,NA,NA,NA,NA,NA,NA,NA,NA,NA,NA,NA,NA,NA,NA,NA,NA,NA,NA,NA,NA,NA,NA,NA
"10/8/24 4:18","University of Maryland, Baltimore County","Maryland","Coastal Sciences","11/1/2024","http://apply.interfolio.com/156317","Asst Prof","Tenure Stream","10/17/24 8:13","1) Does anyone have any insight as to campus/dept culture here? SC Member here - been at UMBC and in Dept for >20y. A most collegial place, within the Dept and without. Very diverse campus, and campus climate reflects those values. Family friendly. One would be hard pressed to find a friendlier place to work. Just moved to R1 status (one of 3 in Maryland; with Hopkins and College Park). @SC - Thank you!","4","Match, partial","University of Maryland-Baltimore County","MD",163268,"Baltimore","R1 Doctoral Universities: Very High Research Activity","Arts & sciences plus professions, some graduate coexistence","Research Doctoral: Comprehensive programs, no medical/veterinary school","Four-year, full-time, more selective, higher transfer-in","High undergraduate","Four-year, large, primarily residential","Classified","Mid East DE DC MD NJ NY PA","Public, 4-year or above","Four or more years","Public",1,"Suburb Large","No","No","No","No",NA,"No","No","No","Yes","No",0,2708,624,87,0,0,3419,79669,4198,185,434,9,7,57,14,73,14,501,123,2078,630,0,20,13602,15403,13497,11456.333333,10932,2565,9216,1622,4,90,1216,1349,1652,23,816,169,NA,NA,22,11,NA,810,0.236911,40,53,17,0.425,"Conferred research/scholarship doctoral degrees",0,0,1,16,10,4022,1557,257,580,570,1150,24,23,23.141676,11459,7962,0.694825,3
"10/7/24 15:09","Arizona State University","Arizona","Human Evolutionary Genetics","11/3/2024","https://apply.interfolio.com/156498","Asst / Assoc Prof","Tenure Stream","10/8/24 11:20","1) I'm not applying bc I don't do human genetics/genomics, but this might be one of the better opportunities this year - ASU is a great place to get set up. 2) I agree! If I were a geneticist, I would apply in a hearbeat. great dept and folks with IHO affiliations are housed in a brand new building with great facilities","","Match, by alias","Arizona State University Campus Immersion","AZ",104151,"Tempe","R1 Doctoral Universities: Very High Research Activity","Balanced arts & sciences/professions, high graduate coexistence","Research Doctoral: Comprehensive programs, no medical/veterinary school","Four-year, full-time, selective, higher transfer-in","High undergraduate","Four-year, large, primarily residential","Classified","Southwest AZ NM OK TX","Public, 4-year or above","Four or more years","Public",1,"City Midsize","No","No","No","No",NA,"No","No","No","Yes","No",0,14694,3991,656,252,0,19593,517586,68234,468,2263,55,96,305,200,456,200,2479,1764,6039,8655,0,38,53286,82880,74795,69204.333333,63124,11671,57410,5223,75,416,8924,2747,12427,250,3954,683,NA,NA,30,52,NA,3910,0.199561,109,204,79,0.724771,"Conferred research/scholarship doctoral degrees",0,0,1,27,23,17878,6562,7265,550,550,1100,21,22,21.474579,53516,47290,0.883661,2
"10/7/24 11:17","Salve Regina University","Rhode Island","Marine and Coastal Biology","12/1/2024","https://salve.interviewexchange.com/jobofferdetails.jsp;jsessionid=B2A5AE9E1302B16A4A13863F324802F0?JOBID=181744","Asst Prof","Tenure Stream","10/30/24 12:36","1) open until filled, review date informed from the Texas A&M job board. 2) FYI They ask for research, teaching and diversity statements after submission. 3) Now the application includes statements at the time of submission seemingly as one document. 4) are letter writers contacted immediately for this position?","3","Match, exact","Salve Regina University","RI",217536,"Newport","Master's Colleges & Universities: Larger Programs","Professions plus arts & sciences, some graduate coexistence","Research Doctoral: Single program-Other","Four-year, full-time, selective, lower transfer-in","High undergraduate","Four-year, small, highly residential","Not Classified","New England CT ME MA NH RI VT","Private not-for-profit, 4-year or above","Four or more years","Private not-for-profit",1,"Suburb Large","No","No","No","No",NA,"No","No","No","No","No",0,512,219,3,5,0,739,NA,NA,NA,NA,NA,NA,NA,NA,3,0,19,205,178,334,0,0,2771,3018,2771,2415,2150,621,2082,59,2,7,153,468,549,0,30,12,NA,NA,20,52,NA,188,0.254398,32,14,4,0.125,"Conferred research/scholarship doctoral degrees",0,0,1,6,1,1285,0,0,0,0,0,0,0,0,4972,3710,0.746179,2
"10/7/24 10:02","University of Calgary","Canada","Data-Driven Modelling for Ecology and Water Conservation","12/31/2024","https://careers.ucalgary.ca/jobs/14976298-assistant-professor-in-data-driven-modelling-for-ecology-and-water-conservation","Asst Prof","Tenure Stream","10/15/24 7:14","1) Should anyone not studying aquatic systems bother applying for this? The ad says "" Preference will be given to candidates with a primary focus and interest centered around the modelling of aquatic ecosystems and/or water usage"". +1
2) The requirements of this position is quite similiar to what I did in Canada, but there is no respnose after sending my CV to the contact person....which is frustrating.....I am not sure whether they really would like to employ a new person for this position.... 3) https://x.com/sam_yeaman/status/1843367668952510752 A prof at the university tweeted that evolutionary biologists who study aquatic organisms should also consider applying. 4) UCalgary science faculty member here. In case anyone was wondering, this search is not targeted at an internal candidate, it's a normal open search. 5) to #4: I do a LOT of modelling based on ecological, genetic, and environmental data in aquatic ecosystems, but all of it is focused on *biodiversity* conservation and the conservation of aquatic ecosystems. The search ad seems pretty focused on water usage as a component (ecosystem services, I guess?), and I have done none of that. Would it still make sense to apply? 6) #4 again. To #5: you can apply (although the aquatic biodiversity is not the major concern for this position).  ) Can foreigeners really apply for the position? At the end of this position it says that ""Canadians and permanent residents will be given priority""..... In the US, I never saw such requirements before...... 7) UCalgary Biological Sciences Dept prof here. Yes, definitely apply, even if you're not a Canadian citizen or permanent resident. Several recent TT searches in various science depts at UCalgary have hired non-Canadians. ","","International",NA,NA,NA,NA,NA,NA,NA,NA,NA,NA,NA,NA,NA,NA,NA,NA,NA,NA,NA,NA,NA,NA,NA,NA,NA,NA,NA,NA,NA,NA,NA,NA,NA,NA,NA,NA,NA,NA,NA,NA,NA,NA,NA,NA,NA,NA,NA,NA,NA,NA,NA,NA,NA,NA,NA,NA,NA,NA,NA,NA,NA,NA,NA,NA,NA,NA,NA,NA,NA,NA,NA,NA,NA,NA,NA,NA,NA,NA,NA,NA,NA,NA,NA,NA,NA,NA,NA,NA,NA,NA,NA,NA,NA,NA,NA,NA
"10/7/24 9:32","University of Geneva","Switzerland","Molecular Plant Sciences","10/31/2024","https://jobs.unige.ch/www/wd_portal.show_job?p_web_site_id=1&p_web_page_id=66781","Asst / Assoc Prof","Tenure Stream","10/10/24 1:01","1) Switzerland is a very comfortable place to be for an academic (i.e. high salaries), and the lac leman region is a wonderful place to live. But, know that like many european jobs, you'll be competing with a lot of junior group leaders for this position -- many of which already did postdocs, so we're talking 5-10 years post PhD experience. It's a tough market.","1","International",NA,NA,NA,NA,NA,NA,NA,NA,NA,NA,NA,NA,NA,NA,NA,NA,NA,NA,NA,NA,NA,NA,NA,NA,NA,NA,NA,NA,NA,NA,NA,NA,NA,NA,NA,NA,NA,NA,NA,NA,NA,NA,NA,NA,NA,NA,NA,NA,NA,NA,NA,NA,NA,NA,NA,NA,NA,NA,NA,NA,NA,NA,NA,NA,NA,NA,NA,NA,NA,NA,NA,NA,NA,NA,NA,NA,NA,NA,NA,NA,NA,NA,NA,NA,NA,NA,NA,NA,NA,NA,NA,NA,NA,NA,NA,NA
"10/7/24 7:39","University of South Alabama","Alabama","Cellular/molecular","11/5/2024","https://www.southalabama.edu/departments/academicaffairs/resources/academicaffairspostings/3222-bly-asstprof-081525-rev.pdf","Asst Prof","Tenure Stream","10/10/24 11:37","1) Dept member here,position is broadly defining cellular and molecular biology, ties to computational or modeling methods a plus. I will check periodically for any questions. 2) Teaching load and salary info available? 3) Current Asst. Profs are at 61K base salary for 9 months and then you can earn summer salary for teaching or through grants. The teaching load is 15 contact hours over two semesters which generally is 4 courses and one of the courses has a lab. In first couple of years we work to help minimize teaching load by sharing material and limiting too many new preps. 4) 61K seems incredibly low for a research focused institution. any plan to make that salary way more competitive? x4 5) @1 why doesn't the ad mention eco/evo if the search is really broad? x2 6) Salary is not ideal and the institution is working to make salaries more competitive, but it will take time. Cost of living in Mobile is low and the housing market is comparatively good for buyers compared to most cities. Eco/Evo not directly mentioned due to administrative process at university but we will happily consider applicants from eco/evo background that have cell/molec/computation as part of their skillset. Specifically, we need someone that can teach in the Cell Biology and/or Genetics rotation. 7) Very much appreciate the open info... but oof. Sure, it's 9 month, but 61k is literally the new NIH minimum for a postdoc...... bleak. x2 8) Not bleak at all, as context is important. Base salary, which is negotiable, is only part of determining if the position is a good fit. The healthcare package and benefits package are excellent and affordable, cost of living is low, and the Mobile area is lovely. Current Asst. Profs are all happy, start-up packages have been great, tenure expectations are clear and reasonable, the teaching load is good for our sized institution, and there are great supportive colleagues in the department and across campus. Then, the students in our department are appreciative and responsive to faculty who care about teaching and mentorship, we have had standing room only in our student org meetings, and the department and faculty are being recognized across campus for success in teaching, research, and service. Overall, the university is growing in students, programs, and resources and we have administrators that are working to make everything better. I am quite excited about the future and hope we can find a colleague who enjoys being able to conduct research in their interest area, who wants to make a positive difference for undergraduate and graduate students, and who wants to contribute to the department and university to make positive changes. 7 again) Very nice context. Thanks! x3 9) when you say can't list eco/evo for administrative reasons, can you elaborate? Is teaching evolution a concern at this university? 10) @9 no concern teaching evolution at all within the department or univeristy, we submitted an initial line request and initial job ad as more of a cellular/molecular position which was approved by the provost office, as we really need help from someone capable teaching cell biology and/or genetics.  However, research expertise in evolutionary genetics, eco-physiology, or any eco/evo, cellular/molecular combination would be strongly considered, if candidates are capable of teaching cell or genetics in addition to courses in area of expertise.","1","Match, exact","University of South Alabama","AL",102094,"Mobile","R2 Doctoral Universities: High Research Activity","Professions plus arts & sciences, some graduate coexistence","Research Doctoral: Professional-dominant","Four-year, full-time, selective, higher transfer-in","Majority undergraduate","Four-year, large, primarily residential","Not Classified","Southeast AL AR FL GA KY LA MS NC SC TN VA WV","Public, 4-year or above","Four or more years","Public",1,"City Midsize","No","Yes","No","No",NA,"No","No","No","No","No",0,2159,1057,43,279,0,3538,50571,531,20,679,0,0,15,28,15,28,89,1247,752,1407,15,0,14397,16398,14224,12607.333333,9050,5174,7605,1182,6,257,4188,986,1550,28,593,98,NA,NA,21,51,NA,1593,0.450254,48,47,22,0.458333,"Conferred research/scholarship doctoral degrees",0,1,0,17,7,3217,162,1469,503,480,980,20,19,19.900674,8084,5904,0.730332,2
"10/7/24 1:43","Cambridge University","United Kingdom","Expedition Botanist","11/17/2024","https://www.botanic.cam.ac.uk/join-support/job-opportunities/expedition-botanist/","Expedition Leader","Fixed Term Academic","10/25/24 8:01","As our Expedition Botanist, you will organise and lead up to four expeditions each year, joining our partners on additional expeditions, contribute to in-situ and ex-situ conservation, support species discovery and expand our botanical collections. You will also play an integral role in post-expedition processing including herbarium specimen preparation, seed banking and digitization. You will apply your taxonomic expertise to enhance and curate our living collections, ensure their scientific accuracy and assist with both university-level teaching and public engagement. 1) 33,966-44,263 salary range. 2) Classic dream job salary. Should be able to retire at the ripe young age of 137, or when you fall off a cliff during one of the expeditions. 3) Salary hasn't changed since Darwin held this post < lolol","","International",NA,NA,NA,NA,NA,NA,NA,NA,NA,NA,NA,NA,NA,NA,NA,NA,NA,NA,NA,NA,NA,NA,NA,NA,NA,NA,NA,NA,NA,NA,NA,NA,NA,NA,NA,NA,NA,NA,NA,NA,NA,NA,NA,NA,NA,NA,NA,NA,NA,NA,NA,NA,NA,NA,NA,NA,NA,NA,NA,NA,NA,NA,NA,NA,NA,NA,NA,NA,NA,NA,NA,NA,NA,NA,NA,NA,NA,NA,NA,NA,NA,NA,NA,NA,NA,NA,NA,NA,NA,NA,NA,NA,NA,NA,NA,NA
"10/6/24 11:06","Jacksonville University","Florida","Marine Science","12/3/2024","https://workforcenow.adp.com/mascsr/default/mdf/recruitment/recruitment.html?cid=77bf9053-07ed-47ba-b601-d78b61854199&ccId=9200563802212_2&lang=en_US&jobId=490554","Rank Open","Tenure Stream","10/6/24 11:07","A research emphasis in an area of elasmobranch biology, ecology and/or population dynamics is expected.","","Match, exact","Jacksonville University","FL",134945,"Jacksonville","Master's Colleges & Universities: Larger Programs","Professions plus arts & sciences, some graduate coexistence","Postbaccalaureate: Other-dominant, with Arts & Sciences","Four-year, full-time, inclusive, higher transfer-in","High undergraduate","Four-year, medium, highly residential","Not Classified","Southeast AL AR FL GA KY LA MS NC SC TN VA WV","Private not-for-profit, 4-year or above","Four or more years","Private not-for-profit",1,"City Large","No","No","No","No",NA,"No","No","No","No","No",0,802,479,0,26,12,1319,NA,NA,NA,NA,NA,NA,NA,NA,0,0,43,474,232,570,0,0,4164,5580,4053,3225.666667,2771,1282,2353,384,1,33,458,824,678,8,173,69,NA,NA,21,51,NA,650,0.492798,43,29,11,0.255814,"Did not confer research/scholarship doctoral degrees",0,0,1,8,0,1703,0,175,0,0,0,18,0,18,7354,5717,0.7774,1
"10/5/24 19:58","East Carolina University","North Carolina","Genetics","10/28/2024","https://ecu.peopleadmin.com/postings/75007","Asst Prof","Tenure Stream","10/6/24 7:55","""address fundamental questions in the broad area of molecular genetics and/or employ genetic approaches to aspects of cell biology, developmental biology, biochemistry, or molecular evolution""","4","Match, exact","East Carolina University","NC",198464,"Greenville","R2 Doctoral Universities: High Research Activity","Professions plus arts & sciences, high graduate coexistence","Research Doctoral: Professional-dominant","Four-year, full-time, selective, higher transfer-in","High undergraduate","Four-year, large, primarily residential","Classified","Southeast AL AR FL GA KY LA MS NC SC TN VA WV","Public, 4-year or above","Four or more years","Public",1,"City Small","No","Yes","No","No",NA,"No","No","No","No","No",0,5283,1393,74,216,0,6966,47123,10697,27,1150,0,7,23,43,29,41,301,1308,1923,3360,0,0,28651,31962,28798,23913.333333,23056,5742,18870,2896,16,1274,2585,3157,4029,113,1397,468,NA,NA,26,51,NA,1461,0.209733,60,88,35,0.583333,"Conferred research/scholarship doctoral degrees",0,0,1,22,6,5640,2212,2015,510,510,1020,19,20,19.523303,20313,17859,0.879191,2
"10/5/24 10:33","Georgia Institute of Technology","Georgia","Integrative Physiology","11/15/2024","https://bit.ly/4dx677J","Rank Open","Tenure Stream","10/31/24 10:20","1) Anyone know the teaching load? 2) It's an R1 Biology Dept. infer 1 course per semester at the most and perhaps 1.5 per year 3) The teaching load at GaTech is 8 credits on 2 year cycles, so lower than most R1 universities 4) thanks, @2 and @3! 5) so is this a physiology or a behavior position? I'm confused 6) Seems like it is an integrative position looking at the physiology of behavior","","Match, by alias","Georgia Institute of Technology-Main Campus","GA",139755,"Atlanta","R1 Doctoral Universities: Very High Research Activity","Professions plus arts & sciences, high graduate coexistence","Research Doctoral: Comprehensive programs, no medical/veterinary school","Four-year, full-time, more selective, higher transfer-in","Majority undergraduate","Four-year, large, highly residential","Not Classified","Southeast AL AR FL GA KY LA MS NC SC TN VA WV","Public, 4-year or above","Four or more years","Public",1,"City Large","No","No","No","No",NA,"No","No","No","No","No",0,3934,4073,527,0,0,8534,1017808,31180,597,839,3,2,492,30,497,30,3262,811,1173,2761,0,0,36302,43217,39771,27189,16561,23210,14476,1267,9,809,6413,16797,3234,26,834,33,NA,NA,17,14,NA,3738,0.438013,33,78,26,0.787879,"Conferred research/scholarship doctoral degrees",0,0,1,16,13,8796,2321,1648,670,700,1370,31,29,29.830436,40852,8719,0.213429,3
"10/4/24 12:50","Southern Methodist University","Texas","Earth & Environmental Science","12/1/2024","https://apply.interfolio.com/150744","Assoc / Full Prof","Tenure Stream","10/14/24 11:59","fully endowed professorship as the Matthews Endowed Chair, includes annual research funds for support of strategic faculty lines, student research and laboratory facilities 2) not ecoevo. 3) @2, ""biogeochemical systems"" 4) @3 ""biogeoecoevo"" 4) ya seems better suited to biogeojobs.net  AP) biogeochemistry is totally part of ecosystem ecology! 5) Thank you, AP -- biogeochemistry is absolutely ecology, agreed! 6) ","","Match, exact","Southern Methodist University","TX",228246,"Dallas","R2 Doctoral Universities: High Research Activity","Balanced arts & sciences/professions, high graduate coexistence","Research Doctoral: Comprehensive programs, no medical/veterinary school","Four-year, full-time, more selective, lower transfer-in","Majority undergraduate","Four-year, large, highly residential","Not Classified","Southwest AZ NM OK TX","Private not-for-profit, 4-year or above","Four or more years","Private not-for-profit",1,"Suburb Large","No","No","No","No",NA,"No","No","No","No","No",0,2004,1740,100,215,0,4059,26882,16199,58,486,3,12,60,25,75,25,795,1160,944,1060,0,0,11824,12963,12373,10327,6827,5546,6615,178,1,33,2688,2858,1529,2,287,10,NA,NA,26,52,NA,1145,0.282089,52,103,31,0.596154,"Conferred research/scholarship doctoral degrees",0,0,1,21,14,3403,605,846,630,620,1250,29,26,27.749139,14010,7379,0.526695,3
"10/4/24 8:06","Leibniz Institute","Germany","Ichthyology","11/30/2024","https://www.leibniz-gemeinschaft.de/en/careers/jobs/detail/job/show/Job/curator-ichthyology-mfd","Rank Open","Tenure Stream","10/4/24 21:44","","","International",NA,NA,NA,NA,NA,NA,NA,NA,NA,NA,NA,NA,NA,NA,NA,NA,NA,NA,NA,NA,NA,NA,NA,NA,NA,NA,NA,NA,NA,NA,NA,NA,NA,NA,NA,NA,NA,NA,NA,NA,NA,NA,NA,NA,NA,NA,NA,NA,NA,NA,NA,NA,NA,NA,NA,NA,NA,NA,NA,NA,NA,NA,NA,NA,NA,NA,NA,NA,NA,NA,NA,NA,NA,NA,NA,NA,NA,NA,NA,NA,NA,NA,NA,NA,NA,NA,NA,NA,NA,NA,NA,NA,NA,NA,NA,NA
