"Timestamp","Institution","Location","Subject Area","PI","Review Date","URL","Last Update","Notes","Matched status","Matched institution name","State abbreviation","Unique IPEDS identification number for an institution","City location of institution","2021 Basic Classification","2021 Undergraduate Instructional Program Classification","2021 Graduate Instructional Program Classification","2021 Undergraduate Profile Classification","2021 Enrollment Profile Classification","2021 Size and Setting Classification","2020/2015 Carnegie Community Engagement Elective Classification","Region code","Sector of institution (control and level combined)","Level of institution","Control of institution","Postsecondary and Title IV institution indicator","Degree of urbanization (Urban-centric locale)","Land-grant institution","Institution grants a medical degree (MD, DDS, DMD, DO, DVM)","Historically Black College or University","Tribal College flag","Hispanic Serving Institution (Using composite lists)","Minority Serving Institution (HSI, HBCU, or Tribal College or University only)","Women's College flag","Council on Public Liberal Arts Colleges flag","Coalition of Urban Serving Universities flag","Coalition of Urban and Metropolitan Universities flag","Associate's degree total","Bachelor's degree total","Master's degrees conferred","Doctoral degrees - research/scholarship","Doctoral degrees - professional practice","Doctoral degrees - other","Total degrees conferred","Science & Engineering Research & Development Expenditures ($Thousands)","Non Science & Engineering Research & Development Expenditures ($Thousands)","Postdoctorates and non-faculty research staff with doctorates","Number full-time of faculty in ladder rank (assistant, associate, and full professors) Fall 2020","Social Science research/scholarship doctoral degrees","Humanities research/scholarship doctoral degrees","STEM research/scholarship doctoral degrees","Number of research/scholarship doctoral degrees conferred in professional fields","Research/scholarship doctoral degrees in Arts & Science fields (humanities, social sciences, & STEM)","Research/scholarship doctoral degrees in professional/other fields","Master's, doctoral-professional practice, and doctoral-other degrees conferred in the Arts & Sciences","Master's, doctoral-professional practice, and doctoral-other degrees conferred in the Professional fields","Baccalaureate degrees conferred in the Arts & Sciences (first and second majors)","Number of baccalaureate degrees conferred in professional fields","Associate's and Certificates of less than 2 years in career and technical fields","Associate's and Certificates of less than 2 years in transfer fields","Total Fall 2019 enrollment","Annual enrollment headcount, academic year 2019-20","Total Fall 2020 enrollment","Fall 2020 Full-Time Equivalent enrollment (full-time plus one-third part-time)","Undergraduate total enrollment, fall 2020","Graduate total enrollment, fall 2020","Undergraduate degree-seeking full-time enrollment","Undergraduate degree-seeking part-time enrollment","Undergraduate non-degree full-time students","Undergraduate non-degree part-time students","Graduate full-time enrollment, fall 2020","Graduate part-time enrollment, fall 2020","Undergraduate new first-time full-time students","Undergraduate new first-time part-time students","Undergraduate new transfer-in full-time students","Undergraduate new transfer-in part-time students","Student mix ratio used for associates college basic classification subcategories","Program mix ratio used for associates college basic classification subcategories","Number of different 2-digit CIP codes in which institution confers any degree","Two-digit CIP code designation in which institution conferred the most degrees","Two-digit CIP code designation in which institution conferred the most degrees (if there is a tie)","Number of degrees awarded in largest two-digit CIP code","Percent of total degrees conferred in CIP-2 designation under which largest number of degrees conferred","Number of different 4-digit CIP code designations in which institution confers an undergraduate degree","Number of graduate degree programs, where a program is defined at the 4-digit CIP code level","CIP-4s observed at both undergrad & grad/professional as percentage of undergraduate CIP-4s","Percent of CIP4 areas in which undergraduate degrees are conferred that graduate degrees are also conferred","Institution confers research/scholarship doctoral degrees","Two-digit CIP under which institution confers the most graduate degrees is Education","Two-digit CIP under which institution confers the most graduate degrees is Business","Two-digit CIP under which institution confers the most graduate degrees is other than Business or Education","Number of different 2-digit CIP codes in which institution confers master's, doctoral-professional practice, and doctoral-other degrees","Number of different 2-digit CIP codes in which institution confers research/scholarship doctoral degrees","Total dormitory capacity (campus-owned, -operated, or -affiliated housing)","Number of first-time entering students who submitted  SAT score","Number of first-time entering students who submitted ACT score","SAT-Verbal 25th percentile score","SAT-Math 25th percentile score","Combined SAT-Math and SAT-Verbal 25th percentiles scores","ACT Composite Score, 25 percentile","The ACT equivalent score for the combined 25th percentile SAT score","Derived 25th percentile ACT score, weighting both ACT and equated SAT scores by number submitted","Number of first-time student applications (used with admits and test scores for selectivity index)","Number of first-time students admitted to the university (used with applicants and test scores for selectivity index)","Percent of applicants admitted (used with test scores for selectivity index)","Final Selectivity category (ACT and Pct Admit) (1=inclusive; 2=selective; 3=more selective)"
"1/21/24 7:53","Augustana University","South Carolina","Evolutionary biology","Carrie Olson-Manning","2/1/2024","https://www.augie.edu/faculty-positions#Postdoctoral%20Scholar%20and%20Teacher,%20Evolutionary%20Biology","1/21/24 10:59","Teacher + scholar postdoctoral opportunity 2) This university is in South Dakota, not South Carolina","Match, exact","Augustana University","SD",219000,"Sioux Falls","Master's Colleges & Universities: Medium Programs","Balanced arts & sciences/professions, some graduate coexistence","Postbaccalaureate: Education-dominant, with other professional programs","Four-year, full-time, selective, higher transfer-in","Very high undergraduate","Four-year, small, highly residential","Not Classified","Plains IA KS MN MO NE ND SD","Private not-for-profit, 4-year or above","Four or more years","Private not-for-profit",1,"City Midsize","No","No","No","No",NA,"No","No","No","No","No",0,530,160,0,0,0,690,NA,NA,NA,NA,NA,NA,NA,NA,0,0,0,160,262,268,0,0,2113,2384,2019,1813,1735,284,1658,52,7,18,45,239,318,5,99,7,NA,NA,19,13,NA,179,0.25942,40,5,2,0.05,"Did not confer research/scholarship doctoral degrees",1,0,0,4,0,1381,29,287,535,520,1060,22,21,21.908228,2037,1454,0.713795,2
"1/20/24 7:35","University of Oslo","Norway","Computational and Natural Sciences","Various","5/14/2024","https://www.jobbnorge.no/en/available-jobs/job/255679/dstrain-msca-postdoctoral-fellowships-in-computational-and-natural-sciences-18-positions","1/21/24 10:36","OP) Notice there are some 'themes'. This will be a competitive process, requiring project applications. My recommendation is that you contact the PI for a given theme and discuss your application with the PI. The PI should be invested in your application, so that you're competitive. See here for themes and PIs https://www.uio.no/dscience/english/dstrain/research-areas/biosciences/index.html; happy to answer any questions.","International",NA,NA,NA,NA,NA,NA,NA,NA,NA,NA,NA,NA,NA,NA,NA,NA,NA,NA,NA,NA,NA,NA,NA,NA,NA,NA,NA,NA,NA,NA,NA,NA,NA,NA,NA,NA,NA,NA,NA,NA,NA,NA,NA,NA,NA,NA,NA,NA,NA,NA,NA,NA,NA,NA,NA,NA,NA,NA,NA,NA,NA,NA,NA,NA,NA,NA,NA,NA,NA,NA,NA,NA,NA,NA,NA,NA,NA,NA,NA,NA,NA,NA,NA,NA,NA,NA,NA,NA,NA,NA,NA,NA,NA,NA,NA,NA
"1/19/24 14:12","Bowdoin College","Maine","Marine Biology","Mentoring established in consultation with successful candidate","2/12/2024","https://careers.bowdoin.edu/postings/13396","","","Match, exact","Bowdoin College","ME",161004,"Brunswick","Baccalaureate Colleges: Arts & Sciences Focus","Arts & sciences focus, no graduate coexistence","Not classified (Exclusively Undergraduate)","Four-year, full-time, more selective, lower transfer-in","Exclusively undergraduate four-year","Four-year, small, highly residential","Not Classified","New England CT ME MA NH RI VT","Private not-for-profit, 4-year or above","Four or more years","Private not-for-profit",1,"Town Fringe","No","No","No","No",NA,"No","No","No","No","No",0,666,0,0,0,0,666,NA,NA,NA,NA,NA,NA,NA,NA,0,0,0,0,599,67,0,0,1835,1973,1777,1776.333333,1777,0,1776,0,0,1,0,0,463,0,6,0,NA,NA,15,45,NA,183,0.274775,34,0,0,0,"Did not confer research/scholarship doctoral degrees",0,0,0,0,0,1749,0,0,0,0,0,0,0,0,9402,861,0.091576,3
"1/19/24 12:59","Clemson University","South Carolina","Population and Quantitative Genetics","Shyamalika Gopalan","3/18/2024","https://apply.interfolio.com/139581","1/19/24 13:06","Start date is flexible","Match, exact","Clemson University","SC",217882,"Clemson","R1 Doctoral Universities: Very High Research Activity","Professions plus arts & sciences, high graduate coexistence","Research Doctoral: Comprehensive programs, no medical/veterinary school","Four-year, full-time, more selective, higher transfer-in","High undergraduate","Four-year, large, primarily residential","Classified","Southeast AL AR FL GA KY LA MS NC SC TN VA WV","Public, 4-year or above","Four or more years","Public",1,"Suburb Large","Yes","No","No","No",NA,"No","No","No","No","No",0,4998,1668,249,0,0,6915,174342,54255,168,953,19,5,150,75,174,75,769,899,1770,3228,0,0,25822,28933,26406,24115.333333,20868,5538,20018,778,3,69,2949,2589,4186,13,1535,60,NA,NA,25,52,NA,1462,0.211424,64,107,39,0.609375,"Conferred research/scholarship doctoral degrees",0,0,1,22,18,7600,2468,1731,610,600,1210,27,25,25.824482,28600,17715,0.619406,3
"1/19/24 7:21","The Ohio State University","Ohio","Population Ecology, Invasive Species, Conservation","Casey Pennock","","https://u.osu.edu/pennocklab/join-the-lab/","","","Match, by alias","Ohio State University-Main Campus","OH",204796,"Columbus","R1 Doctoral Universities: Very High Research Activity","Professions plus arts & sciences, high graduate coexistence","Research Doctoral: Comprehensive programs, with medical/veterinary school","Four-year, full-time, more selective, higher transfer-in","High undergraduate","Four-year, large, primarily residential","Classified","Great Lakes IL IN MI OH WI","Public, 4-year or above","Four or more years","Public",1,"City Large","Yes","Yes","No","No",NA,"No","No","No","Yes","Yes",4,12263,2914,867,863,0,16911,914199,54061,1103,4414,56,103,404,304,563,304,1310,2467,4691,7572,4,0,61391,66017,61369,55537.666667,46984,14385,42540,3322,194,928,9888,4497,8623,56,3547,429,NA,NA,29,52,NA,2828,0.167228,113,196,74,0.654867,"Conferred research/scholarship doctoral degrees",0,0,1,26,25,13085,3140,6973,590,620,1210,26,25,25.689509,49087,33619,0.684886,3
"1/19/24 1:11","Naturalis Biodiversity Center","Netherlands","Monitoring and mapping fungal diversity","Jorinde Nuytinck","2/12/2024","https://www.naturalis.nl/en/about-us/job-opportunities/postdoctoral-fellow-to-improve-identification-of-and-unambiguous","","","International",NA,NA,NA,NA,NA,NA,NA,NA,NA,NA,NA,NA,NA,NA,NA,NA,NA,NA,NA,NA,NA,NA,NA,NA,NA,NA,NA,NA,NA,NA,NA,NA,NA,NA,NA,NA,NA,NA,NA,NA,NA,NA,NA,NA,NA,NA,NA,NA,NA,NA,NA,NA,NA,NA,NA,NA,NA,NA,NA,NA,NA,NA,NA,NA,NA,NA,NA,NA,NA,NA,NA,NA,NA,NA,NA,NA,NA,NA,NA,NA,NA,NA,NA,NA,NA,NA,NA,NA,NA,NA,NA,NA,NA,NA,NA,NA
"1/18/24 4:23","Eawag","Switzerland","Evolutionary ecology of aquatic ecosystems","Blake Matthews","","https://apply.refline.ch/673277/1130/pub/1/index.html","","","International",NA,NA,NA,NA,NA,NA,NA,NA,NA,NA,NA,NA,NA,NA,NA,NA,NA,NA,NA,NA,NA,NA,NA,NA,NA,NA,NA,NA,NA,NA,NA,NA,NA,NA,NA,NA,NA,NA,NA,NA,NA,NA,NA,NA,NA,NA,NA,NA,NA,NA,NA,NA,NA,NA,NA,NA,NA,NA,NA,NA,NA,NA,NA,NA,NA,NA,NA,NA,NA,NA,NA,NA,NA,NA,NA,NA,NA,NA,NA,NA,NA,NA,NA,NA,NA,NA,NA,NA,NA,NA,NA,NA,NA,NA,NA,NA
"1/17/24 12:10","Texas A&M University - Corpus Christi, Harte Research Institute","Texas","Fisheries","Dr. Greg Stunz, Dr. Matthew Streich","2/1/2024","https://tamus.wd1.myworkdayjobs.com/en-US/TAMUCC_External/details/Postdoctoral-Research-Associate_R-057419-1","1/17/24 12:11","Start date is flexible (May 2024 ideal), position open until filled.   ","Unmatched",NA,NA,NA,NA,NA,NA,NA,NA,NA,NA,NA,NA,NA,NA,NA,NA,NA,NA,NA,NA,NA,NA,NA,NA,NA,NA,NA,NA,NA,NA,NA,NA,NA,NA,NA,NA,NA,NA,NA,NA,NA,NA,NA,NA,NA,NA,NA,NA,NA,NA,NA,NA,NA,NA,NA,NA,NA,NA,NA,NA,NA,NA,NA,NA,NA,NA,NA,NA,NA,NA,NA,NA,NA,NA,NA,NA,NA,NA,NA,NA,NA,NA,NA,NA,NA,NA,NA,NA,NA,NA,NA,NA,NA,NA,NA,NA
"1/16/24 2:54","New York University","New York","Urban-system Biogeochemistry/Ecology","Mingzhen Lu","1/31/2024","apply.interfolio.com/138813","1/16/24 3:05","Start date is flexible, position will be open until filled. Salary range 70k-75k, with relocation compensation and discretionary research fund. The selected individual will lead highly independent and forward-looking investigations along the interface of ecosystem ecology and urban-system science. This position will be fully supported by a startup grant.","Match, exact","New York University","NY",193900,"New York","R1 Doctoral Universities: Very High Research Activity","Arts & sciences plus professions, high graduate coexistence","Research Doctoral: Comprehensive programs, with medical/veterinary school","Four-year, full-time, more selective, lower transfer-in","Majority undergraduate","Four-year, large, primarily residential","Classified","Mid East DE DC MD NJ NY PA","Private not-for-profit, 4-year or above","Four or more years","Private not-for-profit",1,"City Large","No","Yes","No","No",NA,"No","No","No","No","Yes",88,7206,9570,422,1005,43,18334,858190,89103,1060,5268,72,86,183,81,341,81,4642,5976,4426,2780,74,14,52885,58361,52775,46956.333333,27444,25331,25824,1452,30,138,18193,7138,6648,53,1315,114,NA,NA,26,52,NA,3146,0.171594,74,246,59,0.797297,"Conferred research/scholarship doctoral degrees",0,0,1,25,22,12985,4277,1796,670,700,1370,31,29,29.59147,80210,16918,0.210921,3
"1/16/24 2:53","New York University","New York","ARCTIC BELOWGROUND ECOLOGY","Mingzhen Lu","1/31/2024","apply.interfolio.com/138815","1/16/24 3:00","The selected individual will be expected to investigate the belowground mechanisms of the ongoing Arctic vegetation shift. Candidates should have sufficient fieldwork experience (especially in Arctic tundra or alpine vegetation) and expertise in belowground ecology (e.g., root ecology, microbial ecology, mycorrhizal ecology). Start date is flexible, salary range from 70k-75k plus relocation compensation and discretionary research fund, fieldwork site will be toolik Alaska. For more inquiries, please email mingzhen.lu@nyu.edu.","Match, exact","New York University","NY",193900,"New York","R1 Doctoral Universities: Very High Research Activity","Arts & sciences plus professions, high graduate coexistence","Research Doctoral: Comprehensive programs, with medical/veterinary school","Four-year, full-time, more selective, lower transfer-in","Majority undergraduate","Four-year, large, primarily residential","Classified","Mid East DE DC MD NJ NY PA","Private not-for-profit, 4-year or above","Four or more years","Private not-for-profit",1,"City Large","No","Yes","No","No",NA,"No","No","No","No","Yes",88,7206,9570,422,1005,43,18334,858190,89103,1060,5268,72,86,183,81,341,81,4642,5976,4426,2780,74,14,52885,58361,52775,46956.333333,27444,25331,25824,1452,30,138,18193,7138,6648,53,1315,114,NA,NA,26,52,NA,3146,0.171594,74,246,59,0.797297,"Conferred research/scholarship doctoral degrees",0,0,1,25,22,12985,4277,1796,670,700,1370,31,29,29.59147,80210,16918,0.210921,3
"1/16/24 2:52","New York University","New York","Terrestrial Biogeochemistry Modeling","Mingzhen Lu","1/31/2024","apply.interfolio.com/138814","1/16/24 3:02","Start date is flexible, salary range 70-75k, with relocation compensation and discretionary research fund. The selected individual will be expected to develop a class of mathematical models that can describe terrestrial biogeochemical cycles by integrating with our existing global stoichiometry database (including both natural and man-made materials). Candidates should have domain expertise in biogeochemistry and be comfortable with dynamical systems (ODEs). ","Match, exact","New York University","NY",193900,"New York","R1 Doctoral Universities: Very High Research Activity","Arts & sciences plus professions, high graduate coexistence","Research Doctoral: Comprehensive programs, with medical/veterinary school","Four-year, full-time, more selective, lower transfer-in","Majority undergraduate","Four-year, large, primarily residential","Classified","Mid East DE DC MD NJ NY PA","Private not-for-profit, 4-year or above","Four or more years","Private not-for-profit",1,"City Large","No","Yes","No","No",NA,"No","No","No","No","Yes",88,7206,9570,422,1005,43,18334,858190,89103,1060,5268,72,86,183,81,341,81,4642,5976,4426,2780,74,14,52885,58361,52775,46956.333333,27444,25331,25824,1452,30,138,18193,7138,6648,53,1315,114,NA,NA,26,52,NA,3146,0.171594,74,246,59,0.797297,"Conferred research/scholarship doctoral degrees",0,0,1,25,22,12985,4277,1796,670,700,1370,31,29,29.59147,80210,16918,0.210921,3
"1/12/24 13:31","University of California, Davis","California","Marine Ecology, Climate Change, Fisheries","Mikaela Provost","2/16/2024","https://mmprovost.com/","1/12/24 13:44","2yr postdoc; ideal start is May 2024 but flexible; please contact Mikaela (mmprovost@ucdavis.edu) with any questions","Match, partial","University of California-Davis","CA",110644,"Davis","R1 Doctoral Universities: Very High Research Activity","Arts & sciences plus professions, high graduate coexistence","Research Doctoral: Comprehensive programs, with medical/veterinary school","Four-year, full-time, more selective, higher transfer-in","High undergraduate","Four-year, large, primarily residential","Classified","Far West AK CA HI NV OR WA","Public, 4-year or above","Four or more years","Public",1,"Suburb Small","Yes","Yes","No","No",NA,"No","No","No","No","No",0,9389,1388,517,414,0,11708,804674,12019,1381,2386,65,60,353,39,478,39,842,960,6186,3203,0,0,38634,41236,39074,37996.666667,31162,7912,30166,976,20,0,7272,640,6000,144,2998,79,NA,NA,24,26,NA,1685,0.143919,78,150,48,0.615385,"Conferred research/scholarship doctoral degrees",0,0,1,24,19,8284,5509,2024,570,590,1160,25,24,24.268684,76897,35645,0.463542,3
"1/12/24 2:12","Lund University","Sweden","Modelling, terrestrial ecology and hidrogeology","Albert C Brangarí, Johannes Rousk","1/23/2024","https://lu.varbi.com/en/what:job/jobID:684343/","","","International",NA,NA,NA,NA,NA,NA,NA,NA,NA,NA,NA,NA,NA,NA,NA,NA,NA,NA,NA,NA,NA,NA,NA,NA,NA,NA,NA,NA,NA,NA,NA,NA,NA,NA,NA,NA,NA,NA,NA,NA,NA,NA,NA,NA,NA,NA,NA,NA,NA,NA,NA,NA,NA,NA,NA,NA,NA,NA,NA,NA,NA,NA,NA,NA,NA,NA,NA,NA,NA,NA,NA,NA,NA,NA,NA,NA,NA,NA,NA,NA,NA,NA,NA,NA,NA,NA,NA,NA,NA,NA,NA,NA,NA,NA,NA,NA
"1/11/24 13:13","Mississippi State University","Mississippi","Quantitative Spatial Ecologist","Brian Davis & Melanie Boudreau","1/25/2024","https://explore.msujobs.msstate.edu/en-us/job/507123/postdoctoral-associate","","","Match, exact","Mississippi State University","MS",176080,"Mississippi State","R1 Doctoral Universities: Very High Research Activity","Professions plus arts & sciences, high graduate coexistence","Research Doctoral: Comprehensive programs, with medical/veterinary school","Four-year, full-time, selective, higher transfer-in","High undergraduate","Four-year, large, primarily residential","Classified","Southeast AL AR FL GA KY LA MS NC SC TN VA WV","Public, 4-year or above","Four or more years","Public",1,"Town Remote","Yes","Yes","No","No",NA,"No","No","No","No","No",0,4175,794,160,87,0,5216,264367,16118,63,745,9,4,114,33,127,33,511,370,1461,2714,0,0,22226,24449,22986,20380.666667,18803,4183,17057,1667,32,47,1989,2194,3202,21,1803,203,NA,NA,26,52,NA,993,0.190376,66,82,36,0.545455,"Conferred research/scholarship doctoral degrees",0,0,1,19,13,5333,205,3003,520,530,1050,22,20,21.872195,16127,12908,0.800397,2
"1/11/24 8:27","National Park Service","Other","Ecology/climate change/conservation","","1/28/2024","https://www.nationalparks.org/science-parks-postdoctoral-fellowship","1/11/24 8:30","From ad:","International",NA,NA,NA,NA,NA,NA,NA,NA,NA,NA,NA,NA,NA,NA,NA,NA,NA,NA,NA,NA,NA,NA,NA,NA,NA,NA,NA,NA,NA,NA,NA,NA,NA,NA,NA,NA,NA,NA,NA,NA,NA,NA,NA,NA,NA,NA,NA,NA,NA,NA,NA,NA,NA,NA,NA,NA,NA,NA,NA,NA,NA,NA,NA,NA,NA,NA,NA,NA,NA,NA,NA,NA,NA,NA,NA,NA,NA,NA,NA,NA,NA,NA,NA,NA,NA,NA,NA,NA,NA,NA,NA,NA,NA,NA,NA,NA
"1/11/24 8:19","University of Notre Dame","Indiana","Remote Sensing and Spatial Ecology","Jason Rohr","","https://www.jasonrohrlab.com/postdoc-opportunities","","","Match, exact","University of Notre Dame","IN",152080,"Notre Dame","R1 Doctoral Universities: Very High Research Activity","Arts & sciences plus professions, high graduate coexistence","Research Doctoral: Comprehensive programs, no medical/veterinary school","Four-year, full-time, more selective, lower transfer-in","Majority undergraduate","Four-year, large, highly residential","Classified","Great Lakes IL IN MI OH WI","Private not-for-profit, 4-year or above","Four or more years","Private not-for-profit",1,"Suburb Large","No","No","No","No",NA,"No","No","No","No","No",0,2884,1160,239,201,0,4484,200815,26720,142,883,25,38,150,26,212,26,376,985,1738,1146,0,0,12683,13268,12809,12625,8874,3935,8832,22,1,19,3700,235,2193,0,238,0,NA,NA,22,52,NA,1092,0.243533,54,76,32,0.592593,"Conferred research/scholarship doctoral degrees",0,0,1,17,13,7103,924,1254,690,710,1400,32,30,31.151515,21253,4035,0.189856,3
"1/11/24 8:01","Northern Arizona University","Arizona","Comparative/Evolutionary Genomics","Marc Tollis","2/12/2024","https://hr.peoplesoft.nau.edu/psp/ph92prta/EMPLOYEE/HRMS/c/HRS_HRAM.HRS_APP_SCHJOB.GBL?Page=HRS_APP_JBPST&Action=U&FOCUS=Applicant&SiteId=1&JobOpeningId=607691&PostingSeq=1","1/11/24 8:03","2yr postdoc, will work closely with colleagues at AMNH (Burbrink) and Princeton (Simões). Remote is possible! I'm trying to extend the application deadline, looking for someone who can start September-December 2024. Email marc.tollis@nau.edu for questions.","Match, exact","Northern Arizona University","AZ",105330,"Flagstaff","R2 Doctoral Universities: High Research Activity","Balanced arts & sciences/professions, some graduate coexistence","Research Doctoral: Comprehensive programs, no medical/veterinary school","Four-year, full-time, inclusive, higher transfer-in","High undergraduate","Four-year, large, primarily residential","Not Classified","Southwest AZ NM OK TX","Public, 4-year or above","Four or more years","Public",1,"City Small","No","No","No","No",NA,"No","No","No","No","No",0,6403,1276,71,142,0,7892,62548,1908,45,748,6,6,18,41,30,41,260,1158,2627,3776,0,48,30733,34290,29566,25102,25228,4338,20642,4238,0,348,2228,2110,4589,628,1614,703,NA,NA,25,51,NA,1247,0.158008,69,73,34,0.492754,"Conferred research/scholarship doctoral degrees",1,0,0,18,9,10144,0,0,0,0,0,0,0,0,37386,30523,0.816429,1
"1/10/24 11:26","Cal Poly - San Luis Obispo","California","Ecological Informatics","Tim Bean","2/15/2024","https://jobs.calpoly.edu/en-us/job/534964/frost-postdoctoral-research-fellow-ecological-informatics","1/21/24 17:08","$62k base salary + benefits w/ additional for each class taught; broad flexibility for research projects (focused on wildlife / spatial ecology); feel free to e-mail w/ questions wtbean(@)calpoly.edu","Unmatched",NA,NA,NA,NA,NA,NA,NA,NA,NA,NA,NA,NA,NA,NA,NA,NA,NA,NA,NA,NA,NA,NA,NA,NA,NA,NA,NA,NA,NA,NA,NA,NA,NA,NA,NA,NA,NA,NA,NA,NA,NA,NA,NA,NA,NA,NA,NA,NA,NA,NA,NA,NA,NA,NA,NA,NA,NA,NA,NA,NA,NA,NA,NA,NA,NA,NA,NA,NA,NA,NA,NA,NA,NA,NA,NA,NA,NA,NA,NA,NA,NA,NA,NA,NA,NA,NA,NA,NA,NA,NA,NA,NA,NA,NA,NA,NA
"1/10/24 10:11","University of California Davis","California","Plant ecophysiology","Justin Valliere","1/29/2024","https://recruit.ucdavis.edu/JPF06238","1/10/24 10:12","Email jmvalliere@ucdavis.edu with any questions.","Match, partial","University of California-Davis","CA",110644,"Davis","R1 Doctoral Universities: Very High Research Activity","Arts & sciences plus professions, high graduate coexistence","Research Doctoral: Comprehensive programs, with medical/veterinary school","Four-year, full-time, more selective, higher transfer-in","High undergraduate","Four-year, large, primarily residential","Classified","Far West AK CA HI NV OR WA","Public, 4-year or above","Four or more years","Public",1,"Suburb Small","Yes","Yes","No","No",NA,"No","No","No","No","No",0,9389,1388,517,414,0,11708,804674,12019,1381,2386,65,60,353,39,478,39,842,960,6186,3203,0,0,38634,41236,39074,37996.666667,31162,7912,30166,976,20,0,7272,640,6000,144,2998,79,NA,NA,24,26,NA,1685,0.143919,78,150,48,0.615385,"Conferred research/scholarship doctoral degrees",0,0,1,24,19,8284,5509,2024,570,590,1160,25,24,24.268684,76897,35645,0.463542,3
