"8/2/23 4:18","University of Maryland Center for Environmental Science","Maryland","Species Distribution Modeling","Matt Fitzpatrick","9/5/2023","https://umces.peopleadmin.com/postings/1735","8/2/23 4:19","2nd of 3 anticipated postdoc hires in late 2023. Excellent working environment in the central Appalachians.","Match, by alias","University of Maryland-College Park","MD",163286,"College Park","R1 Doctoral Universities: Very High Research Activity","Balanced arts & sciences/professions, high graduate coexistence","Research Doctoral: Comprehensive programs, with medical/veterinary school","Four-year, full-time, more selective, higher transfer-in","High undergraduate","Four-year, large, primarily residential","Not Classified","Mid East DE DC MD NJ NY PA","Public, 4-year or above","Four or more years","Public",1,"Suburb Large","Yes","Yes","No","No",NA,"No","No","No","No","No",0,9001,2731,598,35,0,12365,587219,55151,973,1471,66,92,331,109,489,109,1463,1303,5160,3841,0,0,40743,44404,40709,37316.333333,30875,9834,28138,2076,22,639,7460,2374,5318,51,2238,237,NA,NA,28,52,NA,1986,0.160615,75,158,59,0.786667,"Conferred research/scholarship doctoral degrees",0,0,1,25,24,12025,3363,946,630,640,1270,30,26,26.878162,32147,16382,0.509597,3
"8/2/23 2:23","University of Konstanz","Germany","Open","","10/10/2023","https://www.uni-konstanz.de/zukunftskolleg/fellowships/postdoctoral-fellowship/","8/2/23 2:25","2-year postdoc fellowships with the Uni Konstanz Zukunftskolleg. Research can be in any subject area represented at the University of Konstanz. Up to two positions can be funded by the Centre for the Advanced Study of Collective Behavior.","International",NA,NA,NA,NA,NA,NA,NA,NA,NA,NA,NA,NA,NA,NA,NA,NA,NA,NA,NA,NA,NA,NA,NA,NA,NA,NA,NA,NA,NA,NA,NA,NA,NA,NA,NA,NA,NA,NA,NA,NA,NA,NA,NA,NA,NA,NA,NA,NA,NA,NA,NA,NA,NA,NA,NA,NA,NA,NA,NA,NA,NA,NA,NA,NA,NA,NA,NA,NA,NA,NA,NA,NA,NA,NA,NA,NA,NA,NA,NA,NA,NA,NA,NA,NA,NA,NA,NA,NA,NA,NA,NA,NA,NA,NA,NA,NA
"8/1/23 15:58","Arizona State University","Arizona","Coral Nanobiotechnology","Liza Roger","9/1/2023","https://sms.asu.edu/About/Employment-Opportunities#tab-id-1625-3/","8/1/23 16:01","OPEN UNTIL FILLED. Research related to oxidative stress in reef-building corals (NSF funded), specifically to examine free-radical concentrations and dynamics within the complex coral-algae symbiosis through a multidisciplinary lens with an emphasis on diversity and inclusion within science training.","Match, by alias","Arizona State University Campus Immersion","AZ",104151,"Tempe","R1 Doctoral Universities: Very High Research Activity","Balanced arts & sciences/professions, high graduate coexistence","Research Doctoral: Comprehensive programs, no medical/veterinary school","Four-year, full-time, selective, higher transfer-in","High undergraduate","Four-year, large, primarily residential","Classified","Southwest AZ NM OK TX","Public, 4-year or above","Four or more years","Public",1,"City Midsize","No","No","No","No",NA,"No","No","No","Yes","No",0,14694,3991,656,252,0,19593,517586,68234,468,2263,55,96,305,200,456,200,2479,1764,6039,8655,0,38,53286,82880,74795,69204.333333,63124,11671,57410,5223,75,416,8924,2747,12427,250,3954,683,NA,NA,30,52,NA,3910,0.199561,109,204,79,0.724771,"Conferred research/scholarship doctoral degrees",0,0,1,27,23,17878,6562,7265,550,550,1100,21,22,21.474579,53516,47290,0.883661,2
"8/1/23 9:55","Louisiana State University","Louisiana","Plant Phenology, Deep learning","Daijiang Li","","https://lsu.wd1.myworkdayjobs.com/LSU/job/1079-Digital-Media-Center/Research-Data-Scientist--IT-Analyst-3-_R00074121-1","8/1/23 9:55","This position will be open until filled. Can meet at ESA.","Match, by alias","Louisiana State University and Agricultural & Mechanical College","LA",159391,"Baton Rouge","R1 Doctoral Universities: Very High Research Activity","Balanced arts & sciences/professions, high graduate coexistence","Research Doctoral: Comprehensive programs, with medical/veterinary school","Four-year, full-time, selective, lower transfer-in","High undergraduate","Four-year, large, primarily residential","Classified","Southeast AL AR FL GA KY LA MS NC SC TN VA WV","Public, 4-year or above","Four or more years","Public",1,"City Midsize","Yes","Yes","No","No",NA,"No","No","No","No","No",0,5018,1297,347,254,0,6916,277811,8922,178,1029,50,62,184,51,295,51,462,1089,2088,2930,0,0,31756,34811,34285,30555.666667,27825,6460,24025,1178,72,2550,4594,1866,6690,11,834,94,NA,NA,26,52,NA,1501,0.217033,63,116,44,0.698413,"Conferred research/scholarship doctoral degrees",0,0,1,25,20,8468,1007,5649,550,540,1090,23,21,22.697416,28960,21252,0.73384,2
"7/31/23 13:39","York University","Canada","Ecological Genomics","Amro Zayed","9/1/2023","http://zayedlab.apps01.yorku.ca/wordpress/2023/07/postdoctoral-positions-in-ecological-genomics/","7/31/23 13:42","Two positions one bee genomics and coral genomics. in Toronto","Match, partial","York University","NE",181853,"York","Baccalaureate Colleges: Diverse Fields","Balanced arts & sciences/professions, some graduate coexistence","Postbaccalaureate: Business-dominant, with other professional programs","Four-year, full-time, inclusive, higher transfer-in","High undergraduate","Four-year, very small, highly residential","Not Classified","Plains IA KS MN MO NE ND SD","Private not-for-profit, 4-year or above","Four or more years","Private not-for-profit",1,"Town Remote","No","No","No","No",NA,"No","No","No","No","No",15,67,19,0,0,0,101,NA,NA,NA,NA,NA,NA,NA,NA,0,0,0,19,29,38,0,15,507,603,652,508.666667,457,195,430,27,0,0,7,188,129,0,40,4,NA,NA,10,52,NA,36,0.356436,14,2,1,0.071429,"Did not confer research/scholarship doctoral degrees",0,1,0,2,0,584,36,84,410,410,820,15,15,15,555,367,0.661261,1
"7/31/23 13:31","UCLA","California","HYBRIDIZATION","Stepfanie Aguillon","","https://stepfanieaguillon.com/join-the-lab/","","","Match, by alias","University of California-Los Angeles","CA",110662,"Los Angeles","R1 Doctoral Universities: Very High Research Activity","Arts & sciences focus, high graduate coexistence","Research Doctoral: Comprehensive programs, with medical/veterinary school","Four-year, full-time, more selective, higher transfer-in","Majority undergraduate","Four-year, large, highly residential","Classified","Far West AK CA HI NV OR WA","Public, 4-year or above","Four or more years","Public",1,"City Large","Yes","Yes","No","No",NA,"No","No","No","No","No",0,10006,3271,676,569,0,14522,1338707,54234,1498,3481,96,97,365,118,556,117,2075,1765,9100,906,0,0,44371,46947,44589,43489,31636,12953,31068,568,0,0,11871,1082,6378,8,3743,44,NA,NA,24,45,NA,2910,0.200386,71,166,53,0.746479,"Conferred research/scholarship doctoral degrees",0,0,1,20,21,19093,0,0,0,0,0,0,0,0,108870,15602,0.1433085,3
"7/27/23 18:50","ARIZONA STATE UNIVERSITY","Arizona","Coral Nanobiotechnology","Liza M. Roger","8/1/2023","https://sms.asu.edu/About/Employment-Opportunities#tab-id-1625-3/","7/27/23 18:53","research related to oxidative stress in reef-building corals (NSF funded), specifically to examine free-radical concentrations and dynamics within the complex coral-algae symbiosis through a multidisciplinary lens with an emphasis on diversity and inclusion within science training.
Qualifications:Candidates must have a Ph.D. in Marine Biology, Biochemistry, Chemical Engineering or related areas; Candidates with cross training are greatly encouraged to apply; No more than five years of previous postdoctoral experience, nor have been employed previously as an assistant professor, associate professor or professor on the tenure track; Non-US citizens should be eligible for a J-1 Scholar visa for the duration of the fellowship. For additional information and policies regarding postdoctoral scholars at ASU","Match, by alias","Arizona State University Campus Immersion","AZ",104151,"Tempe","R1 Doctoral Universities: Very High Research Activity","Balanced arts & sciences/professions, high graduate coexistence","Research Doctoral: Comprehensive programs, no medical/veterinary school","Four-year, full-time, selective, higher transfer-in","High undergraduate","Four-year, large, primarily residential","Classified","Southwest AZ NM OK TX","Public, 4-year or above","Four or more years","Public",1,"City Midsize","No","No","No","No",NA,"No","No","No","Yes","No",0,14694,3991,656,252,0,19593,517586,68234,468,2263,55,96,305,200,456,200,2479,1764,6039,8655,0,38,53286,82880,74795,69204.333333,63124,11671,57410,5223,75,416,8924,2747,12427,250,3954,683,NA,NA,30,52,NA,3910,0.199561,109,204,79,0.724771,"Conferred research/scholarship doctoral degrees",0,0,1,27,23,17878,6562,7265,550,550,1100,21,22,21.474579,53516,47290,0.883661,2
"7/27/23 11:01","Smithsonian Institution","Other","Climate Change","Various (Researchers across the Smithsonian Institute)","8/31/2023","https://fellowships.si.edu/CCF","","","International",NA,NA,NA,NA,NA,NA,NA,NA,NA,NA,NA,NA,NA,NA,NA,NA,NA,NA,NA,NA,NA,NA,NA,NA,NA,NA,NA,NA,NA,NA,NA,NA,NA,NA,NA,NA,NA,NA,NA,NA,NA,NA,NA,NA,NA,NA,NA,NA,NA,NA,NA,NA,NA,NA,NA,NA,NA,NA,NA,NA,NA,NA,NA,NA,NA,NA,NA,NA,NA,NA,NA,NA,NA,NA,NA,NA,NA,NA,NA,NA,NA,NA,NA,NA,NA,NA,NA,NA,NA,NA,NA,NA,NA,NA,NA,NA
"7/27/23 10:59","Smithsonian Tropical Research Institute (STRI)","Other","Socio-Ecological Resilience","Various (from STRI or National Museum of Natural. History)","8/31/2023","https://fellowships.si.edu/Resilience","","","International",NA,NA,NA,NA,NA,NA,NA,NA,NA,NA,NA,NA,NA,NA,NA,NA,NA,NA,NA,NA,NA,NA,NA,NA,NA,NA,NA,NA,NA,NA,NA,NA,NA,NA,NA,NA,NA,NA,NA,NA,NA,NA,NA,NA,NA,NA,NA,NA,NA,NA,NA,NA,NA,NA,NA,NA,NA,NA,NA,NA,NA,NA,NA,NA,NA,NA,NA,NA,NA,NA,NA,NA,NA,NA,NA,NA,NA,NA,NA,NA,NA,NA,NA,NA,NA,NA,NA,NA,NA,NA,NA,NA,NA,NA,NA,NA
"7/26/23 10:37","University of Chicago - Chicago Botanic Garden","Illinois","Ecological Conservation & Restoration; Synthesis","Dr. Alicia Foxx","8/21/2023","https://workforcenow.adp.com/mascsr/default/mdf/recruitment/recruitment.html?cid=21ef98a3-d325-4110-a85a-7729320b6f80&ccId=19000101_000001&lang=en_US&jobId=9200396490119_1&source=EN","7/26/23 10:39","Option for remote work; Review starts 8/21 but this is not a hard deadline.","Match, by alias","University of Chicago","IL",144050,"Chicago","R1 Doctoral Universities: Very High Research Activity","Arts & sciences focus, high graduate coexistence","Research Doctoral: Comprehensive programs, with medical/veterinary school","Four-year, full-time, more selective, lower transfer-in","Majority graduate","Four-year, large, highly residential","Not Classified","Great Lakes IL IN MI OH WI","Private not-for-profit, 4-year or above","Four or more years","Private not-for-profit",1,"City Large","No","Yes","No","No",NA,"No","No","No","No","Yes",0,2013,3321,378,288,0,6000,448404,10487,793,1949,76,80,167,55,323,55,2329,1280,1797,216,0,0,17451,20413,17834,16351.333333,7056,10778,7004,6,16,30,8590,2188,1848,0,90,0,NA,NA,23,52,NA,1242,0.207,44,117,35,0.795455,"Conferred research/scholarship doctoral degrees",0,0,1,23,18,4532,758,657,730,770,1500,34,33,33.464311,34350,2510,0.073071,3
"7/26/23 10:30","Purdue University","Indiana","ecology, biogeography, biodiversity, data science","Daniel Park","8/15/2023","https://www.bio.purdue.edu/lab/park/news.html#postdoc_ad","7/26/23 10:30","The position will remain open until filled. Can meet at ESA in Portland.","Match, by alias","Purdue University-Main Campus","IN",243780,"West Lafayette","R1 Doctoral Universities: Very High Research Activity","Professions plus arts & sciences, high graduate coexistence","Research Doctoral: Comprehensive programs, with medical/veterinary school","Four-year, full-time, selective, lower transfer-in","High undergraduate","Four-year, large, primarily residential","Classified","Great Lakes IL IN MI OH WI","Public, 4-year or above","Four or more years","Public",1,"City Small","Yes","Yes","No","No",NA,"No","No","No","No","No",61,7959,2284,796,240,0,11340,638715,48429,607,1811,28,58,635,75,721,75,1590,934,2314,5645,44,17,45500,49027,46655,41991.666667,35706,10949,33569,1948,6,183,6085,4864,8887,95,885,151,NA,NA,27,14,NA,3139,0.276808,107,131,60,0.560748,"Conferred research/scholarship doctoral degrees",0,0,1,23,21,14094,7349,4115,580,590,1170,25,24,24.35895,57510,38619,0.671518,3
"7/26/23 10:18","Chicago Botanic Garden","Illinois","Synthesis restoration ecology","Alicia Foxx","","https://workforcenow.adp.com/mascsr/default/mdf/recruitment/recruitment.html?cid=21ef98a3-d325-4110-a85a-7729320b6f80&ccId=19000101_000001&lang=en_US&jobId=9200396490119_1&source=EN","7/26/23 10:42","Option for remote work; Review starts 8/21 but this is not a hard deadline.","Unmatched",NA,NA,NA,NA,NA,NA,NA,NA,NA,NA,NA,NA,NA,NA,NA,NA,NA,NA,NA,NA,NA,NA,NA,NA,NA,NA,NA,NA,NA,NA,NA,NA,NA,NA,NA,NA,NA,NA,NA,NA,NA,NA,NA,NA,NA,NA,NA,NA,NA,NA,NA,NA,NA,NA,NA,NA,NA,NA,NA,NA,NA,NA,NA,NA,NA,NA,NA,NA,NA,NA,NA,NA,NA,NA,NA,NA,NA,NA,NA,NA,NA,NA,NA,NA,NA,NA,NA,NA,NA,NA,NA,NA,NA,NA,NA,NA
"7/26/23 6:45","University of Georgia","Georgia","Ecology","Any faculty member within Ecology","9/1/2023","https://www.ugajobsearch.com/postings/331208","7/26/23 6:59","Odum School of Ecology Research and Teaching Postdoc, 2 yrs of salary with $2K for research stipend each year. More information about the postdoc program can be found here: https://www.ecology.uga.edu/academics/odum-postdoctoral-scholar-program/ ","Match, exact","University of Georgia","GA",139959,"Athens","R1 Doctoral Universities: Very High Research Activity","Professions plus arts & sciences, high graduate coexistence","Research Doctoral: Comprehensive programs, with medical/veterinary school","Four-year, full-time, more selective, higher transfer-in","High undergraduate","Four-year, large, primarily residential","Classified","Southeast AL AR FL GA KY LA MS NC SC TN VA WV","Public, 4-year or above","Four or more years","Public",1,"City Midsize","Yes","Yes","No","No",NA,"No","No","No","No","No",0,8568,1979,528,431,0,11506,419656,63130,256,1660,44,70,222,192,336,192,741,1669,3427,5141,0,22,38920,42941,39147,36349.666667,29765,9382,27877,1828,11,49,7063,2319,5603,43,1486,116,NA,NA,28,52,NA,2920,0.253781,98,184,59,0.602041,"Conferred research/scholarship doctoral degrees",1,0,0,24,22,10050,3835,3585,630,620,1250,29,26,27.449461,28206,13647,0.483833,3
"7/25/23 23:13","University of Regensburg","Germany","Ecology & Conservation Biology","Tomer J Czaczkes","1/1/2024","https://www.animal-economics.com/join-the-team","9/12/23 8:35","Fieldwork in Spain testing control approaches for invasive ants. Prior experience not required, but good organisation skills essential. 2 years.","International",NA,NA,NA,NA,NA,NA,NA,NA,NA,NA,NA,NA,NA,NA,NA,NA,NA,NA,NA,NA,NA,NA,NA,NA,NA,NA,NA,NA,NA,NA,NA,NA,NA,NA,NA,NA,NA,NA,NA,NA,NA,NA,NA,NA,NA,NA,NA,NA,NA,NA,NA,NA,NA,NA,NA,NA,NA,NA,NA,NA,NA,NA,NA,NA,NA,NA,NA,NA,NA,NA,NA,NA,NA,NA,NA,NA,NA,NA,NA,NA,NA,NA,NA,NA,NA,NA,NA,NA,NA,NA,NA,NA,NA,NA,NA,NA
"7/25/23 12:28","George Washington University","District of Columbia","Evolutionary genomics","Linyi Zhang","8/28/2023","https://www.gwu.jobs/postings/104176","","","Match, exact","George Washington University","DC",131469,"Washington","R1 Doctoral Universities: Very High Research Activity","Balanced arts & sciences/professions, high graduate coexistence","Research Doctoral: Comprehensive programs, with medical/veterinary school","Four-year, full-time, more selective, higher transfer-in","Majority undergraduate","Four-year, large, highly residential","Classified","Mid East DE DC MD NJ NY PA","Private not-for-profit, 4-year or above","Four or more years","Private not-for-profit",1,"City Large","No","Yes","No","No",NA,"No","No","No","No","No",214,3453,4780,204,707,0,9358,249745,20624,131,1085,22,5,100,77,127,77,1983,3504,1967,1486,202,12,27814,32209,27017,20673.666667,11763,15254,10121,985,20,637,7361,7893,1949,29,580,173,NA,NA,26,51,NA,2119,0.226437,74,173,49,0.662162,"Conferred research/scholarship doctoral degrees",0,0,1,25,15,7181,992,542,640,630,1270,30,26,27.413299,26405,11366,0.430449,3
"7/25/23 9:09","German Centre for Integrative Biodiversity Research (iDiv) Halle-Jena-Leipzig","Germany","Ecology (plant, insect, biodiversity, land use)","Anne Ebeling","8/18/2023","https://www.idiv.de/fileadmin/content/Vacancies_PDF/Vacancies_2023/Auss217-2023.pdf","7/25/23 23:00","Relating community assembly to ecosystem functioning (CAFE) across trophic levels in space and time, 2 year postdoc position","International",NA,NA,NA,NA,NA,NA,NA,NA,NA,NA,NA,NA,NA,NA,NA,NA,NA,NA,NA,NA,NA,NA,NA,NA,NA,NA,NA,NA,NA,NA,NA,NA,NA,NA,NA,NA,NA,NA,NA,NA,NA,NA,NA,NA,NA,NA,NA,NA,NA,NA,NA,NA,NA,NA,NA,NA,NA,NA,NA,NA,NA,NA,NA,NA,NA,NA,NA,NA,NA,NA,NA,NA,NA,NA,NA,NA,NA,NA,NA,NA,NA,NA,NA,NA,NA,NA,NA,NA,NA,NA,NA,NA,NA,NA,NA,NA
"7/25/23 7:15","Humboldt University Berlin","Germany","Conservation Prioritization in South American Dry Forests","Prof. Tobias Kuermmerle","8/31/2023","https://euraxess.ec.europa.eu/jobs/125365","","","International",NA,NA,NA,NA,NA,NA,NA,NA,NA,NA,NA,NA,NA,NA,NA,NA,NA,NA,NA,NA,NA,NA,NA,NA,NA,NA,NA,NA,NA,NA,NA,NA,NA,NA,NA,NA,NA,NA,NA,NA,NA,NA,NA,NA,NA,NA,NA,NA,NA,NA,NA,NA,NA,NA,NA,NA,NA,NA,NA,NA,NA,NA,NA,NA,NA,NA,NA,NA,NA,NA,NA,NA,NA,NA,NA,NA,NA,NA,NA,NA,NA,NA,NA,NA,NA,NA,NA,NA,NA,NA,NA,NA,NA,NA,NA,NA
"7/24/23 13:52","University of Akron","Ohio","Biomechanics","Henry Astley","8/14/2023","https://uakron.wd1.myworkdayjobs.com/en-US/UACareers/job/Postdoctoral-Research-Associate_JR100235","7/24/23 13:54","Biomechanics of snake locomotion, $60k for about 3 years in low CoL area, learn new skills and work with fascinating animals.  Send any questions to hastley@uakron.edu","Match, by alias","University of Akron Main Campus","OH",200800,"Akron","R2 Doctoral Universities: High Research Activity","Professions plus arts & sciences, high graduate coexistence","Research Doctoral: Comprehensive programs, no medical/veterinary school","Four-year, full-time, inclusive, lower transfer-in","High undergraduate","Four-year, large, primarily nonresidential","Classified","Great Lakes IL IN MI OH WI","Public, 4-year or above","Four or more years","Public",1,"City Midsize","No","No","No","No",NA,"No","No","No","No","No",457,2850,696,134,161,0,4298,22595,901,33,356,10,2,88,34,100,34,223,634,604,2246,389,371,17600,19819,16094,13499.333333,13651,2443,10589,1506,202,1354,1411,1032,2286,57,344,72,NA,NA,26,52,NA,697,0.162168,74,95,37,0.5,"Conferred research/scholarship doctoral degrees",0,0,1,19,9,2820,561,2476,490,500,990,19,19,19,14553,10629,0.730365,1
"7/24/23 2:12","Weizmann Institute of Science","Israel","Marine Metabolomics","Assaf Vardi","8/1/2023","https://www.weizmann.ac.il/plants/vardi/positions","","","International",NA,NA,NA,NA,NA,NA,NA,NA,NA,NA,NA,NA,NA,NA,NA,NA,NA,NA,NA,NA,NA,NA,NA,NA,NA,NA,NA,NA,NA,NA,NA,NA,NA,NA,NA,NA,NA,NA,NA,NA,NA,NA,NA,NA,NA,NA,NA,NA,NA,NA,NA,NA,NA,NA,NA,NA,NA,NA,NA,NA,NA,NA,NA,NA,NA,NA,NA,NA,NA,NA,NA,NA,NA,NA,NA,NA,NA,NA,NA,NA,NA,NA,NA,NA,NA,NA,NA,NA,NA,NA,NA,NA,NA,NA,NA,NA
"7/23/23 9:38","Marian University","Indiana","Genomics, Evolution, Polyploidy, Amphibians","Rob Denton","8/1/2023","https://marian.peopleadmin.com/postings/2369","7/23/23 9:40","Up to 3yrs of funding, 55k/year in a very affordable city, teaching opportunities built in and rotations in R1 collaborator labs. Start date anytime and will review as applications come in. Reach out with any questions (rdenton@marian.edu)!","Match, exact","Marian University","IN",151786,"Indianapolis","Doctoral/Professional Universities","Professions focus, some graduate coexistence","Postbaccalaureate: Other-dominant, with Arts & Sciences","Four-year, full-time, selective, lower transfer-in","Majority undergraduate","Four-year, medium, primarily residential","Classified","Great Lakes IL IN MI OH WI","Private not-for-profit, 4-year or above","Four or more years","Private not-for-profit",1,"City Large","No","Yes","No","No",NA,"No","No","No","No","No",12,658,182,0,174,0,1026,NA,NA,NA,NA,NA,NA,NA,NA,0,0,47,309,127,531,3,9,3519,5140,3706,3256,2566,1140,2187,188,31,160,813,327,460,0,88,23,NA,NA,18,51,NA,541,0.52729,32,9,5,0.15625,"Did not confer research/scholarship doctoral degrees",0,0,1,4,0,1070,0,0,0,0,0,0,0,0,2816,1809,0.642401,2
"7/23/23 4:02","ETH Zurich","Switzerland","Forest dynamics and demography","Lalasia Bialic-Murphy & Tom Crowther","8/31/2023","https://crowtherlab.com/join-the-lab/","","","International",NA,NA,NA,NA,NA,NA,NA,NA,NA,NA,NA,NA,NA,NA,NA,NA,NA,NA,NA,NA,NA,NA,NA,NA,NA,NA,NA,NA,NA,NA,NA,NA,NA,NA,NA,NA,NA,NA,NA,NA,NA,NA,NA,NA,NA,NA,NA,NA,NA,NA,NA,NA,NA,NA,NA,NA,NA,NA,NA,NA,NA,NA,NA,NA,NA,NA,NA,NA,NA,NA,NA,NA,NA,NA,NA,NA,NA,NA,NA,NA,NA,NA,NA,NA,NA,NA,NA,NA,NA,NA,NA,NA,NA,NA,NA,NA
"7/23/23 0:37","Humboldt-University Berlin / Geography (http://hu.berlin/biogeo)","Germany","Conservation planning and land use","Tobias Kuemmerle","8/31/2023","https://euraxess.ec.europa.eu/jobs/125365","","","International",NA,NA,NA,NA,NA,NA,NA,NA,NA,NA,NA,NA,NA,NA,NA,NA,NA,NA,NA,NA,NA,NA,NA,NA,NA,NA,NA,NA,NA,NA,NA,NA,NA,NA,NA,NA,NA,NA,NA,NA,NA,NA,NA,NA,NA,NA,NA,NA,NA,NA,NA,NA,NA,NA,NA,NA,NA,NA,NA,NA,NA,NA,NA,NA,NA,NA,NA,NA,NA,NA,NA,NA,NA,NA,NA,NA,NA,NA,NA,NA,NA,NA,NA,NA,NA,NA,NA,NA,NA,NA,NA,NA,NA,NA,NA,NA
"7/22/23 17:52","Arizona State Unviersity","Arizona","Coral Nanobiotechnology","Liza M. Roger","9/1/2023","https://sms.asu.edu/About/Employment-Opportunities#tab-id-1625-3/","","","Match, by alias","Arizona State University Campus Immersion","AZ",104151,"Tempe","R1 Doctoral Universities: Very High Research Activity","Balanced arts & sciences/professions, high graduate coexistence","Research Doctoral: Comprehensive programs, no medical/veterinary school","Four-year, full-time, selective, higher transfer-in","High undergraduate","Four-year, large, primarily residential","Classified","Southwest AZ NM OK TX","Public, 4-year or above","Four or more years","Public",1,"City Midsize","No","No","No","No",NA,"No","No","No","Yes","No",0,14694,3991,656,252,0,19593,517586,68234,468,2263,55,96,305,200,456,200,2479,1764,6039,8655,0,38,53286,82880,74795,69204.333333,63124,11671,57410,5223,75,416,8924,2747,12427,250,3954,683,NA,NA,30,52,NA,3910,0.199561,109,204,79,0.724771,"Conferred research/scholarship doctoral degrees",0,0,1,27,23,17878,6562,7265,550,550,1100,21,22,21.474579,53516,47290,0.883661,2
"7/22/23 13:49","Yale School of the Environment","Connecticut","Ecological monitoring (vegetation)","Bill Lauenroth","","https://postdocs.yale.edu/yale-postdoctoral-positions","","","Match, by alias","Yale University","CT",130794,"New Haven","R1 Doctoral Universities: Very High Research Activity","Arts & sciences focus, high graduate coexistence","Research Doctoral: Comprehensive programs, with medical/veterinary school","Four-year, full-time, more selective, lower transfer-in","Majority graduate","Four-year, large, highly residential","Not Classified","New England CT ME MA NH RI VT","Private not-for-profit, 4-year or above","Four or more years","Private not-for-profit",1,"City Midsize","No","Yes","No","No",NA,"No","No","No","No","No",0,1661,2525,433,316,7,4942,1079696,14439,1223,2272,61,109,231,32,401,32,1408,1440,1506,155,0,0,13609,14910,12060,11956.666667,4703,7357,4696,5,0,2,7209,148,1264,0,14,0,NA,NA,21,45,NA,647,0.130919,47,148,38,0.808511,"Conferred research/scholarship doctoral degrees",0,0,1,21,20,5576,891,583,720,740,1460,33,32,32.395522,35220,2299,0.065275,3
"7/21/23 15:15","University of Minnesota","Minnesota","Evolution, Genomics, Reproduction, &/or Symbiosis","Dr. Amelia Lindsey","8/15/2023","https://hr.myu.umn.edu/jobs/ext/356512","","","Match, by alias","University of Minnesota-Twin Cities","MN",174066,"Minneapolis","R1 Doctoral Universities: Very High Research Activity","Balanced arts & sciences/professions, high graduate coexistence","Research Doctoral: Comprehensive programs, with medical/veterinary school","Four-year, full-time, more selective, higher transfer-in","Majority undergraduate","Four-year, large, primarily nonresidential","Classified","Plains IA KS MN MO NE ND SD","Public, 4-year or above","Four or more years","Public",1,"City Large","Yes","Yes","No","No",NA,"No","No","No","No","Yes",0,8887,3136,669,950,0,13642,999314,43068,2026,3254,81,83,389,115,551,114,1201,2885,4850,4037,0,14,51327,63760,52017,42937.666667,36061,15956,28529,2378,460,4694,9409,6547,5920,46,1823,125,NA,NA,27,52,NA,1817,0.133192,96,234,68,0.708333,"Conferred research/scholarship doctoral degrees",0,0,1,26,22,7414,858,5422,600,640,1240,25,26,25.136624,38237,26628,0.696394,3
"7/20/23 8:02","Michigan State University","Michigan","Evolution, Genomics, and Plant Biology","David Lowry","8/2/2023","https://careers.msu.edu/en-us/job/515633/research-associatefixed-term","","","Match, exact","Michigan State University","MI",171100,"East Lansing","R1 Doctoral Universities: Very High Research Activity","Balanced arts & sciences/professions, high graduate coexistence","Research Doctoral: Comprehensive programs, with medical/veterinary school","Four-year, full-time, selective, lower transfer-in","High undergraduate","Four-year, large, primarily residential","Classified","Great Lakes IL IN MI OH WI","Public, 4-year or above","Four or more years","Public",1,"City Small","Yes","Yes","No","No",NA,"No","No","No","No","No",0,9516,2063,575,862,0,13016,674384,38813,662,2551,50,76,299,150,425,150,593,2332,4076,5440,113,51,49809,55406,49695,45235,38491,11204,34581,3832,7,71,8417,2787,8097,292,1112,141,NA,NA,28,52,NA,2535,0.19476,98,202,71,0.72449,"Conferred research/scholarship doctoral degrees",0,0,1,26,24,17445,6697,3042,550,550,1100,23,22,22.312352,45426,34663,0.763065,2
