"11/15/23 12:55","University of North Carolina at Greensboro","North Carolina","Evolution/ecology/CT scanning","Bryan S. McLean","1/1/2024","https://spartantalent.uncg.edu/postings/27765","","","Match, exact","University of North Carolina at Greensboro","NC",199148,"Greensboro","R2 Doctoral Universities: High Research Activity","Balanced arts & sciences/professions, high graduate coexistence","Research Doctoral: Comprehensive programs, no medical/veterinary school","Four-year, full-time, inclusive, higher transfer-in","High undergraduate","Four-year, large, primarily residential","Classified","Southeast AL AR FL GA KY LA MS NC SC TN VA WV","Public, 4-year or above","Four or more years","Public",1,"City Large","No","No","No","No",NA,"No","No","No","No","Yes",0,3678,891,156,86,0,4811,15364,13602,25,681,11,24,37,84,72,84,262,715,1736,1942,0,0,20196,22487,19764,16653.333333,15995,3769,13317,2379,74,225,1707,2062,2398,34,1338,411,NA,NA,23,52,NA,845,0.175639,51,77,36,0.705882,"Conferred research/scholarship doctoral degrees",0,0,1,22,14,5660,1350,1152,490,490,980,19,19,19,9870,8640,0.87538,1
"11/15/23 8:55","University of California, Santa Barbara","California","Fisheries and climate change","Chris Free","12/22/2023","https://recruit.ap.ucsb.edu/JPF02658","","","Match, partial","University of California-Santa Barbara","CA",110705,"Santa Barbara","R1 Doctoral Universities: Very High Research Activity","Arts & sciences focus, high graduate coexistence","Research Doctoral: Comprehensive programs, no medical/veterinary school","Four-year, full-time, more selective, higher transfer-in","High undergraduate","Four-year, large, primarily residential","Not Classified","Far West AK CA HI NV OR WA","Public, 4-year or above","Four or more years","Public",1,"Suburb Midsize","Yes","No","No","No","Yes","Yes","No","No","No","No",0,7063,570,298,0,0,7931,241523,12911,527,882,41,52,179,26,272,26,414,156,6374,689,0,0,26314,28096,26179,25562.333333,23196,2983,22480,686,0,30,2774,209,4813,34,2351,102,NA,NA,19,45,NA,2063,0.260119,52,80,37,0.711538,"Conferred research/scholarship doctoral degrees",0,0,1,18,17,9665,3957,1865,620,610,1230,28,25,25.96101,90961,33384,0.367014,3
"11/15/23 5:31","University of Exeter","United Kingdom","Microbial Ecology & Evolution","Gabriel Yvon-Durocher","12/19/2023","https://jobs.exeter.ac.uk/hrpr_webrecruitment/wrd/run/ETREC107GF.open?VACANCY_ID=823676h2G0&WVID=3817591jNg","","","International",NA,NA,NA,NA,NA,NA,NA,NA,NA,NA,NA,NA,NA,NA,NA,NA,NA,NA,NA,NA,NA,NA,NA,NA,NA,NA,NA,NA,NA,NA,NA,NA,NA,NA,NA,NA,NA,NA,NA,NA,NA,NA,NA,NA,NA,NA,NA,NA,NA,NA,NA,NA,NA,NA,NA,NA,NA,NA,NA,NA,NA,NA,NA,NA,NA,NA,NA,NA,NA,NA,NA,NA,NA,NA,NA,NA,NA,NA,NA,NA,NA,NA,NA,NA,NA,NA,NA,NA,NA,NA,NA,NA,NA,NA,NA,NA
"11/15/23 1:16","GEOMAR Helmholtz Centre for Ocean Research","Germany","Genomics of marine symbioses","Prof. Dr. Ute Hentschel Humeida","12/12/2023","https://www.geomar.de/en/karriere/job-single-en/wissenschaftlerin-m-w-d-genomische-basis-mariner-schwammsymbiosen","12/29/23 6:02","A 3+3 position as 'junior group leader.' PI has much of the data already, as part of a larger project, which will allow for a quick start for the selected individual. 1) The deadline for this is now 14th January 2024. ","International",NA,NA,NA,NA,NA,NA,NA,NA,NA,NA,NA,NA,NA,NA,NA,NA,NA,NA,NA,NA,NA,NA,NA,NA,NA,NA,NA,NA,NA,NA,NA,NA,NA,NA,NA,NA,NA,NA,NA,NA,NA,NA,NA,NA,NA,NA,NA,NA,NA,NA,NA,NA,NA,NA,NA,NA,NA,NA,NA,NA,NA,NA,NA,NA,NA,NA,NA,NA,NA,NA,NA,NA,NA,NA,NA,NA,NA,NA,NA,NA,NA,NA,NA,NA,NA,NA,NA,NA,NA,NA,NA,NA,NA,NA,NA,NA
"11/14/23 9:00","University of Utah","Utah","Ecology/Evolution Broadly","University of Utah, Independent Research, You are the PI","12/6/2023","https://utah.peopleadmin.com/postings/155192","11/14/23 9:03","Hiring multiple positions. Three years of funding. Teaching/mentor focus.","Match, exact","University of Utah","UT",230764,"Salt Lake City","R1 Doctoral Universities: Very High Research Activity","Balanced arts & sciences/professions, high graduate coexistence","Research Doctoral: Comprehensive programs, with medical/veterinary school","Four-year, medium full-time , selective, higher transfer-in","Majority undergraduate","Four-year, large, primarily residential","Classified","Rocky Mountains CO ID MT UT WY","Public, 4-year or above","Four or more years","Public",1,"City Midsize","No","Yes","No","No",NA,"No","No","No","No","No",0,5310,2296,371,496,0,8473,577238,29823,485,1893,39,40,218,74,297,74,961,1831,2944,2366,0,0,32852,38335,33081,27963.666667,24643,8438,18660,4985,89,909,6656,1782,4214,269,1123,421,NA,NA,25,52,NA,1411,0.166529,79,151,56,0.708861,"Conferred research/scholarship doctoral degrees",0,0,1,23,18,5914,1080,3587,570,560,1130,22,23,22.231412,18419,14624,0.793963,2
"11/14/23 6:02","UMass Lowell","Massachusetts","Muscle physiology","Nicolai Konow","","https://careers.pageuppeople.com/822/lowell/en-us/job/521376/postdoctoral-research-associate-biological-sciences","","","Match, by alias","University of Massachusetts-Lowell","MA",166513,"Lowell","R2 Doctoral Universities: High Research Activity","Balanced arts & sciences/professions, high graduate coexistence","Research Doctoral: STEM-dominant","Four-year, medium full-time , selective, higher transfer-in","High undergraduate","Four-year, large, primarily residential","Classified","New England CT ME MA NH RI VT","Public, 4-year or above","Four or more years","Public",1,"Suburb Large","No","No","No","No",NA,"No","No","No","No","Yes",41,2993,1148,135,37,0,4354,85346,6870,58,457,1,0,75,59,76,59,503,682,1205,1788,13,28,18352,22192,18150,14014.666667,13813,4337,10612,2752,25,424,1310,3027,2021,61,873,422,NA,NA,22,52,NA,954,0.219109,38,62,23,0.605263,"Conferred research/scholarship doctoral degrees",0,0,1,16,9,4787,1412,187,570,570,1140,23,23,23,12970,9753,0.751966,2
"11/14/23 6:02","UMass Lowell","Massachusetts","Biomechanics and muscle physiology","Nicolai Konow","","https://careers.pageuppeople.com/822/lowell/en-us/job/521375/postdoctoral-research-associate-biological-sciences","","","Match, by alias","University of Massachusetts-Lowell","MA",166513,"Lowell","R2 Doctoral Universities: High Research Activity","Balanced arts & sciences/professions, high graduate coexistence","Research Doctoral: STEM-dominant","Four-year, medium full-time , selective, higher transfer-in","High undergraduate","Four-year, large, primarily residential","Classified","New England CT ME MA NH RI VT","Public, 4-year or above","Four or more years","Public",1,"Suburb Large","No","No","No","No",NA,"No","No","No","No","Yes",41,2993,1148,135,37,0,4354,85346,6870,58,457,1,0,75,59,76,59,503,682,1205,1788,13,28,18352,22192,18150,14014.666667,13813,4337,10612,2752,25,424,1310,3027,2021,61,873,422,NA,NA,22,52,NA,954,0.219109,38,62,23,0.605263,"Conferred research/scholarship doctoral degrees",0,0,1,16,9,4787,1412,187,570,570,1140,23,23,23,12970,9753,0.751966,2
"11/13/23 10:38","Montana State University, Bozeman","Montana","Agroecology","Jessica Kansman, Will Wetzel, Kevin Wanner","11/27/2023","https://jobs.montana.edu/postings/38795","11/14/23 9:39","Reviewing until filled, but please email or submit an application asap!","Match, by alias","Montana State University","MT",180461,"Bozeman","R1 Doctoral Universities: Very High Research Activity","Professions plus arts & sciences, high graduate coexistence","Research Doctoral: STEM-dominant","Four-year, full-time, selective, lower transfer-in","Very high undergraduate","Four-year, large, primarily residential","Classified","Rocky Mountains CO ID MT UT WY","Public, 4-year or above","Four or more years","Public",1,"Town Remote","Yes","No","No","No",NA,"No","No","No","No","No",120,2683,414,70,18,0,3305,147443,18842,186,576,0,4,59,7,63,7,195,237,992,1691,31,89,16692,18756,16218,13790.666667,14230,1988,12017,2115,9,89,551,1437,2791,468,505,171,NA,NA,27,14,NA,513,0.155219,49,74,29,0.591837,"Conferred research/scholarship doctoral degrees",0,0,1,21,10,4601,1385,2151,550,540,1090,21,21,21,18892,15260,0.807749,2
"11/13/23 8:41","University of California Los Angeles","California","California Conservation Science","Brad Shaffer","11/26/2023","https://www.ioes.ucla.edu/jobs/postdoctoral-fellowship-with-the-la-kretz-center-for-california-conservation-science/","","","Match, partial","University of California-Los Angeles","CA",110662,"Los Angeles","R1 Doctoral Universities: Very High Research Activity","Arts & sciences focus, high graduate coexistence","Research Doctoral: Comprehensive programs, with medical/veterinary school","Four-year, full-time, more selective, higher transfer-in","Majority undergraduate","Four-year, large, highly residential","Classified","Far West AK CA HI NV OR WA","Public, 4-year or above","Four or more years","Public",1,"City Large","Yes","Yes","No","No",NA,"No","No","No","No","No",0,10006,3271,676,569,0,14522,1338707,54234,1498,3481,96,97,365,118,556,117,2075,1765,9100,906,0,0,44371,46947,44589,43489,31636,12953,31068,568,0,0,11871,1082,6378,8,3743,44,NA,NA,24,45,NA,2910,0.200386,71,166,53,0.746479,"Conferred research/scholarship doctoral degrees",0,0,1,20,21,19093,0,0,0,0,0,0,0,0,108870,15602,0.1433085,3
"11/13/23 5:43","University of Copenhagen","Denmark","Macroecology","Carsten Rahbek","11/23/2023","https://candidate.hr-manager.net/ApplicationInit.aspx/?cid=1307&departmentId=19217&ProjectId=160530&MediaId=5&SkipAdvertisement=false","","","International",NA,NA,NA,NA,NA,NA,NA,NA,NA,NA,NA,NA,NA,NA,NA,NA,NA,NA,NA,NA,NA,NA,NA,NA,NA,NA,NA,NA,NA,NA,NA,NA,NA,NA,NA,NA,NA,NA,NA,NA,NA,NA,NA,NA,NA,NA,NA,NA,NA,NA,NA,NA,NA,NA,NA,NA,NA,NA,NA,NA,NA,NA,NA,NA,NA,NA,NA,NA,NA,NA,NA,NA,NA,NA,NA,NA,NA,NA,NA,NA,NA,NA,NA,NA,NA,NA,NA,NA,NA,NA,NA,NA,NA,NA,NA,NA
"11/12/23 7:13","New York University","New York","ecosystem ecology, urban science","Mingzhen Lu","12/1/2023","https://apply.interfolio.com/127698","11/12/23 7:19","2 opennings, flexible start date, continue until filled","Match, exact","New York University","NY",193900,"New York","R1 Doctoral Universities: Very High Research Activity","Arts & sciences plus professions, high graduate coexistence","Research Doctoral: Comprehensive programs, with medical/veterinary school","Four-year, full-time, more selective, lower transfer-in","Majority undergraduate","Four-year, large, primarily residential","Classified","Mid East DE DC MD NJ NY PA","Private not-for-profit, 4-year or above","Four or more years","Private not-for-profit",1,"City Large","No","Yes","No","No",NA,"No","No","No","No","Yes",88,7206,9570,422,1005,43,18334,858190,89103,1060,5268,72,86,183,81,341,81,4642,5976,4426,2780,74,14,52885,58361,52775,46956.333333,27444,25331,25824,1452,30,138,18193,7138,6648,53,1315,114,NA,NA,26,52,NA,3146,0.171594,74,246,59,0.797297,"Conferred research/scholarship doctoral degrees",0,0,1,25,22,12985,4277,1796,670,700,1370,31,29,29.59147,80210,16918,0.210921,3
"11/10/23 9:59","University of Michigan","Michigan","Evolutionary Ecology, Plant-animal interactions","Marjorie Weber","11/13/2023","http://www.theweberlab.com/postdoc-position.html","11/10/23 11:01","Will continue to review until filled :)","Match, by alias","University of Michigan-Ann Arbor","MI",170976,"Ann Arbor","R1 Doctoral Universities: Very High Research Activity","Arts & sciences plus professions, high graduate coexistence","Research Doctoral: Comprehensive programs, with medical/veterinary school","Four-year, full-time, more selective, lower transfer-in","Majority undergraduate","Four-year, large, primarily residential","Not Classified","Great Lakes IL IN MI OH WI","Public, 4-year or above","Four or more years","Public",1,"City Midsize","No","Yes","No","No",NA,"No","No","No","No","No",0,8715,4691,876,750,0,15032,1572931,100931,2042,4273,79,92,628,76,788,75,2648,2793,5845,2870,0,0,48090,49530,47907,45691.666667,31329,16578,29813,1376,38,102,14733,1845,6835,44,1257,48,NA,NA,24,14,NA,2565,0.170636,76,216,59,0.776316,"Conferred research/scholarship doctoral degrees",0,0,1,22,23,12242,4393,3277,660,680,1340,31,28,29.281747,65021,16974,0.261054,3
"11/9/23 14:19","Central State University","Ohio","Agricultural science, entomology, soil science, project management","Li-Byarlay","12/1/2023","https://careers.centralstate.edu/postings/7422","11/9/23 14:20","Project manager position, up to 5 yrs, work with minority students in ag","Match, exact","Central State University","OH",201690,"Wilberforce","Baccalaureate Colleges: Diverse Fields","Professions plus arts & sciences, no graduate coexistence","Not classified (Exclusively Undergraduate)","Four-year, higher part-time","Exclusively undergraduate four-year","Four-year, small, primarily residential","Not Classified","Great Lakes IL IN MI OH WI","Public, 4-year or above","Four or more years","Public",1,"Rural Fringe","Yes","No","Yes","No",NA,"Yes","No","No","No","No",0,235,0,0,0,0,235,NA,NA,NA,NA,NA,NA,NA,NA,0,0,0,0,76,159,0,0,2033,2421,4021,2768.333333,4021,0,2141,1868,1,11,0,0,471,2,203,1217,NA,NA,18,52,NA,61,0.259574,26,0,0,0,"Did not confer research/scholarship doctoral degrees",0,0,0,0,0,1437,0,0,0,0,0,0,0,0,10191,5915,0.580414,0
"11/9/23 14:17","Central State University","Ohio","pollinator ecology, Plant-pollinator interaction","Nagle/ Li-Byarlay","12/1/2023","https://docs.google.com/forms/d/e/1FAIpQLSfaqq8pqwxjlckPBsYR--z7SY9Deh1evXR-qi-WsPnuaOveuw/viewform","11/9/23 14:18","the job posting is coming soon, up to 3 yrs postdoc, usda funded research","Match, exact","Central State University","OH",201690,"Wilberforce","Baccalaureate Colleges: Diverse Fields","Professions plus arts & sciences, no graduate coexistence","Not classified (Exclusively Undergraduate)","Four-year, higher part-time","Exclusively undergraduate four-year","Four-year, small, primarily residential","Not Classified","Great Lakes IL IN MI OH WI","Public, 4-year or above","Four or more years","Public",1,"Rural Fringe","Yes","No","Yes","No",NA,"Yes","No","No","No","No",0,235,0,0,0,0,235,NA,NA,NA,NA,NA,NA,NA,NA,0,0,0,0,76,159,0,0,2033,2421,4021,2768.333333,4021,0,2141,1868,1,11,0,0,471,2,203,1217,NA,NA,18,52,NA,61,0.259574,26,0,0,0,"Did not confer research/scholarship doctoral degrees",0,0,0,0,0,1437,0,0,0,0,0,0,0,0,10191,5915,0.580414,0
"11/9/23 14:11","Central State University","Ohio","honeybee genomics, epigenomics, transcriptomics, social behavior of grooming","Li-Byarlay","11/16/2023","https://careers.centralstate.edu/postings/6987","11/9/23 14:12","2-year postdoc. Encourage to apply for USDA postdoc fellowships","Match, exact","Central State University","OH",201690,"Wilberforce","Baccalaureate Colleges: Diverse Fields","Professions plus arts & sciences, no graduate coexistence","Not classified (Exclusively Undergraduate)","Four-year, higher part-time","Exclusively undergraduate four-year","Four-year, small, primarily residential","Not Classified","Great Lakes IL IN MI OH WI","Public, 4-year or above","Four or more years","Public",1,"Rural Fringe","Yes","No","Yes","No",NA,"Yes","No","No","No","No",0,235,0,0,0,0,235,NA,NA,NA,NA,NA,NA,NA,NA,0,0,0,0,76,159,0,0,2033,2421,4021,2768.333333,4021,0,2141,1868,1,11,0,0,471,2,203,1217,NA,NA,18,52,NA,61,0.259574,26,0,0,0,"Did not confer research/scholarship doctoral degrees",0,0,0,0,0,1437,0,0,0,0,0,0,0,0,10191,5915,0.580414,0
"11/9/23 9:06","University of Wisconsin-Madison","Wisconsin","Aquatic Vegetation and Fisheries Community Modeling","Zachary Feiner","12/9/2023","https://hr.wisc.edu/postdoc-and-research-intern-vacancies/","11/9/23 9:08","Two-year postdoc as part of a collaborative team of Upper Midwest US (MI, MN, WI) ecologists interested in leveraging extensive ecological datasets to investigate macrophyte communities, model relationships between macrophyte communities and fisheries characteristics in lakes, assess fishery responses to changes in macrophyte habitats, and develop tools to identify and prioritize habitat management strategies. ","Match, exact","University of Wisconsin-Madison","WI",240444,"Madison","R1 Doctoral Universities: Very High Research Activity","Balanced arts & sciences/professions, high graduate coexistence","Research Doctoral: Comprehensive programs, with medical/veterinary school","Four-year, full-time, more selective, lower transfer-in","Majority undergraduate","Four-year, large, primarily residential","Classified","Great Lakes IL IN MI OH WI","Public, 4-year or above","Four or more years","Public",1,"City Large","Yes","Yes","No","No",NA,"No","No","No","No","No",0,9646,2345,749,602,0,13342,1272053,91878,1460,3412,91,105,444,110,634,109,1365,1582,5371,4275,0,0,44257,47831,44640,41471.333333,32688,11952,29986,1665,77,960,9824,2128,7256,50,941,70,NA,NA,26,52,NA,1827,0.136936,97,234,79,0.814433,"Conferred research/scholarship doctoral degrees",0,0,1,26,26,8871,1968,5697,610,650,1260,27,26,26.743249,45915,26286,0.572493,3
"11/6/23 13:57","University of Central Florida","Florida","Entomology/Soil Biology/Myrmecology","Josh King","1/31/2024","https://ucf.wd1.myworkdayjobs.com/en-US/careers/job/Postdoctoral-Scholar_R105548","11/6/23 13:58","Post doc is still open. Please apply! NSF funded, 3-4 years of support. Please feel free to reach out with questions.","Match, exact","University of Central Florida","FL",132903,"Orlando","R1 Doctoral Universities: Very High Research Activity","Balanced arts & sciences/professions, high graduate coexistence","Research Doctoral: Comprehensive programs, with medical/veterinary school","Four-year, medium full-time , selective, higher transfer-in","High undergraduate","Four-year, large, primarily nonresidential","Classified","Southeast AL AR FL GA KY LA MS NC SC TN VA WV","Public, 4-year or above","Four or more years","Public",1,"Suburb Large","No","Yes","No","No",NA,"No","No","No","Yes","No",371,14400,2576,300,166,0,17813,187788,51555,195,1099,18,5,195,82,218,82,848,1894,6112,8288,0,371,69402,81082,71881,56272.333333,61401,10480,43385,17726,128,162,4955,5525,7624,413,4859,2762,NA,NA,26,51,NA,2972,0.166844,66,102,43,0.651515,"Conferred research/scholarship doctoral degrees",0,0,1,21,14,12277,6196,1847,590,570,1160,25,24,24.229641,47957,21661,0.451675,3
"11/3/23 10:15","American Museum of Natural History","New York","Squamate Genomics and Evolution","Frank Burbrink","11/3/2023","https://careers.amnh.org/postings/3904","11/3/23 15:50","2-year postdoc, will be part of a team of 3 total postdocs (1 morphology, 2 genomics) and three PIs. This is from an NSF grant. Also this was just posted today so the 3rd is not the review date.","Unmatched",NA,NA,NA,NA,NA,NA,NA,NA,NA,NA,NA,NA,NA,NA,NA,NA,NA,NA,NA,NA,NA,NA,NA,NA,NA,NA,NA,NA,NA,NA,NA,NA,NA,NA,NA,NA,NA,NA,NA,NA,NA,NA,NA,NA,NA,NA,NA,NA,NA,NA,NA,NA,NA,NA,NA,NA,NA,NA,NA,NA,NA,NA,NA,NA,NA,NA,NA,NA,NA,NA,NA,NA,NA,NA,NA,NA,NA,NA,NA,NA,NA,NA,NA,NA,NA,NA,NA,NA,NA,NA,NA,NA,NA,NA,NA,NA
"11/2/23 9:57","USDA ARS Biological Control of Insects Research Laboratory","Missouri","Bioinformatics & Microbiology (2 years, GS-11, $69K-89K))","David Kang","12/31/2023","https://careers.entsoc.org/jobs/19356806/research-biologist-computational-bioinformatic-microbiologist-postdoctoral-res-ass-gs-0401-0403","","","Unmatched",NA,NA,NA,NA,NA,NA,NA,NA,NA,NA,NA,NA,NA,NA,NA,NA,NA,NA,NA,NA,NA,NA,NA,NA,NA,NA,NA,NA,NA,NA,NA,NA,NA,NA,NA,NA,NA,NA,NA,NA,NA,NA,NA,NA,NA,NA,NA,NA,NA,NA,NA,NA,NA,NA,NA,NA,NA,NA,NA,NA,NA,NA,NA,NA,NA,NA,NA,NA,NA,NA,NA,NA,NA,NA,NA,NA,NA,NA,NA,NA,NA,NA,NA,NA,NA,NA,NA,NA,NA,NA,NA,NA,NA,NA,NA,NA
"11/2/23 7:03","American Museum of Natural History","New York","Conservation Science - Interdisciplinary (2yrs)","Center for Biodiversity and Conservation","11/27/2023","https://careers.amnh.org/postings/3902","11/16/23 11:12","(1) Is the position open to remote work?","Unmatched",NA,NA,NA,NA,NA,NA,NA,NA,NA,NA,NA,NA,NA,NA,NA,NA,NA,NA,NA,NA,NA,NA,NA,NA,NA,NA,NA,NA,NA,NA,NA,NA,NA,NA,NA,NA,NA,NA,NA,NA,NA,NA,NA,NA,NA,NA,NA,NA,NA,NA,NA,NA,NA,NA,NA,NA,NA,NA,NA,NA,NA,NA,NA,NA,NA,NA,NA,NA,NA,NA,NA,NA,NA,NA,NA,NA,NA,NA,NA,NA,NA,NA,NA,NA,NA,NA,NA,NA,NA,NA,NA,NA,NA,NA,NA,NA
"11/2/23 7:03","American Museum of Natural History","New York","Conservation Science - Innovation (1yr w possible extension)","Center for Biodiversity and Conservation","11/27/2023","https://careers.amnh.org/postings/3903","","","Unmatched",NA,NA,NA,NA,NA,NA,NA,NA,NA,NA,NA,NA,NA,NA,NA,NA,NA,NA,NA,NA,NA,NA,NA,NA,NA,NA,NA,NA,NA,NA,NA,NA,NA,NA,NA,NA,NA,NA,NA,NA,NA,NA,NA,NA,NA,NA,NA,NA,NA,NA,NA,NA,NA,NA,NA,NA,NA,NA,NA,NA,NA,NA,NA,NA,NA,NA,NA,NA,NA,NA,NA,NA,NA,NA,NA,NA,NA,NA,NA,NA,NA,NA,NA,NA,NA,NA,NA,NA,NA,NA,NA,NA,NA,NA,NA,NA
"11/2/23 1:48","Institute of Vertebrate Biology CAS","Europe (Other)","Bird Ecology and Migration","Petr Procházka.","11/30/2023","https://drive.google.com/file/d/1KkAwWpQeAUBKhfvKg-b_yCZuC68mEML_/view?pli=1","","","International",NA,NA,NA,NA,NA,NA,NA,NA,NA,NA,NA,NA,NA,NA,NA,NA,NA,NA,NA,NA,NA,NA,NA,NA,NA,NA,NA,NA,NA,NA,NA,NA,NA,NA,NA,NA,NA,NA,NA,NA,NA,NA,NA,NA,NA,NA,NA,NA,NA,NA,NA,NA,NA,NA,NA,NA,NA,NA,NA,NA,NA,NA,NA,NA,NA,NA,NA,NA,NA,NA,NA,NA,NA,NA,NA,NA,NA,NA,NA,NA,NA,NA,NA,NA,NA,NA,NA,NA,NA,NA,NA,NA,NA,NA,NA,NA
"11/1/23 14:27","University of California Santa Barbara","California","Global Change","","12/1/2023","https://recruit.ap.ucsb.edu/JPF02630","11/15/23 16:23","New postdoc fellowship program at UCSB's Bren School of Environmental Science & Management! (1) remote work optional?","Match, partial","University of California-Santa Barbara","CA",110705,"Santa Barbara","R1 Doctoral Universities: Very High Research Activity","Arts & sciences focus, high graduate coexistence","Research Doctoral: Comprehensive programs, no medical/veterinary school","Four-year, full-time, more selective, higher transfer-in","High undergraduate","Four-year, large, primarily residential","Not Classified","Far West AK CA HI NV OR WA","Public, 4-year or above","Four or more years","Public",1,"Suburb Midsize","Yes","No","No","No","Yes","Yes","No","No","No","No",0,7063,570,298,0,0,7931,241523,12911,527,882,41,52,179,26,272,26,414,156,6374,689,0,0,26314,28096,26179,25562.333333,23196,2983,22480,686,0,30,2774,209,4813,34,2351,102,NA,NA,19,45,NA,2063,0.260119,52,80,37,0.711538,"Conferred research/scholarship doctoral degrees",0,0,1,18,17,9665,3957,1865,620,610,1230,28,25,25.96101,90961,33384,0.367014,3
"11/1/23 14:27","Stephen F. Austin State University","Texas","Wildlife Ecology","Glasscock, Antoniazzi, Eversole","12/1/2023","https://careers.sfasu.edu/postings/10839","11/1/23 15:02","Good pay and stability for several years. Opportunity to work on a diverse array of projects.","Unmatched",NA,NA,NA,NA,NA,NA,NA,NA,NA,NA,NA,NA,NA,NA,NA,NA,NA,NA,NA,NA,NA,NA,NA,NA,NA,NA,NA,NA,NA,NA,NA,NA,NA,NA,NA,NA,NA,NA,NA,NA,NA,NA,NA,NA,NA,NA,NA,NA,NA,NA,NA,NA,NA,NA,NA,NA,NA,NA,NA,NA,NA,NA,NA,NA,NA,NA,NA,NA,NA,NA,NA,NA,NA,NA,NA,NA,NA,NA,NA,NA,NA,NA,NA,NA,NA,NA,NA,NA,NA,NA,NA,NA,NA,NA,NA,NA
"11/1/23 13:28","Bigelow Laboratory for Ocean Sciences","Maine","Environmental Chemistry","Christoph Aeppli","11/1/2023","https://bigelow.freshteam.com/jobs/uPudksYiHX_7/postdoctoral-research-scientist-in-environmental-chemistry","","","Unmatched",NA,NA,NA,NA,NA,NA,NA,NA,NA,NA,NA,NA,NA,NA,NA,NA,NA,NA,NA,NA,NA,NA,NA,NA,NA,NA,NA,NA,NA,NA,NA,NA,NA,NA,NA,NA,NA,NA,NA,NA,NA,NA,NA,NA,NA,NA,NA,NA,NA,NA,NA,NA,NA,NA,NA,NA,NA,NA,NA,NA,NA,NA,NA,NA,NA,NA,NA,NA,NA,NA,NA,NA,NA,NA,NA,NA,NA,NA,NA,NA,NA,NA,NA,NA,NA,NA,NA,NA,NA,NA,NA,NA,NA,NA,NA,NA
