"8/9/24 6:50","University of Arkansas","Arkansas","Evolutionary Biology","10/4/2024","https://uasys.wd5.myworkdayjobs.com/en-US/UASYS/details/Assistant-Professor-of-Evolutionary-Biology_R0060075-1?q=Evolutionary+Biology","Asst Prof","Tenure Stream","10/29/24 14:29","1) possible inside hire fyi. 2) I am in the department and it is definitely NOT an inside hire, this is a very broad search. I don't think they have a specific thing in mind. 3) nothing screams red flag like including the following in your job ad: ""Regular, reliable, and non-disruptive attendance is an essential job duty..."". (4) a lot of people now expect to be able to work remotely. I think its interesting and honest that they are saying this in the job ad. Cause later if a prof simply does not show up it is a thing to consider when they came up for tenure reviews. (5) Unfortunately what 3 pointed out does need to be said, I've seen tenure cases denied because the person was just never seen in the department.#1) @#2 THanks! I was aware of some movement that raised that possiblity. WOuldn't stop me from applying! (6) Does theoretical/mathematical biology count? Applications in biomedicine? 7) It's the non-disruptive part of that sentence that's the biggest red flag! You usually don't say something like that unless there's been an issue with diruptive behavior in the departmnet. 8) #2 again, that language is standard for the entire university. All job ads at UArk include an identical sentance regardless of college/dept. I'm not TT faculty but from my perspective, the dept has a good environment and people seem to get along well. I really like it here. @6 I think if you fit under the broad evolutionary umbrella you should apply. 9) I did not receive a request for letter writer contacts after application submission. Did anyone else? x2 10) @9 I got the request a few days after submission x 4. 11) Letters requested 12) My letters were requested automatically when contact info was requested, so maybe we can't read into it too much. 12) @11 good to know 13) I wish it had been clear.  I got all excited that I got letter requests figuring it was almost to the phone interview stage.  Talk about disappointment x2 14) Any updates? x3 15) none here x7 16) Worth reaching out to the search chair? 17) nah, i'd wait til at least the 6 week mark, unless you have another offer in hand 18) I would not bother them at all.  either they are contacting you or they aren't.  Odds are not good no matter who you are! ","27","Match, exact","University of Arkansas","AR",106397,"Fayetteville","R1 Doctoral Universities: Very High Research Activity","Professions plus arts & sciences, high graduate coexistence","Research Doctoral: Comprehensive programs, no medical/veterinary school","Four-year, full-time, selective, lower transfer-in","High undergraduate","Four-year, large, primarily residential","Not Classified","Southeast AL AR FL GA KY LA MS NC SC TN VA WV","Public, 4-year or above","Four or more years","Public",1,"City Small","Yes","No","No","No",NA,"No","No","No","No","No",0,5470,1120,204,130,0,6924,141283,24604,85,1036,18,21,106,59,145,59,549,701,1631,3839,0,0,27559,30137,27562,23900.666667,22825,4737,20247,2377,5,196,1818,2919,4685,43,1022,331,NA,NA,27,52,NA,1698,0.245234,71,111,43,0.605634,"Conferred research/scholarship doctoral degrees",0,0,1,22,16,6232,1139,4187,550,540,1090,23,21,22.572287,19777,15361,0.77671,2
"8/8/24 21:45","St. Mary's College of Maryland","Maryland","Microbiology","9/1/2024","https://www.smcm.edu/hr/smcm-job/assistant-professor-of-microbiology/","Asst Prof","Tenure Stream","10/18/24 14:49","Teaching responsibilities will include participation in one or more of our core biology courses (Principles of Biology I and II, Genetics, and Ecology and Evolution), an upper division laboratory course in microbiology, and further opportunities to teach electives and biology laboratories in the candidates specialty. 2) Zoom invite 9/19 x3 3) I know it's a bit early, but did anyone hear anything about on campus? I got the feeling my Zoom didn't go well. 4) I zoomed but haven't heard anything yet and I felt like it went well (10/18). 5) on campus invite 10/18","4","Match, exact","St. Mary's College of Maryland","MD",163912,"St. Mary's City","Baccalaureate Colleges: Arts & Sciences Focus","Arts & sciences focus, no graduate coexistence","Postbaccalaureate: Single program-Education","Four-year, full-time, selective, lower transfer-in","Very high undergraduate","Four-year, small, highly residential","Not Classified","Mid East DE DC MD NJ NY PA","Public, 4-year or above","Four or more years","Public",1,"Suburb Small","No","No","No","No",NA,"No","No","Yes","No","No",0,403,21,0,0,0,424,NA,NA,NA,NA,NA,NA,NA,NA,0,0,0,21,360,43,0,0,1489,1611,1508,1464,1486,22,1420,47,0,19,22,0,377,4,77,2,NA,NA,16,45,NA,83,0.195755,22,1,0,0,"Did not confer research/scholarship doctoral degrees",1,0,0,1,0,1507,322,82,550,520,1070,23,21,21.405941,2604,2058,0.790323,2
"8/8/24 21:44","St. Mary's College of Maryland","Maryland","Molecular Biology","9/1/2024","https://www.smcm.edu/hr/smcm-job/3413/","Asst Prof","Tenure Stream","10/31/24 5:47","Teaching responsibilities will include participation in one or more of our core biology courses (Principles of Biology I and II, Genetics, and Ecology and Evolution), an upper division laboratory course in molecular biology, and further opportunities to teach electives and biology laboratories in the candidates specialty. 2) Zoom invite 9/19 x3 3) has anyone else that had a zoom interview heard about on campus invites yet?","6","Match, exact","St. Mary's College of Maryland","MD",163912,"St. Mary's City","Baccalaureate Colleges: Arts & Sciences Focus","Arts & sciences focus, no graduate coexistence","Postbaccalaureate: Single program-Education","Four-year, full-time, selective, lower transfer-in","Very high undergraduate","Four-year, small, highly residential","Not Classified","Mid East DE DC MD NJ NY PA","Public, 4-year or above","Four or more years","Public",1,"Suburb Small","No","No","No","No",NA,"No","No","Yes","No","No",0,403,21,0,0,0,424,NA,NA,NA,NA,NA,NA,NA,NA,0,0,0,21,360,43,0,0,1489,1611,1508,1464,1486,22,1420,47,0,19,22,0,377,4,77,2,NA,NA,16,45,NA,83,0.195755,22,1,0,0,"Did not confer research/scholarship doctoral degrees",1,0,0,1,0,1507,322,82,550,520,1070,23,21,21.405941,2604,2058,0.790323,2
"8/8/24 21:33","Luther College","Iowa","Ecology","9/6/2024","https://secure6.saashr.com/ta/6189870.careers?ShowJob=570873155","Asst Prof","Tenure Stream","8/19/24 8:58","Anyone else think of the live Dave Matthews/Tim Reynolds album when they saw this? Only reason I've heard of this place!","1","Match, exact","Luther College","IA",153834,"Decorah","Baccalaureate Colleges: Arts & Sciences Focus","Arts & sciences plus professions, no graduate coexistence","Not classified (Exclusively Undergraduate)","Four-year, full-time, selective, lower transfer-in","Exclusively undergraduate four-year","Four-year, small, highly residential","Not Classified","Plains IA KS MN MO NE ND SD","Private not-for-profit, 4-year or above","Four or more years","Private not-for-profit",1,"Town Remote","No","No","No","No",NA,"No","No","No","No","No",0,469,0,0,0,0,469,NA,NA,NA,NA,NA,NA,NA,NA,0,0,0,0,314,155,0,0,1951,1984,1802,1784,1802,0,1769,25,6,2,0,0,452,1,24,0,NA,NA,20,50,NA,71,0.151386,39,0,0,0,"Did not confer research/scholarship doctoral degrees",0,0,0,0,0,2156,106,367,510,520,1030,23,20,22.327696,3640,2340,0.642857,2
"8/8/24 15:41","University of Southampton","United Kingdom","Biological Sciences","9/30/2024","https://jobs.soton.ac.uk/Vacancy.aspx?ref=2804124BJ","Asst / Assoc Prof","Tenure Stream","10/30/24 1:01","1) I am a current academic at USoton and happy to answer questions. I quite like it here! The uni is growing and we are hiring for 7 positions (Seven Faculty positions in Biological Sciences Including Microbial Biofilms, Plant Sciences, Neuroscience, Computational Biology, Advanced Cell Models and Biological Sciences) (2) Do they have insect housing facilities, and decent technical support? (3) Any idea of what field might be preferred for the 'open' post? +1 4) Hi 1, any full professorial searches happening? 5) @1 do they have good mass spectrometry based capabilities? Or any proteomics and metabolomics capabilitites? 6) @5 google can answer that: https://www.southampton.ac.uk/~msweb/. 1) Here. Sorry for the slow reply. We do have insect facilities - one of the academics houses bees in there and it is a dedicated lab. For the open post, it really is pretty open but the school has been wanting to push for BBSRC funding so within the remit will be generally important. There are professorial posts (e.g. one in plant science). We do have a few mass specs around, most of them are for targeted work (glycobiology etc). We are funding a large precision biosciences initiative and the person running it is keen on proteomics, so that will expand 7) Oct 11th, received update from HR that review/shortlisting will be complete by Oct 29th. I presume everyone got this email. x4 8) Oct 29, received email notifying further delay. Shortlisting now expected to be completed by 2-3 weeks. x4","1","International",NA,NA,NA,NA,NA,NA,NA,NA,NA,NA,NA,NA,NA,NA,NA,NA,NA,NA,NA,NA,NA,NA,NA,NA,NA,NA,NA,NA,NA,NA,NA,NA,NA,NA,NA,NA,NA,NA,NA,NA,NA,NA,NA,NA,NA,NA,NA,NA,NA,NA,NA,NA,NA,NA,NA,NA,NA,NA,NA,NA,NA,NA,NA,NA,NA,NA,NA,NA,NA,NA,NA,NA,NA,NA,NA,NA,NA,NA,NA,NA,NA,NA,NA,NA,NA,NA,NA,NA,NA,NA,NA,NA,NA,NA,NA,NA
"8/8/24 15:39","University of Southampton","United Kingdom","Microbial Biofilms","9/30/2024","https://jobs.soton.ac.uk/Vacancy.aspx?ref=2799824BJ","Assoc Prof","Tenure Stream","","","","International",NA,NA,NA,NA,NA,NA,NA,NA,NA,NA,NA,NA,NA,NA,NA,NA,NA,NA,NA,NA,NA,NA,NA,NA,NA,NA,NA,NA,NA,NA,NA,NA,NA,NA,NA,NA,NA,NA,NA,NA,NA,NA,NA,NA,NA,NA,NA,NA,NA,NA,NA,NA,NA,NA,NA,NA,NA,NA,NA,NA,NA,NA,NA,NA,NA,NA,NA,NA,NA,NA,NA,NA,NA,NA,NA,NA,NA,NA,NA,NA,NA,NA,NA,NA,NA,NA,NA,NA,NA,NA,NA,NA,NA,NA,NA,NA
"8/8/24 9:47","UC Davis","California","Insect Biology","10/31/2024","https://recruit.ucdavis.edu/JPF06649?utm_source=Indeed&utm_medium=organic&utm_campaign=Indeed","Asst Prof","Tenure Stream","11/1/24 11:50","This looks similar to last year's search (but higher pay and slightly different classes), but I don't have any knowledge about if that failed or if this is a new position. 2) Yes, definitely looks the same position and I know people that have been interviewed for that position this year, but dont know the outcome 3) Davis is notoriously slow. I wouldn't be surprised if the committee took so long to pick someone that admins shut down the search 4) No. This is a second position https://x.com/joanna_c_chiu/status/1821731889981616444 . 5) A record number of retirements this year, I expect to see even more jobs posted from here. The Entomology program is very strong here. x4 6) Is indeed a new position. AFAIK an offer was accepted for the first. 7) Interviewed for last year's position and wasn't hired; I can confirm they did hire someone and this is another hire. 8) Do Future research plans need to be a separate statement or can they be worked into the Research Statement as usual? x 2. 9) @8, what did you end up doing? Did you write in a new future plan statement or work it into your research statement? 10) Wrote a statment summarizing future directions (the detailed one was is the research statement). 11) What lengths did you all choose for statements? Wasn't specified anywhere.","24","Match, by alias","University of California-Davis","CA",110644,"Davis","R1 Doctoral Universities: Very High Research Activity","Arts & sciences plus professions, high graduate coexistence","Research Doctoral: Comprehensive programs, with medical/veterinary school","Four-year, full-time, more selective, higher transfer-in","High undergraduate","Four-year, large, primarily residential","Classified","Far West AK CA HI NV OR WA","Public, 4-year or above","Four or more years","Public",1,"Suburb Small","Yes","Yes","No","No",NA,"No","No","No","No","No",0,9389,1388,517,414,0,11708,804674,12019,1381,2386,65,60,353,39,478,39,842,960,6186,3203,0,0,38634,41236,39074,37996.666667,31162,7912,30166,976,20,0,7272,640,6000,144,2998,79,NA,NA,24,26,NA,1685,0.143919,78,150,48,0.615385,"Conferred research/scholarship doctoral degrees",0,0,1,24,19,8284,5509,2024,570,590,1160,25,24,24.268684,76897,35645,0.463542,3
"8/8/24 3:41","University of Essex","United Kingdom","Evolutionary Biology","9/16/2024","https://vacancies.essex.ac.uk/tlive_webrecruitment/wrd/run/ETREC107GF.open?VACANCY_ID=202575WW5Z&WVID=9918109NEm&LANG=USA","Asst Prof","Tenure Stream","9/6/24 6:39","1) Can anyone explain the REF Framework? (e.g., ""In addition, it is essential that you have a clear publication plan for submission to future Research Excellence Framework (REF) programmes and evidence of a research agenda, engagement in high-quality research activity and a developing research profile. As part of the process and to be successful you will be required to demonstrate how your research has been impactful within and beyond the academic sphere, recognising the importance of this and the effect it will have on the University."")","3","International",NA,NA,NA,NA,NA,NA,NA,NA,NA,NA,NA,NA,NA,NA,NA,NA,NA,NA,NA,NA,NA,NA,NA,NA,NA,NA,NA,NA,NA,NA,NA,NA,NA,NA,NA,NA,NA,NA,NA,NA,NA,NA,NA,NA,NA,NA,NA,NA,NA,NA,NA,NA,NA,NA,NA,NA,NA,NA,NA,NA,NA,NA,NA,NA,NA,NA,NA,NA,NA,NA,NA,NA,NA,NA,NA,NA,NA,NA,NA,NA,NA,NA,NA,NA,NA,NA,NA,NA,NA,NA,NA,NA,NA,NA,NA,NA
"8/7/24 19:01","Oregon State University","Oregon","Aquaculture","10/15/2024","https://jobs.oregonstate.edu/postings/158087?utm_source=Indeed&utm_medium=organic&utm_campaign=Indeed","Asst Prof","Tenure Stream","8/18/24 12:47","Emphasis on shellfish and seaweeds 2) I read this first as ""selfish seaweeds"" which I'm very into 3) @2 that would be a cool research project. LOL. 3) @2 I read same thing!  Would fit right in with the Spider Personality guy that faked all his papers. ","","Match, exact","Oregon State University","OR",209542,"Corvallis","R1 Doctoral Universities: Very High Research Activity","Professions plus arts & sciences, high graduate coexistence","Research Doctoral: Comprehensive programs, with medical/veterinary school","Four-year, medium full-time , selective, higher transfer-in","High undergraduate","Four-year, large, primarily nonresidential","Classified","Far West AK CA HI NV OR WA","Public, 4-year or above","Four or more years","Public",1,"City Small","Yes","Yes","No","No",NA,"No","No","No","No","No",0,6100,1037,272,138,0,7547,262426,5959,324,915,12,3,192,65,207,65,664,511,2337,3763,0,0,31719,37586,32312,25139.333333,26644,5668,17925,8123,159,437,3469,2199,3125,449,1742,877,NA,NA,25,14,NA,1355,0.179542,75,139,41,0.546667,"Conferred research/scholarship doctoral degrees",0,0,1,21,16,5055,2327,1344,540,540,1080,21,21,21,17374,14284,0.822148,2
"8/7/24 7:12","American University","District of Columbia","Environmental Health","10/18/2024","https://american.wd1.myworkdayjobs.com/AU/job/Main-Campus-Washington-DC/%20Assistant-Professor_R1547","Asst Prof","Tenure Stream","11/1/24 12:54","1) Anyone know anything about departmental culture here? 2) zoom interview requested 11/1","2","Match, exact","American University","DC",131159,"Washington","R2 Doctoral Universities: High Research Activity","Arts & sciences plus professions, high graduate coexistence","Research Doctoral: Comprehensive programs, no medical/veterinary school","Four-year, full-time, more selective, lower transfer-in","Majority undergraduate","Four-year, large, highly residential","Not Classified","Mid East DE DC MD NJ NY PA","Private not-for-profit, 4-year or above","Four or more years","Private not-for-profit",1,"City Large","No","No","No","No",NA,"No","No","No","No","Yes",0,1979,1940,61,382,0,4362,37505,34334,2,506,24,10,6,21,40,21,813,1509,1292,687,0,0,14318,16032,14001,11597.666667,7953,6048,7103,407,350,93,2943,3105,1585,22,167,21,NA,NA,25,45,NA,1132,0.259514,44,78,29,0.659091,"Conferred research/scholarship doctoral degrees",0,0,1,23,8,4219,800,494,630,590,1220,27,25,25.763524,20036,7744,0.386504,3
"8/7/24 7:10","University of Georgia","Georgia","Tree Biology, Structure, and Health Care","9/15/2024","https://www.ugajobsearch.com/postings/363253","Asst / Assoc Prof","Tenure Stream","9/16/24 8:28","What is outreach?","","Match, exact","University of Georgia","GA",139959,"Athens","R1 Doctoral Universities: Very High Research Activity","Professions plus arts & sciences, high graduate coexistence","Research Doctoral: Comprehensive programs, with medical/veterinary school","Four-year, full-time, more selective, higher transfer-in","High undergraduate","Four-year, large, primarily residential","Classified","Southeast AL AR FL GA KY LA MS NC SC TN VA WV","Public, 4-year or above","Four or more years","Public",1,"City Midsize","Yes","Yes","No","No",NA,"No","No","No","No","No",0,8568,1979,528,431,0,11506,419656,63130,256,1660,44,70,222,192,336,192,741,1669,3427,5141,0,22,38920,42941,39147,36349.666667,29765,9382,27877,1828,11,49,7063,2319,5603,43,1486,116,NA,NA,28,52,NA,2920,0.253781,98,184,59,0.602041,"Conferred research/scholarship doctoral degrees",1,0,0,24,22,10050,3835,3585,630,620,1250,29,26,27.449461,28206,13647,0.483833,3
"8/7/24 5:22","Arctic University of Norway","Norway","Coastal Ecology & Sustainability","9/30/2024","https://www.jobbnorge.no/en/available-jobs/job/264733/associate-professor-in-coastal-ecology-and-sustainability","Assoc Prof","Tenure Stream","9/25/24 4:35","*Associate Professor, not Assistant Professor 2) In the Norwegian system this position is more equivalent to assistant professor, i.e. it is expected all applicants with a doctorate are qualified to apply. [deadline extended to 30 September -AP]","","International",NA,NA,NA,NA,NA,NA,NA,NA,NA,NA,NA,NA,NA,NA,NA,NA,NA,NA,NA,NA,NA,NA,NA,NA,NA,NA,NA,NA,NA,NA,NA,NA,NA,NA,NA,NA,NA,NA,NA,NA,NA,NA,NA,NA,NA,NA,NA,NA,NA,NA,NA,NA,NA,NA,NA,NA,NA,NA,NA,NA,NA,NA,NA,NA,NA,NA,NA,NA,NA,NA,NA,NA,NA,NA,NA,NA,NA,NA,NA,NA,NA,NA,NA,NA,NA,NA,NA,NA,NA,NA,NA,NA,NA,NA,NA,NA
"8/6/24 12:43","University of Maine","Maine","Forest Science","9/20/2024","https://fa-ewca-saasfaprod1.fa.ocs.oraclecloud.com/hcmUI/CandidateExperience/en/sites/CX_1/job/260/?lastSelectedFacet=CATEGORIES&selectedCategoriesFacet=300000014335735","Asst Prof","Fixed Term Academic","10/24/24 7:34","1) Anyone know the story on this? A 2-year position with 50% research and grad student mentoring seems unusual. 2) It's effectively a VAP, which is not that uncommon (it's just at an R1 and not at a SLAC). My understanding is that this is to help fill a gap with someone moving into a department chair position and someone retiring, as well as some sabbaticals. 3) Teaching grad-level courses and directly advising students is pretty unusual for a visiting position. 4) 2 here again -- the program has a non-thesis MS in Forestry, which is part of where the mentoring and graduate teaching comes in. 5) Zoom interview received 10/9. 6) On campus visit invitation Oct 23. x2","1","Match, exact","University of Maine","ME",161253,"Orono","R1 Doctoral Universities: Very High Research Activity","Professions plus arts & sciences, high graduate coexistence","Research Doctoral: Comprehensive programs, no medical/veterinary school","Four-year, full-time, inclusive, lower transfer-in","High undergraduate","Four-year, medium, primarily residential","Classified","New England CT ME MA NH RI VT","Public, 4-year or above","Four or more years","Public",1,"Suburb Small","Yes","No","No","No",NA,"No","No","No","No","No",0,1910,437,62,0,0,2409,124999,9184,136,437,3,9,45,5,57,5,167,270,650,1260,0,0,11561,13426,11741,9685.666667,9465,2276,7836,1034,11,584,811,1465,2014,45,362,112,NA,NA,25,52,NA,375,0.155666,63,76,36,0.571429,"Conferred research/scholarship doctoral degrees",0,0,1,19,13,3117,0,0,0,0,0,0,0,0,14785,13633,0.922083,1
"8/6/24 10:45","Trinity University","Texas","Environmental Geosciences","10/21/2024","https://trinity.wd1.myworkdayjobs.com/en-US/Trinity_University/details/Assistant-Professor---Earth---Environmental-Geosciences_JR100840","Asst Prof","Tenure Stream","10/9/24 20:08","Additional info about posting also available on TOS website at https://jobs.tos.org/job/assistant-professor-of-environmental-geosciences/74642528/. Note, ABD candidates are eligible. 1) How strict is the requirement for a Ph.D. in geosciences as oposed other diciplines?","","Match, exact","Trinity University","TX",229267,"San Antonio","Baccalaureate Colleges: Arts & Sciences Focus","Arts & sciences plus professions, some graduate coexistence","Postbaccalaureate: Education-dominant, with other professional programs","Four-year, full-time, more selective, lower transfer-in","Very high undergraduate","Four-year, small, highly residential","Not Classified","Southwest AZ NM OK TX","Private not-for-profit, 4-year or above","Four or more years","Private not-for-profit",1,"City Large","No","No","No","No",NA,"No","No","No","No","No",0,677,95,0,0,0,772,NA,NA,NA,NA,NA,NA,NA,NA,0,0,0,95,481,196,0,0,2606,2843,2677,2612.333333,2504,173,2457,34,0,13,123,50,634,0,27,0,NA,NA,18,52,NA,165,0.213731,44,7,1,0.022727,"Did not confer research/scholarship doctoral degrees",1,0,0,4,0,2136,438,353,630,620,1250,28,26,26.892541,9394,3158,0.336172,3
"8/5/24 22:21","Universitt Osnabrck","Germany","Microbial Ecology & Evolution","8/25/2024","https://www.uni-osnabrueck.de/universitaet/stellenangebote/stellenangebote-detail/170-fb-5-research-assistant-mfd/","Senior Staff Scientist","Tenure Stream","8/27/24 8:37","See also https://x.com/KostChristian/status/1820400234364559653 ; (2) For me it's a massive red flag that Christian Kost puts out a 'dream job alert ' ( https://x.com/KostChristian/status/1814589689963155461 ) for someone to work for/under him. Perhaps I'm being overly critical, but this suggests a massive ego to me, and therefore it's a red flag. 3) The German system is... peculiar 4) The ad mentions opportunity to start own research group, but after contacting the PI he said there is no current plan for that, but that one can apply for external funding to make that happen...","","International",NA,NA,NA,NA,NA,NA,NA,NA,NA,NA,NA,NA,NA,NA,NA,NA,NA,NA,NA,NA,NA,NA,NA,NA,NA,NA,NA,NA,NA,NA,NA,NA,NA,NA,NA,NA,NA,NA,NA,NA,NA,NA,NA,NA,NA,NA,NA,NA,NA,NA,NA,NA,NA,NA,NA,NA,NA,NA,NA,NA,NA,NA,NA,NA,NA,NA,NA,NA,NA,NA,NA,NA,NA,NA,NA,NA,NA,NA,NA,NA,NA,NA,NA,NA,NA,NA,NA,NA,NA,NA,NA,NA,NA,NA,NA,NA
"8/5/24 22:18","University of the Philippines Manila","Asia (Other)","Botany","","https://x.com/jasperidium/status/1819381821811183747","Asst / Assoc Prof","Tenure Stream","","","","International",NA,NA,NA,NA,NA,NA,NA,NA,NA,NA,NA,NA,NA,NA,NA,NA,NA,NA,NA,NA,NA,NA,NA,NA,NA,NA,NA,NA,NA,NA,NA,NA,NA,NA,NA,NA,NA,NA,NA,NA,NA,NA,NA,NA,NA,NA,NA,NA,NA,NA,NA,NA,NA,NA,NA,NA,NA,NA,NA,NA,NA,NA,NA,NA,NA,NA,NA,NA,NA,NA,NA,NA,NA,NA,NA,NA,NA,NA,NA,NA,NA,NA,NA,NA,NA,NA,NA,NA,NA,NA,NA,NA,NA,NA,NA,NA
"8/5/24 15:56","Simon Fraser University","Canada","Biological Control","9/17/2024","https://www.sfu.ca/biology/about/employment/faculty/faculty-thelma-finlayson-chair-repost.html","Asst / Assoc Prof","Tenure Stream","10/22/24 2:23","Failed search from last year. Thelma Finlayson Chair in Biological Control. Comment from a committee member:  The very general position description is purposefully written to be broad.  This may make it so you don't see yourself in it.  But Biology at SFU includes significant research strength in ecology and evolutionary biology, and we would love to see applications from ecologists or evolutionary biologists who study, for example, invasive species impacts and control, the evolution of host/parasite interactions, the mechanisms of selection in new environments vs. the home range, etc.  The focus on a practical question (pests and their control) as mandated in the endowment doesn't change the need for that larger conceptual foundation of the research our new colleague will do. (2) any insights into why the search failed last year? (3). Is someone working in the marine ecosystem encouraged to apply? (4) @2 FWIW I heard that the preferred candidate ended up turning down the position (5) informed that I made long list & references requested on 17 Oct x3","4","International",NA,NA,NA,NA,NA,NA,NA,NA,NA,NA,NA,NA,NA,NA,NA,NA,NA,NA,NA,NA,NA,NA,NA,NA,NA,NA,NA,NA,NA,NA,NA,NA,NA,NA,NA,NA,NA,NA,NA,NA,NA,NA,NA,NA,NA,NA,NA,NA,NA,NA,NA,NA,NA,NA,NA,NA,NA,NA,NA,NA,NA,NA,NA,NA,NA,NA,NA,NA,NA,NA,NA,NA,NA,NA,NA,NA,NA,NA,NA,NA,NA,NA,NA,NA,NA,NA,NA,NA,NA,NA,NA,NA,NA,NA,NA,NA
"8/5/24 11:27","New Mexico State University","New Mexico","Dept Chair: Fish, Wildlife, & Conservation Ecology","8/30/2024","https://careers.nmsu.edu/jobs/academic-department-head-fish-wildlife-conservation-ecology-las-cruces-new-mexico-united-states","Assoc / Full Prof","Tenure Stream","","","","Match, by alias","New Mexico State University-Main Campus","NM",188030,"Las Cruces","R2 Doctoral Universities: High Research Activity","Professions plus arts & sciences, high graduate coexistence","Research Doctoral: Comprehensive programs, no medical/veterinary school","Four-year, full-time, inclusive, lower transfer-in","High undergraduate","Four-year, large, primarily residential","Classified","Southwest AZ NM OK TX","Public, 4-year or above","Four or more years","Public",1,"Suburb Midsize","Yes","No","No","No","Yes","Yes","No","No","No","No",5,2429,658,113,13,0,3218,105817,1458,62,612,6,10,41,56,57,56,291,380,771,1658,5,0,14296,16064,14227,11983,11575,2652,9454,1653,12,456,1395,1257,2146,23,357,85,NA,NA,27,52,NA,476,0.147918,68,80,39,0.573529,"Conferred research/scholarship doctoral degrees",1,0,0,21,14,3517,710,1511,480,470,950,17,18,17.319676,13715,8595,0.626686,1
