"10/23/24 6:22","UC San Diego","California","Evolutionary genomics","Diana Rennison","","https://x.com/lifeatthebench/status/1848804515505705286","11/7/24 11:11","Unsolicited shout out to Diana! She is awesome","Match, by alias","University of California-San Diego","CA",110680,"La Jolla","R1 Doctoral Universities: Very High Research Activity","Arts & sciences plus professions, high graduate coexistence","Research Doctoral: Comprehensive programs, with medical/veterinary school","Four-year, full-time, more selective, higher transfer-in","High undergraduate","Four-year, large, highly residential","Not Classified","Far West AK CA HI NV OR WA","Public, 4-year or above","Four or more years","Public",1,"City Large","Yes","Yes","No","No",NA,"No","No","No","No","No",0,8395,2235,553,193,0,11376,1395348,8387,1764,2482,43,43,425,42,511,42,1771,657,6695,1700,0,0,38736,40547,39576,38573.333333,31842,7734,30939,888,0,15,7133,601,6423,24,3251,83,NA,NA,24,26,NA,1868,0.164205,70,117,44,0.628571,"Conferred research/scholarship doctoral degrees",0,0,1,20,18,17598,5723,2191,620,650,1270,28,26,26.553702,100062,36634,0.366113,3
"10/22/24 10:53","Cal Poly Humboldt","California","Microbial Ecology","Catalina Cuellar-Gempeler","12/1/2024","https://cuellar-gempeler-lab.weebly.com/postdoc-opportunity.html","10/28/24 8:20","Contact PI with inquiries: cc349@humboldt.edu.","Match, by alias","California State Polytechnic University-Humboldt","CA",115755,"Arcata","Master's Colleges & Universities: Larger Programs","Balanced arts & sciences/professions, some graduate coexistence","Postbaccalaureate: Comprehensive programs","Four-year, full-time, inclusive, higher transfer-in","Very high undergraduate","Four-year, medium, primarily residential","Not Classified","Far West AK CA HI NV OR WA","Public, 4-year or above","Four or more years","Public",1,"Town Remote","No","No","No","No","Yes","Yes","No","No","No","No",0,1843,209,0,0,0,2052,NA,NA,NA,NA,NA,NA,NA,NA,0,0,116,93,1069,774,0,0,7180,7813,6612,5966.666667,6008,604,5238,753,0,17,406,198,532,14,837,136,NA,NA,22,3,NA,367,0.17885,42,12,9,0.214286,"Did not confer research/scholarship doctoral degrees",0,0,1,9,0,2069,495,138,490,480,970,17,18,17.781991,10198,8683,0.851441,1
"10/22/24 6:50","Black Rock Forest","New York","Wildlife Ecology","Scott LaPoint","11/8/2024","https://www.blackrockforest.org/black-rock-forest-postdoctoral-fellowship-program","11/5/24 22:18","PI here: several pathways exist for this position, so read the details and reach out. Particularly interested in proposals that capitalize on our existing efforts in camera trap surveys, white-tailed deer population monitoring, landscape connectivity, and/or road ecology","Unmatched",NA,NA,NA,NA,NA,NA,NA,NA,NA,NA,NA,NA,NA,NA,NA,NA,NA,NA,NA,NA,NA,NA,NA,NA,NA,NA,NA,NA,NA,NA,NA,NA,NA,NA,NA,NA,NA,NA,NA,NA,NA,NA,NA,NA,NA,NA,NA,NA,NA,NA,NA,NA,NA,NA,NA,NA,NA,NA,NA,NA,NA,NA,NA,NA,NA,NA,NA,NA,NA,NA,NA,NA,NA,NA,NA,NA,NA,NA,NA,NA,NA,NA,NA,NA,NA,NA,NA,NA,NA,NA,NA,NA,NA,NA,NA,NA
"10/21/24 13:33","University of California - Los Angeles","California","La Kretz Center California Conservation Fellowship","Brad Shaffer","11/25/2024","https://www.ioes.ucla.edu/jobs/postdoctoral-fellowship-for-the-la-kretz-center-for-california-conservation-science/","11/18/24 13:38","DEADLINE APPROACHING","Match, partial","University of California-Los Angeles","CA",110662,"Los Angeles","R1 Doctoral Universities: Very High Research Activity","Arts & sciences focus, high graduate coexistence","Research Doctoral: Comprehensive programs, with medical/veterinary school","Four-year, full-time, more selective, higher transfer-in","Majority undergraduate","Four-year, large, highly residential","Classified","Far West AK CA HI NV OR WA","Public, 4-year or above","Four or more years","Public",1,"City Large","Yes","Yes","No","No",NA,"No","No","No","No","No",0,10006,3271,676,569,0,14522,1338707,54234,1498,3481,96,97,365,118,556,117,2075,1765,9100,906,0,0,44371,46947,44589,43489,31636,12953,31068,568,0,0,11871,1082,6378,8,3743,44,NA,NA,24,45,NA,2910,0.200386,71,166,53,0.746479,"Conferred research/scholarship doctoral degrees",0,0,1,20,21,19093,0,0,0,0,0,0,0,0,108870,15602,0.1433085,3
"10/21/24 7:59","Bigelow Laboratory for Ocean Sciences","Maine","data-modeling, ocean forecasting, ","Nick Record","11/26/2024","https://bigelow.freshteam.com/jobs/XDznU-zQFpPm/assistant-director-tandy-center-for-ocean-forecasting","10/21/24 11:16","Is this a permanent position?","Unmatched",NA,NA,NA,NA,NA,NA,NA,NA,NA,NA,NA,NA,NA,NA,NA,NA,NA,NA,NA,NA,NA,NA,NA,NA,NA,NA,NA,NA,NA,NA,NA,NA,NA,NA,NA,NA,NA,NA,NA,NA,NA,NA,NA,NA,NA,NA,NA,NA,NA,NA,NA,NA,NA,NA,NA,NA,NA,NA,NA,NA,NA,NA,NA,NA,NA,NA,NA,NA,NA,NA,NA,NA,NA,NA,NA,NA,NA,NA,NA,NA,NA,NA,NA,NA,NA,NA,NA,NA,NA,NA,NA,NA,NA,NA,NA,NA
"10/21/24 7:26","Imperial College London (Silwood Park)","United Kingdom","Plant/Soil Microbial Ecology","Peter Graystock","11/20/2024","https://www.imperial.ac.uk/jobs/search-jobs/description/index.php?jobId=21411","","","International",NA,NA,NA,NA,NA,NA,NA,NA,NA,NA,NA,NA,NA,NA,NA,NA,NA,NA,NA,NA,NA,NA,NA,NA,NA,NA,NA,NA,NA,NA,NA,NA,NA,NA,NA,NA,NA,NA,NA,NA,NA,NA,NA,NA,NA,NA,NA,NA,NA,NA,NA,NA,NA,NA,NA,NA,NA,NA,NA,NA,NA,NA,NA,NA,NA,NA,NA,NA,NA,NA,NA,NA,NA,NA,NA,NA,NA,NA,NA,NA,NA,NA,NA,NA,NA,NA,NA,NA,NA,NA,NA,NA,NA,NA,NA,NA
"10/21/24 7:09","Memorial University","Canada","Marine Ecology and Climate Change","Dr. Tyler Eddy","10/21/2024","https://static1.squarespace.com/static/5d780889f144187aeb002f90/t/66ffe6a20f5a2f4f5d0c4b8f/1728046754512/MUN+Postdoc+ad+2024+-+Climate+Change.pdf","","","International",NA,NA,NA,NA,NA,NA,NA,NA,NA,NA,NA,NA,NA,NA,NA,NA,NA,NA,NA,NA,NA,NA,NA,NA,NA,NA,NA,NA,NA,NA,NA,NA,NA,NA,NA,NA,NA,NA,NA,NA,NA,NA,NA,NA,NA,NA,NA,NA,NA,NA,NA,NA,NA,NA,NA,NA,NA,NA,NA,NA,NA,NA,NA,NA,NA,NA,NA,NA,NA,NA,NA,NA,NA,NA,NA,NA,NA,NA,NA,NA,NA,NA,NA,NA,NA,NA,NA,NA,NA,NA,NA,NA,NA,NA,NA,NA
"10/18/24 14:06","Columbia University","New York","Neurogenomics of Behavior and Speciation","Dr. Kira Delmore","11/1/2024","https://www.delmorelab.com/recruitment","","","Match, by alias","Columbia University in the City of New York","NY",190150,"New York","R1 Doctoral Universities: Very High Research Activity","Arts & sciences focus, high graduate coexistence","Research Doctoral: Comprehensive programs, with medical/veterinary school","Four-year, full-time, more selective, higher transfer-in","Majority graduate","Four-year, large, highly residential","Not Classified","Mid East DE DC MD NJ NY PA","Private not-for-profit, 4-year or above","Four or more years","Private not-for-profit",1,"City Large","No","Yes","No","No",NA,"No","No","No","No","No",0,2940,9178,679,831,0,13628,981906,51003,1975,3740,88,139,343,109,570,109,4726,5283,2504,436,0,0,31456,33882,30135,25913.666667,8148,21987,7509,639,0,0,16294,5693,1482,39,618,135,NA,NA,24,52,NA,1818,0.133402,60,199,51,0.85,"Conferred research/scholarship doctoral degrees",0,0,1,24,21,12459,1009,695,720,740,1460,33,32,32.407864,40462,2695,0.066606,3
"10/17/24 18:12","Vanderbilt University","Tennessee","Global Change Ecology","Lin Meng","","https://forms.gle/5B5btrBVbbt9ZFWS9","","","Match, exact","Vanderbilt University","TN",221999,"Nashville","R1 Doctoral Universities: Very High Research Activity","Arts & sciences focus, high graduate coexistence","Research Doctoral: Comprehensive programs, with medical/veterinary school","Four-year, full-time, more selective, lower transfer-in","Majority undergraduate","Four-year, large, highly residential","Not Classified","Southeast AL AR FL GA KY LA MS NC SC TN VA WV","Private not-for-profit, 4-year or above","Four or more years","Private not-for-profit",1,"City Large","No","Yes","No","No",NA,"No","No","No","No","No",0,2261,1612,307,360,0,4540,774717,50086,577,1038,30,43,174,59,246,59,434,1538,1885,376,0,0,13131,13918,13537,12718.333333,7057,6480,6983,69,0,5,5326,1154,1693,5,311,0,NA,NA,23,45,NA,680,0.14978,48,144,34,0.708333,"Conferred research/scholarship doctoral degrees",0,0,1,21,15,5079,761,958,720,750,1470,33,32,32.557301,36646,4259,0.11622,3
"10/17/24 11:18","University at Buffalo","New York","Geology, paleoclimate, biology, climate change","","10/1/2024","https://www.ubjobs.buffalo.edu/postings/52444","","","Match, exact","University at Buffalo","NY",196088,"Buffalo","R1 Doctoral Universities: Very High Research Activity","Balanced arts & sciences/professions, high graduate coexistence","Research Doctoral: Comprehensive programs, with medical/veterinary school","Four-year, full-time, selective, higher transfer-in","Majority undergraduate","Four-year, large, primarily residential","Classified","Mid East DE DC MD NJ NY PA","Public, 4-year or above","Four or more years","Public",1,"Suburb Large","No","Yes","No","No",NA,"No","No","No","No","No",0,5583,2450,362,625,0,9020,401640,20398,341,1582,33,62,209,58,304,58,1478,1597,3242,2341,0,40,31923,35509,32347,28515,22306,10041,20403,1656,32,215,6164,3877,4388,27,1481,156,NA,NA,24,14,NA,1419,0.157317,63,192,47,0.746032,"Conferred research/scholarship doctoral degrees",0,0,1,23,19,7962,2970,755,560,580,1140,23,23,23,30247,20251,0.669521,2
"10/17/24 7:39","University of Montana","Montana","Community Ecology and Evolutionary  Modeling","","12/31/2024","https://drive.google.com/file/d/1_Mbv4vFxpplsx8yTENBtDJC8GO-svTx0/view","","","Match, partial","The University of Montana","MT",180489,"Missoula","R1 Doctoral Universities: Very High Research Activity","Balanced arts & sciences/professions, high graduate coexistence","Research Doctoral: Comprehensive programs, no medical/veterinary school","Four-year, full-time, selective, higher transfer-in","High undergraduate","Four-year, medium, primarily residential","Classified","Rocky Mountains CO ID MT UT WY","Public, 4-year or above","Four or more years","Public",1,"City Small","No","No","No","No",NA,"No","No","No","No","No",331,1365,500,53,447,0,2696,101504,8714,120,390,15,1,31,6,46,6,186,761,789,576,226,195,10487,12694,9808,7822,6975,2833,5640,1257,14,64,1175,1658,1120,105,436,138,NA,NA,26,51,NA,563,0.208828,51,69,35,0.686275,"Conferred research/scholarship doctoral degrees",0,0,1,19,10,3044,330,691,540,510,1050,20,20,20,5380,5153,0.957807,2
"10/16/24 11:30","North Carolina State University","North Carolina","Cropping systems diversity, statistics in agroecology","DRIVES Team (Core Scientists)","11/15/2024","https://docs.google.com/document/d/1lUYZKc6NAVxnz4Z3F4jUkrK0OOrIuwbngkICB2t2VdI/edit?usp=sharing","","","Match, by alias","North Carolina State University at Raleigh","NC",199193,"Raleigh","R1 Doctoral Universities: Very High Research Activity","Professions plus arts & sciences, high graduate coexistence","Research Doctoral: Comprehensive programs, with medical/veterinary school","Four-year, full-time, more selective, higher transfer-in","High undergraduate","Four-year, large, primarily residential","Classified","Southeast AL AR FL GA KY LA MS NC SC TN VA WV","Public, 4-year or above","Four or more years","Public",1,"City Large","Yes","Yes","No","No",NA,"No","No","No","No","No",165,5991,2735,568,100,0,9559,528089,18201,694,1656,43,1,437,87,473,86,1866,969,2354,3637,86,79,36304,40537,36042,30890,26150,9892,22869,1802,60,1419,5385,4507,4711,36,1331,136,NA,NA,27,14,NA,2482,0.259651,73,161,48,0.657534,"Conferred research/scholarship doctoral degrees",0,0,1,22,15,10433,2344,2357,610,620,1230,27,25,26.002765,31487,14553,0.462191,3
"10/16/24 10:10","South Dakota State University","South Dakota","Ecology","Jeff Martin","11/15/2024","https://bisonjeff.weebly.com/opportunities.html#:~:text=Postdoctoral%20Project%20Coordinator","10/20/24 14:27","PI here: Position focuses on being a project coordinator for a recently funded USDA-NRCS-CIG project. We seek a candidate with broad interests in large ruminant grazing ecology, climate adaptation, rangeland management, and stakeholder engagement; a strong quantitative skillset and ability to add to it; and excellent organizational and communication skills. Location is Rapid City, SD.","Match, exact","South Dakota State University","SD",219356,"Brookings","R2 Doctoral Universities: High Research Activity","Professions plus arts & sciences, some graduate coexistence","Research Doctoral: STEM-dominant","Four-year, full-time, selective, lower transfer-in","Very high undergraduate","Four-year, medium, highly residential","Not Classified","Plains IA KS MN MO NE ND SD","Public, 4-year or above","Four or more years","Public",1,"Town Remote","Yes","No","No","No",NA,"No","No","No","No","No",87,2029,382,66,99,0,2663,60600,339,43,338,5,0,55,6,60,6,197,284,531,1498,3,84,11512,13937,11405,9335.666667,9976,1429,7772,1136,16,1052,513,916,2023,64,271,85,NA,NA,25,51,NA,616,0.231318,68,66,32,0.470588,"Conferred research/scholarship doctoral degrees",0,0,1,18,9,4620,74,2003,500,500,1000,20,19,19.964372,5290,4705,0.889414,2
"10/16/24 9:10","Michigan State University","Michigan","Avian Agroecology","Olivia Smith","11/15/2024","https://careers.msu.edu/cw/en-us/job/520859/research-associatefixed-term","10/16/24 9:59","PI here: The ad says the review date is 10/28, but I am working to get HR to update it to 11/15, which is when I will start reviewing applications. 1) Dr. Smith is a phenomenal person to work with, if I studied birds I'd absolutely apply","Match, exact","Michigan State University","MI",171100,"East Lansing","R1 Doctoral Universities: Very High Research Activity","Balanced arts & sciences/professions, high graduate coexistence","Research Doctoral: Comprehensive programs, with medical/veterinary school","Four-year, full-time, selective, lower transfer-in","High undergraduate","Four-year, large, primarily residential","Classified","Great Lakes IL IN MI OH WI","Public, 4-year or above","Four or more years","Public",1,"City Small","Yes","Yes","No","No",NA,"No","No","No","No","No",0,9516,2063,575,862,0,13016,674384,38813,662,2551,50,76,299,150,425,150,593,2332,4076,5440,113,51,49809,55406,49695,45235,38491,11204,34581,3832,7,71,8417,2787,8097,292,1112,141,NA,NA,28,52,NA,2535,0.19476,98,202,71,0.72449,"Conferred research/scholarship doctoral degrees",0,0,1,26,24,17445,6697,3042,550,550,1100,23,22,22.312352,45426,34663,0.763065,2
"10/15/24 23:58","Imperial College London","United Kingdom","soil biogeochemistry","Bonnie Waring","11/15/2024","https://www.imperial.ac.uk/jobs/search-jobs/description/index.php?jobId=21336&jobTitle=Research+Associate+in+Soil+Biogeochemistry","","","International",NA,NA,NA,NA,NA,NA,NA,NA,NA,NA,NA,NA,NA,NA,NA,NA,NA,NA,NA,NA,NA,NA,NA,NA,NA,NA,NA,NA,NA,NA,NA,NA,NA,NA,NA,NA,NA,NA,NA,NA,NA,NA,NA,NA,NA,NA,NA,NA,NA,NA,NA,NA,NA,NA,NA,NA,NA,NA,NA,NA,NA,NA,NA,NA,NA,NA,NA,NA,NA,NA,NA,NA,NA,NA,NA,NA,NA,NA,NA,NA,NA,NA,NA,NA,NA,NA,NA,NA,NA,NA,NA,NA,NA,NA,NA,NA
"10/15/24 6:57","Colorado State University","Colorado","Urban Ecology and Spatial Statistics","Sara Bombaci","10/23/2024","https://jobs.colostate.edu/postings/151833","10/15/24 6:58","The successful candidate will collaborate with Dr. Sara Bombaci and undergraduate technicians to collect and analyze data, publish research on socioeconomic status (SES)-realted biases in citizen science data, and investigate how SES, urban development, and natural environments influence biodiversity across multiple cities.","Match, by alias","Colorado State University-Fort Collins","CO",126818,"Fort Collins","R1 Doctoral Universities: Very High Research Activity","Balanced arts & sciences/professions, high graduate coexistence","Research Doctoral: Comprehensive programs, with medical/veterinary school","Four-year, full-time, selective, lower transfer-in","High undergraduate","Four-year, large, primarily residential","Classified","Rocky Mountains CO ID MT UT WY","Public, 4-year or above","Four or more years","Public",1,"City Midsize","Yes","Yes","No","No",NA,"No","No","No","No","No",0,5578,1767,256,144,0,7745,384044,23258,477,1245,23,1,192,40,216,40,1102,809,2614,2964,0,0,33426,37806,32428,26057.333333,24792,7636,19633,3699,311,1149,2928,4708,4190,265,971,253,NA,NA,28,52,NA,1078,0.139187,67,123,49,0.731343,"Conferred research/scholarship doctoral degrees",0,0,1,25,16,8697,3635,1722,540,530,1070,23,21,21.642897,28843,24091,0.835246,2
"10/13/24 9:28","Oklahoma State University","Oklahoma","Animal Behavior, Morphological Evolution","Zachary Emberts","11/1/2024","https://apply.interfolio.com/157125","","","Match, by alias","Oklahoma State University-Main Campus","OK",207388,"Stillwater","R1 Doctoral Universities: Very High Research Activity","Professions plus arts & sciences, high graduate coexistence","Research Doctoral: Comprehensive programs, with medical/veterinary school","Four-year, full-time, selective, higher transfer-in","High undergraduate","Four-year, large, primarily residential","Classified","Southwest AZ NM OK TX","Public, 4-year or above","Four or more years","Public",1,"Town Distant","Yes","Yes","No","No",NA,"No","No","No","No","No",0,4836,930,224,88,0,6078,153586,33474,126,886,19,8,98,99,125,99,468,550,1315,3521,9,0,24079,26463,24535,21021,20323,4212,17605,2177,19,522,1640,2572,3809,345,1104,242,NA,NA,28,52,NA,1486,0.244488,75,111,49,0.653333,"Conferred research/scholarship doctoral degrees",0,0,1,24,16,6286,1356,3625,510,510,1020,21,20,20.727766,17164,11515,0.670881,2
"10/12/24 16:08","Harvard University","Massachusetts","Insect flight-to-light behavior, ecology and evolution","Avalon Owens","11/15/2024","https://academicpositions.harvard.edu/postings/14240","10/17/24 6:49","Position broadly focused on the ecological costs and evolutionary consequences of insect flight-to-light behavior. Learn more about the Rowland Institute at Harvard: https://www.rowland.harvard.edu/","Match, exact","Harvard University","MA",166027,"Cambridge","R1 Doctoral Universities: Very High Research Activity","Arts & sciences focus, high graduate coexistence","Research Doctoral: Comprehensive programs, with medical/veterinary school","Four-year, full-time, more selective, lower transfer-in","Majority graduate","Four-year, large, highly residential","Not Classified","New England CT ME MA NH RI VT","Private not-for-profit, 4-year or above","Four or more years","Private not-for-profit",1,"City Midsize","No","Yes","No","No",NA,"No","No","No","No","No",2,1943,4949,681,783,0,8358,1116344,123639,7147,1627,85,100,350,146,535,146,1468,4264,1836,107,0,2,31655,41024,30391,22817,8527,21864,5503,596,196,2232,13331,8533,1404,0,13,0,NA,NA,26,52,NA,1446,0.173008,37,174,32,0.864865,"Conferred research/scholarship doctoral degrees",0,0,1,24,22,13694,1007,634,720,740,1460,33,32,32.38635,40248,2015,0.050065,3
"10/12/24 9:13","The Wilderness Society","Montana","Conservation, carbon emissions","","11/17/2024","https://thewildernesssoc.careers.hibob.com/jobs/3043e024-e09b-4023-99ad-20ed94dc9b54?fbclid=IwY2xjawF3TG5leHRuA2FlbQIxMQABHULUkxpYT7-5Alnhux5obD69sUuC6CCnRU1LrPKq4t2yP_TGLB2g1wpNmg_aem_oeWPV8dHc9TyzMg8myMWNg","","","Unmatched",NA,NA,NA,NA,NA,NA,NA,NA,NA,NA,NA,NA,NA,NA,NA,NA,NA,NA,NA,NA,NA,NA,NA,NA,NA,NA,NA,NA,NA,NA,NA,NA,NA,NA,NA,NA,NA,NA,NA,NA,NA,NA,NA,NA,NA,NA,NA,NA,NA,NA,NA,NA,NA,NA,NA,NA,NA,NA,NA,NA,NA,NA,NA,NA,NA,NA,NA,NA,NA,NA,NA,NA,NA,NA,NA,NA,NA,NA,NA,NA,NA,NA,NA,NA,NA,NA,NA,NA,NA,NA,NA,NA,NA,NA,NA,NA
"10/10/24 11:20","U.S. Department of Agriculture","District of Columbia","Systematic entomology","Michael Gates","","https://www.zintellect.com/Opportunity/Details/USDA-ARS-NEA-2024-0240A","11/14/24 1:54","The position has been filled.","Unmatched",NA,NA,NA,NA,NA,NA,NA,NA,NA,NA,NA,NA,NA,NA,NA,NA,NA,NA,NA,NA,NA,NA,NA,NA,NA,NA,NA,NA,NA,NA,NA,NA,NA,NA,NA,NA,NA,NA,NA,NA,NA,NA,NA,NA,NA,NA,NA,NA,NA,NA,NA,NA,NA,NA,NA,NA,NA,NA,NA,NA,NA,NA,NA,NA,NA,NA,NA,NA,NA,NA,NA,NA,NA,NA,NA,NA,NA,NA,NA,NA,NA,NA,NA,NA,NA,NA,NA,NA,NA,NA,NA,NA,NA,NA,NA,NA
"10/10/24 9:54","State University of New York at Geneseo","New York","Deep-Sea Biology","Mackenzie Gerringer","10/10/2024","https://www.geneseo.edu/sites/default/files/documents/PostDoc.Oct2024.Gerringer%20Lab.pdf","10/10/24 9:55","Update from previous posting - position is open until filled.","Match, by alias","SUNY College at Geneseo","NY",196167,"Geneseo","Master's Colleges & Universities: Small Programs","Arts & sciences plus professions, some graduate coexistence","Postbaccalaureate: Education-dominant, with other professional programs","Four-year, full-time, more selective, lower transfer-in","Very high undergraduate","Four-year, medium, highly residential","Classified","Mid East DE DC MD NJ NY PA","Public, 4-year or above","Four or more years","Public",1,"Town Distant","No","No","No","No",NA,"No","No","Yes","No","No",0,1280,59,0,0,0,1339,NA,NA,NA,NA,NA,NA,NA,NA,0,0,0,59,991,289,0,0,5398,5724,4911,4753.666667,4829,82,4627,193,0,9,48,34,885,6,167,7,NA,NA,14,45,NA,232,0.173264,30,2,2,0.066667,"Did not confer research/scholarship doctoral degrees",1,0,0,2,0,4471,789,195,570,570,1140,24,23,23.198171,10250,6289,0.613561,3
"10/10/24 6:56","Notre Dame","Indiana","Behavior/Stress Responses/Heart rate in wild baboons","Elizabeth Archie","11/15/2024","https://docs.google.com/document/d/1stDVDMEwD9tniY7EGT7zdPiHkOZGHuBFn12JXfxOSMw/edit?usp=sharing","10/10/24 6:59","PI is very happy to answer any questions. Contact earchie@nd.edu for inquiries.","Unmatched",NA,NA,NA,NA,NA,NA,NA,NA,NA,NA,NA,NA,NA,NA,NA,NA,NA,NA,NA,NA,NA,NA,NA,NA,NA,NA,NA,NA,NA,NA,NA,NA,NA,NA,NA,NA,NA,NA,NA,NA,NA,NA,NA,NA,NA,NA,NA,NA,NA,NA,NA,NA,NA,NA,NA,NA,NA,NA,NA,NA,NA,NA,NA,NA,NA,NA,NA,NA,NA,NA,NA,NA,NA,NA,NA,NA,NA,NA,NA,NA,NA,NA,NA,NA,NA,NA,NA,NA,NA,NA,NA,NA,NA,NA,NA,NA
"10/10/24 2:25","Türkiye Koç University or Sakarya University","Asia (Other)","Molecular Ecology, Wolf-dogs hybridization, the applicant need to know wet lab procedures to bioinformatic analysis","Morteza Naderi mnaderi@ku.edu.tr","12/31/2024","For further information please contact project PI mnaderi@ku.edu.tr","10/10/24 2:27","For more information about the project, please contact the PI at mnaderi@ku.edu.tr the project is about Wolf-dog hybridization using non-invasive approaches","International",NA,NA,NA,NA,NA,NA,NA,NA,NA,NA,NA,NA,NA,NA,NA,NA,NA,NA,NA,NA,NA,NA,NA,NA,NA,NA,NA,NA,NA,NA,NA,NA,NA,NA,NA,NA,NA,NA,NA,NA,NA,NA,NA,NA,NA,NA,NA,NA,NA,NA,NA,NA,NA,NA,NA,NA,NA,NA,NA,NA,NA,NA,NA,NA,NA,NA,NA,NA,NA,NA,NA,NA,NA,NA,NA,NA,NA,NA,NA,NA,NA,NA,NA,NA,NA,NA,NA,NA,NA,NA,NA,NA,NA,NA,NA,NA
"10/9/24 13:28","University of North Carolina Wilmington","North Carolina","Marine Sciences","Dr. Bradley Tolar","11/6/2024","https://jobs.uncw.edu/postings/33807","10/10/24 2:26","","Match, exact","University of North Carolina Wilmington","NC",199218,"Wilmington","R2 Doctoral Universities: High Research Activity","Balanced arts & sciences/professions, some graduate coexistence","Research Doctoral: Professional-dominant","Four-year, full-time, more selective, higher transfer-in","High undergraduate","Four-year, large, primarily residential","Classified","Southeast AL AR FL GA KY LA MS NC SC TN VA WV","Public, 4-year or above","Four or more years","Public",1,"City Midsize","No","No","No","No",NA,"No","No","No","No","Yes",0,3936,883,24,14,0,4857,15005,1539,7,568,0,0,2,22,2,22,206,691,1575,2361,0,0,17499,20367,17915,14789,14650,3265,11881,2445,108,216,1237,2028,2019,6,1342,611,NA,NA,20,51,NA,1108,0.228124,42,35,19,0.452381,"Conferred research/scholarship doctoral degrees",1,0,0,16,2,4788,825,1241,590,570,1160,23,24,23.399322,13633,9266,0.679674,3
"10/8/24 7:06","Yale University","Connecticut","plant evolutionary biology","Erika Edwards","11/1/2024","https://evol.mcmaster.ca/brian/evoldir/PostDocs//YaleU.PlantPhylogenetics","","","Match, exact","Yale University","CT",130794,"New Haven","R1 Doctoral Universities: Very High Research Activity","Arts & sciences focus, high graduate coexistence","Research Doctoral: Comprehensive programs, with medical/veterinary school","Four-year, full-time, more selective, lower transfer-in","Majority graduate","Four-year, large, highly residential","Not Classified","New England CT ME MA NH RI VT","Private not-for-profit, 4-year or above","Four or more years","Private not-for-profit",1,"City Midsize","No","Yes","No","No",NA,"No","No","No","No","No",0,1661,2525,433,316,7,4942,1079696,14439,1223,2272,61,109,231,32,401,32,1408,1440,1506,155,0,0,13609,14910,12060,11956.666667,4703,7357,4696,5,0,2,7209,148,1264,0,14,0,NA,NA,21,45,NA,647,0.130919,47,148,38,0.808511,"Conferred research/scholarship doctoral degrees",0,0,1,21,20,5576,891,583,720,740,1460,33,32,32.395522,35220,2299,0.065275,3
"10/8/24 3:06","Imperial College London","United Kingdom","plant-fungal ecology","Bonnie Waring","11/8/2024","https://www.imperial.ac.uk/jobs/search-jobs/description/index.php?jobId=21180&jobTitle=Research+Associate+in+Plant-Fungal+Ecology","","","International",NA,NA,NA,NA,NA,NA,NA,NA,NA,NA,NA,NA,NA,NA,NA,NA,NA,NA,NA,NA,NA,NA,NA,NA,NA,NA,NA,NA,NA,NA,NA,NA,NA,NA,NA,NA,NA,NA,NA,NA,NA,NA,NA,NA,NA,NA,NA,NA,NA,NA,NA,NA,NA,NA,NA,NA,NA,NA,NA,NA,NA,NA,NA,NA,NA,NA,NA,NA,NA,NA,NA,NA,NA,NA,NA,NA,NA,NA,NA,NA,NA,NA,NA,NA,NA,NA,NA,NA,NA,NA,NA,NA,NA,NA,NA,NA
